Boat Crew Sees Birth of a New Island in South Pacific-Truth! & Outdated!			https://www.truthorfiction.com/boat-crew-sees-birth-new-island-south-pacific/
Solar Farm Banned Over Fear It’ll Suck Up the Sun’s Energy-Mostly Fiction!			https://www.truthorfiction.com/solar-farm-banned-over-fear-itll-suck-up-the-suns-energy/
NASA Finds Antarctica is Gaining Ice, Not Losing Ice-Truth!			https://www.truthorfiction.com/nasa-finds-antarctica-is-gaining-ice-not-losing-ice/
Two Oceans Meet But Do Not Mix in the Gulf of Alaska-Fiction!			https://www.truthorfiction.com/two-oceans-meet-but-do-not-mix-in-the-gulf-of-alaska/
Photos Show the Beautiful “Fly Geyser” in Gerlach, Nevada-Truth!			https://www.truthorfiction.com/photos-show-the-beautiful-fly-geyser-in-gerlach-nevada/
Collecting Rainwater is Illegal in Some States-Truth! & Fiction!			https://www.truthorfiction.com/collecting-rainwater-is-illegal-in-some-states/
Blood Red Waters in Brazil a Sign of Apocalypse-Fiction!			https://www.truthorfiction.com/blood-red-waters-in-brazil-a-sign-of-apocalypse/
Newspaper Article from 1922 Discusses Arctic Ocean Climate Change-Truth!			https://www.truthorfiction.com/newspaper-article-from-1922-discusses-arctic-ocean-climate-change/
