After a Schoolteacher Called Thomas Edison “Addled,” His Heroic Mother Stepped In-Mostly Fiction!			https://www.truthorfiction.com/after-a-schoolteacher-called-thomas-edison-addled-his-heroic-mother-stepped-in/
Boy Sang Gospel Song Until Kidnapper Released Him-Truth!			https://www.truthorfiction.com/willie-myrick/
The Cross in the Flag-Truth!			https://www.truthorfiction.com/cross-flag/
Iraqi statue honoring American soldiers-Truth!			https://www.truthorfiction.com/kalat/
Butch and Eddie O’Hare-Truth!			https://www.truthorfiction.com/butchandeddie/
Canadian Gordon Sinclair’s commentary on America-Truth!			https://www.truthorfiction.com/gordonsinclair/
Air Force General Richard Hawley’s comments on the Attack on America-Fiction!			https://www.truthorfiction.com/hawley/
Diane…protected from rape by two angels-Source Not Found!			https://www.truthorfiction.com/diane/
Winston Churchill’s life saved by a doctor whom Churchill’s father put through school-Fiction!			https://www.truthorfiction.com/churchill/
Atheist in a university classroom is upstaged by a piece of chalk-Fiction!			https://www.truthorfiction.com/chalk/
Bill Gates’ high school speech on The Eleven Rules of Life-Fiction!			https://www.truthorfiction.com/billgatesspeech/
Ant and contact lens-an inspirational rock-climbing story-Unproven!			https://www.truthorfiction.com/antandcontactlens/
The film “The Man Without A Face” is about actor Mel Gibson-Fiction!			https://www.truthorfiction.com/manwithnoface/
The Story of Mark Eklund, the former Catholic school student killed inVietnam-Truth!			https://www.truthorfiction.com/markeklund/
The Cab Driver who was kind to a terminally ill passenger-Unproven!			https://www.truthorfiction.com/cabbie/
Woman who preached to Alaska Airlines passengers on doomed flight-Fiction!			https://www.truthorfiction.com/alaskaflight261/
The 9/11 story of Robert Matthews-Fiction!			https://www.truthorfiction.com/jakematthews/
Picture of a Surgeon Holding Hands With a 21-week Old Fetus-Truth! &  Disputed!			https://www.truthorfiction.com/babysamuel/
The German ship that honored Americans over losses to terrorists-Truth!			https://www.truthorfiction.com/usswinstonchurchill/
Holocaust Memorial made of paper clips-Truth!			https://www.truthorfiction.com/studentmemorial/
Support the Wounded Veterans at Walter Reed-Fiction!			https://www.truthorfiction.com/support-the-troops/
Mitt Romney Set Up A Command Center To Help Find Partner’s Missing Daughter-Truth!			https://www.truthorfiction.com/romney-nyc-missing-teen/
The Generous Gift of a Glass of Milk that Ended up Paying for Medical Care-Truth!			https://www.truthorfiction.com/oneglassofmilk/
Marines Helped Evacuate Children From Pentagon Day Care on 9/11-Fiction!			https://www.truthorfiction.com/pentagon-daycare-evac/
Actress Jane Fonda has become a born-again Christian-Truth!			https://www.truthorfiction.com/janefonda/
The hospitality of Gander, Newfoundland to stranded airline passengers on September 11-Truth!			https://www.truthorfiction.com/deltaflight15/
General Mills issues apology for a CD-ROM in cereal boxes that includes the Bible-Truth!			https://www.truthorfiction.com/cheerios/
The Fall of Fortresses by Elmer Bendiner, and a Note Found in a Dud Shell -Truth!&  Fiction!			https://www.truthorfiction.com/fall-of-fortresses-bendiner/
Photo of President George W. Bush Dancing With Wounded Warrior-Truth! But Inaccurate Details!			https://www.truthorfiction.com/gwbush-dance-warrior/
The weight of a prayer-Unproven!			https://www.truthorfiction.com/weightofaprayer/
An Article on “What is an American” -Truth!			https://www.truthorfiction.com/whatisanamerican/
His Eye is On the Sparrow at Starbucks-Truth!			https://www.truthorfiction.com/starbuckssparrow/
Stop To Salute-a Memorial Day Tribute written by a U.S. ArmyCaptain-Truth!			https://www.truthorfiction.com/stoptosalute/
Encounter with the president in Iraq-Truth!			https://www.truthorfiction.com/surprisevisit/
Courage at the Tomb of the Unknowns during Hurricane Isabel-Truth!			https://www.truthorfiction.com/tombofunknowns/
The classic gospel song “Precious Lord” was written by bandleader Tommy Dorsey-Fiction!			https://www.truthorfiction.com/tommydorsey/
The tooth that saved a soldier’s life-Truth!			https://www.truthorfiction.com/toothmiracle/
The returning Marine from Afghanistan who warmed the hearts of a real estate staff-Truth!			https://www.truthorfiction.com/returningmarine/
The Story of the Sandpiper-Unclear!			https://www.truthorfiction.com/sandpiper/
Miracle Sand Storm in Iraq – Unproven!			https://www.truthorfiction.com/sandstorm-mines/
Inspirational sand sculptures in Maryland-Truth!			https://www.truthorfiction.com/sculptures/
A sign from God after hurricane Charlie-Truth!			https://www.truthorfiction.com/signfromgod/
The power of a smile and unconditional acceptance at McDonald’s-Unproven!			https://www.truthorfiction.com/smiles/
“Eternity” the story of the homeless man in Sydney, Australiawho went down in history-Truth!			https://www.truthorfiction.com/stace/
“If I Were the Devil” by Paul Harvey-Truth!			https://www.truthorfiction.com/paulharveycommentary/
Outback Steakhouses serve dinner with all the trimmings to troops inAfghanistan-Truth!			https://www.truthorfiction.com/outback-kandahar/
The Boy Who Played Chopsticks for the Great Paderewski-Fiction!			https://www.truthorfiction.com/paderewski/
Letter from heaven?-Fiction!			https://www.truthorfiction.com/notefromheaven/
President Bush fulled a promise to jog with a wounded vet-Truth!			https://www.truthorfiction.com/mikemcnaughton/
The Russian Boy and the Babe in the Manger-Unproven!			https://www.truthorfiction.com/misha/
Little African girl saved from pursuers by lions-Disputed!			https://www.truthorfiction.com/lionsave/
Marines applauded by passengers on delayed flight-Unproven!			https://www.truthorfiction.com/marineapplause/
Graduating student sneezes so fellow students can say God Bless you-Truth!			https://www.truthorfiction.com/graduationsneeze/
The baby hippo and the tortoise who became friends after the tsunami-Truth!			https://www.truthorfiction.com/hippo-tort/
The football player to performed for his blind father-Unproven!			https://www.truthorfiction.com/eyesthatsee/
Wisdom from the Dalai Lama-Fiction!			https://www.truthorfiction.com/dali/
The Little Boy Who Wanted to Buy a Doll For His Sister inHeaven-Unproven!			https://www.truthorfiction.com/doll/
The Day that pilots from Coca-Cola and the Navy’s Blue Angels saved a little girl’s life-Fiction!			https://www.truthorfiction.com/blueangels/
Six Brave Soldiers-Truth!			https://www.truthorfiction.com/bravesoldiers/
White House help with rescuing a small boy and paying for hisfuneral?-Truth! & Fiction!			https://www.truthorfiction.com/bush-funeral/
The President and a soldier whose hand was amputated-Mostly Truth!			https://www.truthorfiction.com/bush-tilley/
Prayer Request From President Bush in China-Truth!			https://www.truthorfiction.com/bushprayerreq/
Ben Stein’s Last Column-Truth!			https://www.truthorfiction.com/benstein/
Angels hang out at the Big Wheel truck stop-Unproven!			https://www.truthorfiction.com/bigwheel/
The faith of Atlanta hostage Ashley Smith-Truth!			https://www.truthorfiction.com/ashley-smith/
On the First Anniversary of 9/11, drive with headlights shining-GrassRoots Effort!			https://www.truthorfiction.com/attackanniversary/
The new September 11 postage stamp-Fiction!			https://www.truthorfiction.com/9-11stamp/
Florida mother who saved her son from an alligator-Fiction!			https://www.truthorfiction.com/alligator/
Christmas Wreaths At Arlington Cemetery-Truth!			https://www.truthorfiction.com/wreaths/
The Private Train That Took Wounded Vets to the Army Navy Game in2005-Truth!			https://www.truthorfiction.com/vet-train/
Veterans carry school desks into history class-Truth!			https://www.truthorfiction.com/school-desks/
Diary of a Marine’s final flight home-Truth!			https://www.truthorfiction.com/last-flight/
Don Knotts Was a Chicken Plucker Called Jesse-Truth! & Unproven!			https://www.truthorfiction.com/don-knotts-chicken-plucker/
The Easter story of Edith Burns-Fiction!			https://www.truthorfiction.com/edith-burns/
Two Egyptian Children Buried for 15 Days Say Jesus Saved TheirLives-Unproven!			https://www.truthorfiction.com/egyptian-miracle/
Yorkshire Stammering Student Video on YouTube-Truth!			https://www.truthorfiction.com/yorkshire-musharaf-reading/
Herman Rosenblat and “The Girl with the Apple”-Fiction!			https://www.truthorfiction.com/rosenblat/
Teddy Stoddard			https://www.truthorfiction.com/teddy/
Stuart (or Russ) Hamblen, Billy Graham, John Wayne, and Hamblen’s Song It Is No Secret-Mostly Truth!			https://www.truthorfiction.com/stuarthamblin/
The smell of rain, an inspirational story about a premature baby-Truth!			https://www.truthorfiction.com/smellofrain/
The Man Who Thanked the Sea Gulls-Eddie Rickenbacker-Truth! But Inaccurate Details!			https://www.truthorfiction.com/rickenbacker/
“Rudolph the Red Nosed Reindeer” Was Written To Comfort a Grieving Daughter -Fiction!			https://www.truthorfiction.com/rudolph/
The missionary son who found redemption in Timbuktu-Truth!			https://www.truthorfiction.com/saint/
“The Christmas Miracle” of Santa and Sarah-Truth!			https://www.truthorfiction.com/santa-sarah/
Price of a miracle-the little girl who needed surgery-Unproven!			https://www.truthorfiction.com/priceofamiracle/
The Inspiration for Albrecht Dürer’s Famous Artwork “The Praying Hands”-Fiction!			https://www.truthorfiction.com/praying-hands/
Photo of New York Police Officer Giving Boots to a Homeless Man-Truth!			https://www.truthorfiction.com/nypd-boots/
The moving military funeral of Navy SEAL Mike Monsoor-Truth!			https://www.truthorfiction.com/moonsor/
John McCain Just Got Baptized-Fiction!			https://www.truthorfiction.com/mccainbaptized/
Stanford Commencement Speech by Steve Jobs-Confirmed Authorship!			https://www.truthorfiction.com/steve-jobs-commencement-stanford/
Heather Levia Said She was Fired From McDonalds After Buying Meals for Firefighters-Truth!			https://www.truthorfiction.com/heather-levia-mcdonalds/
Woman Without Arms Flies Airplanes With Her Feet-Truth!			https://www.truthorfiction.com/jessica-cox/
John Wayne conversion to Christianity through the daughter of Dr. Robert Schuller-Fiction!			https://www.truthorfiction.com/johnwayne-schuller/
The Story of Kareem Abdul-Jabbar and the Rabbi-Truth! & Fiction!			https://www.truthorfiction.com/kareem-abdul-jabbar/
The Amazing Story and Performance of a Contestant in a Korean Talent Program-Truth!			https://www.truthorfiction.com/korea-got-talent/
Actor Lee Marvin gives tribute to fellow Marine Bob Keeshan-Fiction!			https://www.truthorfiction.com/keeshan/
The Story of Kyle, saved from suicide by a friend-Fiction!			https://www.truthorfiction.com/kyle/
Soldiers in a movie theater in Iraq finish an interrupted National Anthem-Truth!			https://www.truthorfiction.com/iraq-anthem/
Irena Sendler, a woman who saved the lives of 2,500 Jewish Children during WW II-Truth!			https://www.truthorfiction.com/irena-sendler/
An Account Of A Ceremony That Takes Place Every Friday At The Pentagon-Truth!			https://www.truthorfiction.com/galloway-pentagon/
Picture of American soldier comforting a wounded little girl in Iraq-Truth!			https://www.truthorfiction.com/gebhardt/
The Account of Former Navy Seal Christopher Hebon-Truth!			https://www.truthorfiction.com/chris-hebon/
The Four Finger Pianist-Truth!			https://www.truthorfiction.com/hee-ah-lee/
Stray Dog Rescues Abandoned Baby-Truth!			https://www.truthorfiction.com/dog-rescues-baby/
The “crabby old man” who died with an inspirational poem in hispocket-Fiction!			https://www.truthorfiction.com/crabby-old-man/
The story of Christian the Lion-Truth!			https://www.truthorfiction.com/christian-the-lion/
Chick-Fil-A Fed Stranded Motorists in Snowstorm-Truth!			https://www.truthorfiction.com/chick-fil-a-fed-stranded-motoris/
Chilean Miners Wore T-Shirts That Said “¡Gracias Señor! – Thank You Lord!” During the Rescue Operation-Truth!			https://www.truthorfiction.com/chile-miners/
The Blue Ribbon that Saved a Teen’s Life-Reported to be Truth!			https://www.truthorfiction.com/blue-ribbon/
The Incredible Story of the Protection of the Bulgarian Jews-MostlyTruth!			https://www.truthorfiction.com/bulgaria/
Bald eagles change their lives at 40-Fiction!			https://www.truthorfiction.com/baldeagle/
Teen Escapes Death After Hospital Video Captures Images of What the Family Believes Was an Angel-Truth!			https://www.truthorfiction.com/angel-chelsea/
The story behind the military song “taps”-Fiction!			https://www.truthorfiction.com/taps/
The hardship of the signers of The Declaration Of Independence-Truth! and Fiction!			https://www.truthorfiction.com/patriots/
Leonardo used the same man for Jesus and Judas in the last supper painting-Fiction!			https://www.truthorfiction.com/lastsupper/
George W. Bush spent 30 minutes talking with a teen about God at a banquet-Fiction!			https://www.truthorfiction.com/evangelistbush/
Daisy the dog that saved nearly 1,000 people on 9/11-Fiction!			https://www.truthorfiction.com/daisy/
Logan, the young boy who is older than his years-Truth!			https://www.truthorfiction.com/logan/
Touching Article about Coach John Wooden-Truth!			https://www.truthorfiction.com/johnwooden/
The whale that thanked its rescuers-Reported to be Truth!			https://www.truthorfiction.com/grateful-whale/
Theologian Paul Tillich upstaged by a simple preacher-Fiction!			https://www.truthorfiction.com/tillich/
26 Armed Guards protecting a missionary-Unproven!			https://www.truthorfiction.com/twentysixarmedguards/
Mother Bird Saved Chicks in Yellowstone Fire-Fiction			https://www.truthorfiction.com/motherbird/
Tennessee high school principal’s remarks about prayer at a football game-Truth!			https://www.truthorfiction.com/jodymccloud/
The preacher’s prayer that stirred the Kansas legislature-Truth!			https://www.truthorfiction.com/kansasprayer/
Ann-Margret’s tribute to American Vets-Truth!			https://www.truthorfiction.com/annmargret/
Mysterious woman on the road-Fiction!			https://www.truthorfiction.com/womanontheroad/
Inspirational story, “The Tablecloth”-Unproven!			https://www.truthorfiction.com/tablecloth/
The POW confronts anti-war protestors in Moscow, Idaho-Fiction!			https://www.truthorfiction.com/pow-idaho/
The Romanian Newspaper editorial celebrating America-Truth!			https://www.truthorfiction.com/odetoamerica/
Stranded motorist who turned out to be Mrs. Nat King Cole-Fiction!			https://www.truthorfiction.com/mrs-nat-king-cole/
John McCain’s POW story about the pledge of allegiance-Truth!			https://www.truthorfiction.com/mccain-flag/
The Littlest Firefighter, the boy with cancer and the firefighters who loved him-Truth!			https://www.truthorfiction.com/littlestfirefighter/
The love story of Kurt Warner and his wife Brenda-Truth! and Fiction!			https://www.truthorfiction.com/kurtwarner/
The story of Tommy, the atheist theology student who was found byGod-Truth!			https://www.truthorfiction.com/johnpowell/
The man who got involved…and saved his daughter’s life- Unproven!			https://www.truthorfiction.com/involved/
A dying baby, a hot water bottle, a child’s prayer, and a children’s doll-Truth!			https://www.truthorfiction.com/hotwaterbottle/
Inspirational story titled “The Room”-Fiction!			https://www.truthorfiction.com/theroom/
The Rejection that led to the founding of Stanford University-Fiction!			https://www.truthorfiction.com/stanford/
Robby, the boy who played the piano for his deaf motherFiction!			https://www.truthorfiction.com/robby/
Who packs your parachute?-Truth!			https://www.truthorfiction.com/parachute/
The sailor who gave up his son’s life to save his son’s friend-Fiction!			https://www.truthorfiction.com/mysonsfriend/
“God’s perfection,” the story of a disabled boy and baseball-Truth!			https://www.truthorfiction.com/godsperfection/
The little girl who died and left 57 cents to build a biggerchurch-Truth! & Fiction!			https://www.truthorfiction.com/hattiemaywiatt/
Send greeting or business cards to cancer victim Craig Shergold-Fiction!			https://www.truthorfiction.com/craigshergold/
Poem about a car crash and the miraculous survival of twin boys-Fiction!			https://www.truthorfiction.com/crashpoem/
Congressional Testimony of Darrell Scott, father of one of the Columbine Shooting Victims-Truth!			https://www.truthorfiction.com/darrellscott/
Cassie Bernall Said “Yes” When Asked about her faith by a shooter at Columbine-Disputed!			https://www.truthorfiction.com/cassie/
The Little boy who was helped by “Birdies” while trapped beneath a garage door-Unproven!			https://www.truthorfiction.com/birdies/
The Miracle of a Brother’s Song-Truth!			https://www.truthorfiction.com/brotherssong/
The 9/11 flight attendant who found God before her fatal flight-Unproven!			https://www.truthorfiction.com/billfay/
The soldier’s Christmas poem			https://www.truthorfiction.com/soldierschristmas/
