Air Malaysia Pilot Resurfaces 2 Years After Flight MH370 Disappeared			https://www.truthorfiction.com/air-malaysia-pilot-resurfaces-2-years-after-flight-mh370-disappeared/
An “Amber Alert” about 9-year-old Nicholas Farber, Kidnapped From California-Truth! but Resolved!			https://www.truthorfiction.com/nicholas/
Four-year-old abducted in store, hair shaved, clothes changed-Fiction!			https://www.truthorfiction.com/codeadam/
Help Find Branson Perry of Skidmore, Missouri-Truth!			https://www.truthorfiction.com/branson/
Asha Degree, a ten-year-old is missing from North Carolina-Truth!			https://www.truthorfiction.com/asha/
Find little Christopher John Mineo Jr-Fiction!			https://www.truthorfiction.com/christopher/
Aaron Russell Steinmetz, missing in Florida-Once Truth! Now Resolved!			https://www.truthorfiction.com/aaronsteinmetz/
Help Find Little Madeleine McCann-Truth!			https://www.truthorfiction.com/madeleine/
Help find Erin from Cedar Rapids-Truth!			https://www.truthorfiction.com/erin/
Katelyn Marie Craven Missing-Truth! but Found!			https://www.truthorfiction.com/katelyn-marie-craven/
Help find Sabrina Fair Allen-Truth!			https://www.truthorfiction.com/sabrina/
Help Find Kathlee Hennigan			https://www.truthorfiction.com/hennigan/
Help find Evan Trembley a missing 15-year old			https://www.truthorfiction.com/evantrembley/
14 Year Old Devin Ward is Missing- Previously Truth! Now Resolved!!			https://www.truthorfiction.com/devin-ward/
Help Find Reachelle Marie Smith-Truth!			https://www.truthorfiction.com/reachelle/
Help Find Missing Teen Paulina Scedrinaite-Truth! but Found!			https://www.truthorfiction.com/paulina-scedrinaite-missing/
Amber Alert for Hailey Owens in Missouri–Previously Truth! Now Ended!			https://www.truthorfiction.com/amber-alert-hailey-owens/
Kelsey Brooke Jones, a missing little girl-Fiction!			https://www.truthorfiction.com/kelsey/
Forward an email to help Debbie Schwartz-Fiction!			https://www.truthorfiction.com/debbieschwartz/
Help Find Ashley Flores-Fiction!			https://www.truthorfiction.com/ashleyflores/
Amber Alert for Jewel Strong-Truth!			https://www.truthorfiction.com/amber-alert-jewel-strong/
Krystava Patients Schmidt, a missing girl-Truth! Now Resolved!			https://www.truthorfiction.com/krystava/
Appeal From Tracy Russell in Colorado to find her kids-Truth!			https://www.truthorfiction.com/tracyrussell/
Help find Penny Brown-Fiction!			https://www.truthorfiction.com/pennybrown/
5-year-old Jessica Koopmans is missing in Canada-Once Truth! Now Resolved!			https://www.truthorfiction.com/jessica/
Help find 7-year-old Danielle van Dam from San Diego-Truth! But now over!			https://www.truthorfiction.com/danielle/
Focus on Amber Alerts			https://www.truthorfiction.com/amberalerts/
