A General Mattis Christmas Story-Truth!			https://www.truthorfiction.com/general-mattis-christmas-story/			2016-12-05T09:06:53+00:00
Gold Star Family Booed by Passengers on Flight-Truth!			https://www.truthorfiction.com/gold-star-family-booed-passengers-flight/			2016-11-21T08:27:55+00:00
Navy to Name Ship After Harvey Milk-Truth!			https://www.truthorfiction.com/navy-name-ship-harvey-milk-truth/			2016-08-15T10:29:41+00:00
A Secretary Without Honor by Philip Jennings-Authorship Confirmed!			https://www.truthorfiction.com/secretary-without-honor-philip-jennings/			2016-07-20T11:29:29+00:00
Bad Angel Pilot Lt. Louis E. Curdes Shot Down His Girlfriend in WWII-Truth! & Fiction!			https://www.truthorfiction.com/bad-angel-pilot-lt-louis-e-curdes-shot-girlfriend-wwii/			2016-06-28T11:22:24+00:00
Joint Chief of Staff Resignation by Ray Starmann -Fiction!			https://www.truthorfiction.com/joint-chief-staff-resignation-ray-starmann/			2016-04-20T09:40:22+00:00
41 Senators Block Benefits for Veterans-Truth! & Outdated!			https://www.truthorfiction.com/41-senators-block-benefits-for-veterans-truth/			2015-11-23T13:49:47+00:00
Obama Pulls $2.6 Billion from Vets for Refugees-Fiction!			https://www.truthorfiction.com/obama-pulls-2-6-billion-from-vets-for-refugees/			2015-11-12T12:46:01+00:00
Major General Craig Olson Faces Court Martial for Thanking God-Previously Truth! Now Resolved!			https://www.truthorfiction.com/major-general-craig-olson-faces-court-martial-for-thanking-god/			2015-05-29T11:08:54+00:00
Troops Called Hillary Clinton’s Helicopter “Broomstick One”-Unproven!			https://www.truthorfiction.com/troops-called-hillary-clintons-helicopter-broomstick-one-2/			2015-05-06T22:32:12+00:00
Texas Governor Deploys State Guard to Stave Off Obama Takeover – Truth! & Fiction!			https://www.truthorfiction.com/texas-governor-deploys-state-guard-to-stave-off-obama-takeover/			2015-05-06T06:41:34+00:00
Coach K Criticizes President Obama’s Military Strategy-Truth! & Outdated!			https://www.truthorfiction.com/coach-k-criticizes-president-obamas-military-strategy/			2015-04-11T00:01:48+00:00
Marine Wrote “Battling Boys of Benghazi” Poem-Authorship Confirmed!			https://www.truthorfiction.com/marine-wrote-battling-boys-of-benghazi-poem/			2015-04-02T15:54:39+00:00
ACLU Sues Over Military Crosses at Santa Barbara Beach-Fiction!			https://www.truthorfiction.com/aclu-sues-over-military-crosses-at-santa-barbara-beach/			2015-04-01T09:34:41+00:00
Chaplain Says Officials Ordered Him To Cover Christian Symbols In VA Chapel-Truth!			https://www.truthorfiction.com/va-covers-religious-symbols/			2015-03-30T21:41:03+00:00
ISIS Released a “Kill List” of U.S. Armed Forces Members-Truth!			https://www.truthorfiction.com/isi-released-a-kill-list-of-us-armed-forces-members/			2015-03-29T17:29:32+00:00
Man Jumped From an Altitude of 102,800 Feet Back to Earth-Truth!			https://www.truthorfiction.com/kittenger-free-fall/			2015-03-28T21:40:55+00:00
Near disaster of the Air Force Thunderbirds-Fiction!			https://www.truthorfiction.com/tbirds/			2015-03-27T20:42:37+00:00
Pictures of the sound barrier-Disputed!			https://www.truthorfiction.com/soundbarrier/			2015-03-25T21:41:01+00:00
A New Navy Ship, the USS New York, is Partly Built With Steel From the Ruins of the World Trade Center-Truth!			https://www.truthorfiction.com/ussnewyork/			2015-03-24T18:06:33+00:00
FEMA Corps Team Members Are the Modern Day Hitler Youth-Fiction!			https://www.truthorfiction.com/fema-corps-hitler-youth/			2015-03-23T21:40:52+00:00
Jade Helm 15 Military Training Exercise Prep for Martial Law, World War III-Fiction!			https://www.truthorfiction.com/jade-helm-15-military-training-exercise-prep-for-martial-law-and-world-war-iii/			2015-03-20T18:52:37+00:00
Amateur Divers Find Long-Lost Nuclear Warhead-Fiction!			https://www.truthorfiction.com/amateur-divers-find-long-lost-nuclear-warhead/			2015-03-19T17:14:26+00:00
Baker Company photo tribute to 9-11-Truth!			https://www.truthorfiction.com/bakertributeto9-11/			2015-03-18T21:45:40+00:00
Iraqi statue honoring American soldiers-Truth!			https://www.truthorfiction.com/kalat/			2015-03-18T20:42:31+00:00
Mass Re-enlistment on July 4th-Truth!			https://www.truthorfiction.com/massreenlistment/			2015-03-18T18:06:26+00:00
Butch and Eddie O’Hare-Truth!			https://www.truthorfiction.com/butchandeddie/			2015-03-17T22:38:31+00:00
Picture of a great white shark attacking a soldier hanging from a helicopter-Fiction!			https://www.truthorfiction.com/shark-copter/			2015-03-17T22:02:13+00:00
The Pentagon was not struck by a hijacked jet on September 11-Fiction!			https://www.truthorfiction.com/pentagoncrash/			2015-03-17T22:02:12+00:00
Air Force General Richard Hawley’s comments on the Attack on America-Fiction!			https://www.truthorfiction.com/hawley/			2015-03-17T22:02:06+00:00
Soldier’s message in Iraq spelled out in flags-A Joke!			https://www.truthorfiction.com/flags/			2015-03-17T22:02:05+00:00
Actress Cindy Williams is against military pay raises-Fiction!			https://www.truthorfiction.com/cindywilliams/			2015-03-17T22:02:03+00:00
The Story of Mark Eklund, the former Catholic school student killed inVietnam-Truth!			https://www.truthorfiction.com/markeklund/			2015-03-17T21:58:02+00:00
John Kerry’s anti-war past-Truth! and Unproven!			https://www.truthorfiction.com/kerry/			2015-03-17T21:45:48+00:00
Gloomy report from a reporter in Baghdad-Truth!			https://www.truthorfiction.com/fassihi/			2015-03-17T21:45:45+00:00
America Wake Up-a speech on terrorism by a Navy Captain-Truth!			https://www.truthorfiction.com/america-wake-up/			2015-03-17T21:45:40+00:00
“Saucy Jack”-A letter from a Marine on the front lines in Afghanistan-Unproven!			https://www.truthorfiction.com/afghanfrontline/			2015-03-17T21:41:26+00:00
WWII Memorial revises history in Roosevelt quotation-Fiction!			https://www.truthorfiction.com/wwiimemorial/			2015-03-17T21:41:04+00:00
U.S. Marines Defending Embassy in Egypt Without Ammunition-Fiction!			https://www.truthorfiction.com/usmc-no-ammo/			2015-03-17T21:41:03+00:00
500 Tons of Uranium Yellowcake Moved From Iraq to Canada-Truth!			https://www.truthorfiction.com/uraniumyellowcake/			2015-03-17T21:41:03+00:00
Military Hiring Muslim Brotherhood Chaplains by Allen West-Authorship Confirmed			https://www.truthorfiction.com/military-hiring-muslim/			2015-03-17T21:41:03+00:00
Walter Reed Medical Center has Banned Religious Items-Truth! But Rescinded!			https://www.truthorfiction.com/walter-reed-bible-ban/			2015-03-17T21:41:03+00:00
The German ship that honored Americans over losses to terrorists-Truth!			https://www.truthorfiction.com/usswinstonchurchill/			2015-03-17T21:41:03+00:00
The School Teacher Who Thought it was World War Eleven-Unproven!			https://www.truthorfiction.com/theodore-van-kirk/			2015-03-17T21:41:03+00:00
Support the Wounded Veterans at Walter Reed-Fiction!			https://www.truthorfiction.com/support-the-troops/			2015-03-17T21:41:02+00:00
Reggie the Black Lab’s Adoption-Fiction!			https://www.truthorfiction.com/reggie-black-lab/			2015-03-17T21:41:00+00:00
Marines Helped Evacuate Children From Pentagon Day Care on 9/11-Fiction!			https://www.truthorfiction.com/pentagon-daycare-evac/			2015-03-17T21:40:59+00:00
President Obama Failed to Attend D-Day Ceremonies at Normandy-Fiction!			https://www.truthorfiction.com/obama-no-show-d-day/			2015-03-17T21:40:58+00:00
Navy Directive Bans Bibles from Hotel Rooms on Bases-Previously Truth! Now Ended!			https://www.truthorfiction.com/navy-removes-hotel-bibles/			2015-03-17T21:40:57+00:00
NBC Cuts Christ From Interview with the Widow of Fallen U.S. Navy Seal-Fiction!			https://www.truthorfiction.com/nbc-cuts-christ/			2015-03-17T21:40:57+00:00
Environmental fears over Navy sonar-Truth!			https://www.truthorfiction.com/navysonar/			2015-03-17T21:40:57+00:00
Pay Hike Policy Could Shut Down Burger King and Other Fast Food Franchises on Military Bases-Truth! But On Hold!			https://www.truthorfiction.com/military-base-burger-king/			2015-03-17T21:40:57+00:00
U.S.A.F. Veteran Brian Kolfage’s letter to President Obama-Confirmed Authorship!			https://www.truthorfiction.com/brian-kolfage/			2015-03-17T21:40:55+00:00
Jane Fonda’s supported the enemy in Vietnam got American POW’skilled-Truth! and Fiction!			https://www.truthorfiction.com/hanoijane/			2015-03-17T21:40:53+00:00
Department of Defense Procedures to Shut Up Civilians-Unproven!			https://www.truthorfiction.com/dod-interment-resettlement-ops/			2015-03-17T21:40:51+00:00
China Has a New Multi-Hulled Aircraft Carrier-Truth! & Fiction!			https://www.truthorfiction.com/china-new-aircraft-carrier/			2015-03-17T21:40:50+00:00
Army Dad Not Allowed to Visit Daughters School While in Uniform-Truth! Now Resolved!			https://www.truthorfiction.com/lt-col-baker-no-school-uniform/			2015-03-17T21:40:49+00:00
The Fall of Fortresses by Elmer Bendiner, and a Note Found in a Dud Shell -Truth!&  Fiction!			https://www.truthorfiction.com/fall-of-fortresses-bendiner/			2015-03-17T21:40:49+00:00
Photo of President George W. Bush Dancing With Wounded Warrior-Truth! But Inaccurate Details!			https://www.truthorfiction.com/gwbush-dance-warrior/			2015-03-17T21:40:49+00:00
Van T. Barfoot and Homeowners Association Dispute Over a Flagpole-Truth!			https://www.truthorfiction.com/barfoot/			2015-03-17T21:40:48+00:00
Comrades Allege Bergdahl Desertion-Truth!			https://www.truthorfiction.com/bowe-bergdahl/			2015-03-17T21:40:48+00:00
Poetic justice?  U.S. relocating military bases-Truth!			https://www.truthorfiction.com/vieques/			2015-03-17T20:42:38+00:00
The worth of a military family-Truth! & Fiction!			https://www.truthorfiction.com/worthofafamily/			2015-03-17T20:42:38+00:00
The tooth that saved a soldier’s life-Truth!			https://www.truthorfiction.com/toothmiracle/			2015-03-17T20:42:37+00:00
Carrier pictures of secret new stealth fighter?-Fiction!			https://www.truthorfiction.com/stealth/			2015-03-17T20:42:37+00:00
Stop To Salute-a Memorial Day Tribute written by a U.S. ArmyCaptain-Truth!			https://www.truthorfiction.com/stoptosalute/			2015-03-17T20:42:37+00:00
Encounter with the president in Iraq-Truth!			https://www.truthorfiction.com/surprisevisit/			2015-03-17T20:42:37+00:00
Courage at the Tomb of the Unknowns during Hurricane Isabel-Truth!			https://www.truthorfiction.com/tombofunknowns/			2015-03-17T20:42:37+00:00
Sears is Providing Financially for Employees Who are Reservists on ActiveDuty-Truth!			https://www.truthorfiction.com/sears/			2015-03-17T20:42:36+00:00
The returning Marine from Afghanistan who warmed the hearts of a real estate staff-Truth!			https://www.truthorfiction.com/returningmarine/			2015-03-17T20:42:36+00:00
Starbucks doesn’t support the war in Iraq-Fiction!			https://www.truthorfiction.com/starbucks-iraq/			2015-03-17T20:42:36+00:00
Good news from a soldier in Iraq-Truth!			https://www.truthorfiction.com/rydbom/			2015-03-17T20:42:36+00:00
Appeal for prayer for the Iraqi elections from an Army chaplain-Unproven!			https://www.truthorfiction.com/shackleford/			2015-03-17T20:42:36+00:00
Miracle Sand Storm in Iraq – Unproven!			https://www.truthorfiction.com/sandstorm-mines/			2015-03-17T20:42:36+00:00
Pictures of huge dust storm in Iraq-Truth!			https://www.truthorfiction.com/sandstorm/			2015-03-17T20:42:36+00:00
Veteran CNN Reporter Breaks Down On The Air After Being Touched by theQuality of American Soldiers-Unproven!			https://www.truthorfiction.com/savidge/			2015-03-17T20:42:36+00:00
Partial ejection from a Navy Jet-Truth!			https://www.truthorfiction.com/partialeject/			2015-03-17T20:42:35+00:00
President Clinton watched golf instead of giving a decision on a criticalattack against Iraq-Disputed!			https://www.truthorfiction.com/patterson/			2015-03-17T20:42:35+00:00
Good things in Iraq not being reported-Truth!, Fiction!, and Unproven!			https://www.truthorfiction.com/rayreynolds/			2015-03-17T20:42:35+00:00
The Real Deal-thoughts about terrorist warfare from a veteran-Truth!			https://www.truthorfiction.com/realdeal/			2015-03-17T20:42:35+00:00
Wear Red on Fridays-Grass Roots Movement			https://www.truthorfiction.com/redfridays/			2015-03-17T20:42:35+00:00
The amazing WW II “piggyback” B-17 mid-air collision-Truth!			https://www.truthorfiction.com/piggyback/			2015-03-17T20:42:35+00:00
Colin Powell-All We Want is Land to Bury our Dead-Truth!			https://www.truthorfiction.com/powell-empires/			2015-03-17T20:42:35+00:00
Fancy paint job on American helicopter in Afghanistan?-Fiction!			https://www.truthorfiction.com/mi-24/			2015-03-17T20:42:33+00:00
Accusations against John Kerry from Former Navy Swift Boat crewmen from the Vietnam War-Truth!, Fiction! & Disputed!			https://www.truthorfiction.com/kerry-swiftboats/			2015-03-17T20:42:32+00:00
Marines applauded by passengers on delayed flight-Unproven!			https://www.truthorfiction.com/marineapplause/			2015-03-17T20:42:32+00:00
Koran 9:11 refers to the war in iraq?-Fiction!			https://www.truthorfiction.com/koran-war/			2015-03-17T20:42:32+00:00
Confrontation between a French Army officer and a U.S. Marine inBosnia-Unproven!			https://www.truthorfiction.com/marineofficer/			2015-03-17T20:42:32+00:00
A List of Supplies that Marines Would Appreciate in Iraq-Truth!…But Not So Fast!			https://www.truthorfiction.com/marines-iraq/			2015-03-17T20:42:32+00:00
Millions of dollars of gold bars found in Iraq-Fiction!			https://www.truthorfiction.com/iraqigold/			2015-03-17T20:42:31+00:00
Donating miles to military personnel on furlough-Truth!			https://www.truthorfiction.com/heromiles/			2015-03-17T20:42:30+00:00
Hillary Clinton inconvenienced U.S. soldiers in Afghanistan-Unproven!			https://www.truthorfiction.com/hillary-afghanistan/			2015-03-17T20:42:30+00:00
Picture of a U.S. soldier shaking hands with Hillary Clinton but not happy about it-Truth!			https://www.truthorfiction.com/hillary-soldier/			2015-03-17T20:42:30+00:00
Special GI insurance dividend for veterans-Fiction!			https://www.truthorfiction.com/gi-insuracedividend/			2015-03-17T20:42:30+00:00
Jet fighters’ formation spells USA-Fiction!			https://www.truthorfiction.com/flyby/			2015-03-17T20:42:29+00:00
Jane Fonda and Ted Turner kicked out of Montana restaurant?-Fiction!			https://www.truthorfiction.com/fonda-restaurant/			2015-03-17T20:42:29+00:00
Advanced Russian fighters found in the sand in Iraq-Truth!			https://www.truthorfiction.com/foxbat/			2015-03-17T20:42:29+00:00
John Denver an Army Sniper? – Fiction!			https://www.truthorfiction.com/denver-sniper/			2015-03-17T20:42:28+00:00
Denzel Washington spontaneously paid for a new Fisher House at BrookeArmy Medical Center-Fiction! But he later came through!			https://www.truthorfiction.com/denzel-brooke/			2015-03-17T20:42:28+00:00
A military draft in 2005?-Fiction!			https://www.truthorfiction.com/draft/			2015-03-17T20:42:28+00:00
Pray for Chad, a soldier shot in the head in Iraq-Truth!			https://www.truthorfiction.com/chad-snowden/			2015-03-17T20:42:27+00:00
The heroic actions of Marine Lt. Brian Chontosh in Iraq-Truth!			https://www.truthorfiction.com/chontosh/			2015-03-17T20:42:27+00:00
The 9/11 widow who visited Iraq-Truth!			https://www.truthorfiction.com/christyferer/			2015-03-17T20:42:27+00:00
Anti War Activist Cindy Sheehan did not really rear her Army Soldierson-Fiction!			https://www.truthorfiction.com/cindy_sheehan/			2015-03-17T20:42:27+00:00
Good news from Baghdad-Unproven!			https://www.truthorfiction.com/beautifulbaghdad/			2015-03-17T20:42:26+00:00
The Day that pilots from Coca-Cola and the Navy’s Blue Angels saved a little girl’s life-Fiction!			https://www.truthorfiction.com/blueangels/			2015-03-17T20:42:26+00:00
“Freezing the balls off the brass monkey,” a Navy phrase about cannon balls-Fiction!			https://www.truthorfiction.com/brassmonkeys/			2015-03-17T20:42:26+00:00
Six Brave Soldiers-Truth!			https://www.truthorfiction.com/bravesoldiers/			2015-03-17T20:42:26+00:00
George W. Bush a deserter from the military?-Disputed!			https://www.truthorfiction.com/bush-desert/			2015-03-17T20:42:26+00:00
The President and a soldier whose hand was amputated-Mostly Truth!			https://www.truthorfiction.com/bush-tilley/			2015-03-17T20:42:26+00:00
Stories of respect from and for President Bush-Truth! & Fiction!			https://www.truthorfiction.com/bushrespect/			2015-03-17T20:42:26+00:00
Airline passengers who gave up their seats for U.S. Soldiers-Truth!			https://www.truthorfiction.com/baltimore/			2015-03-17T20:42:25+00:00
On the First Anniversary of 9/11, drive with headlights shining-GrassRoots Effort!			https://www.truthorfiction.com/attackanniversary/			2015-03-17T20:42:25+00:00
ACLU Opposition to Marines Praying-Fiction!			https://www.truthorfiction.com/aclu-marines/			2015-03-17T20:42:24+00:00
Christmas Wreaths At Arlington Cemetery-Truth!			https://www.truthorfiction.com/wreaths/			2015-03-17T20:40:01+00:00
Free cards to U.S. troops through Xerox?-Truth!			https://www.truthorfiction.com/xerox-cards-for-troops/			2015-03-17T20:40:01+00:00
Dr. Jack Wheeler on Seal Team Rescue of Captain Phillips-Confirmed Authorship!			https://www.truthorfiction.com/wheeler-pirates-seals/			2015-03-17T20:40:00+00:00
V.A. Hospital Refuses to Allow ‘Merry Christmas’ Cards-Fiction!			https://www.truthorfiction.com/va-christmas/			2015-03-17T20:39:59+00:00
Pres. Bush Comforts Fallen Soldier’s Family-Truth!			https://www.truthorfiction.com/value-of-service/			2015-03-17T20:39:59+00:00
The Private Train That Took Wounded Vets to the Army Navy Game in2005-Truth!			https://www.truthorfiction.com/vet-train/			2015-03-17T20:39:59+00:00
Soldier Takes Self Portrait in Car While Ditching Evening Colors-Truth!			https://www.truthorfiction.com/sheffey-selfie-flag/			2015-03-17T20:39:55+00:00
Veterans carry school desks into history class-Truth!			https://www.truthorfiction.com/school-desks/			2015-03-17T20:39:55+00:00
Harley-Davidson Dealer’s Special Thanks to Military Members-Truth!			https://www.truthorfiction.com/reimans-harley-davidson/			2015-03-17T20:39:54+00:00
The List of Military Endorsements for Mitt Romney-Truth!			https://www.truthorfiction.com/romney-military-endorsement/			2015-03-17T20:39:54+00:00
President Obama Snaps at Military Brass – Unproven!			https://www.truthorfiction.com/obama-snap/			2015-03-17T20:39:50+00:00
Photo of Mohammad Fazi with Severed Heads-Fiction!			https://www.truthorfiction.com/mohammad-fazi-photo/			2015-03-17T20:39:47+00:00
Some Motel 6 Will Only Rent Rooms To Those 21 and Over-Truth!			https://www.truthorfiction.com/motel-6-military/			2015-03-17T20:39:47+00:00
U.S. Marines in Inaugural Parade Ordered to Disarm-Pending Investigation!			https://www.truthorfiction.com/marines-parade-rifles/			2015-03-17T20:39:46+00:00
Diary of a Marine’s final flight home-Truth!			https://www.truthorfiction.com/last-flight/			2015-03-17T20:39:45+00:00
Prayer Request for David Kristynik in Iraq-Truth! But Inaccurate!			https://www.truthorfiction.com/lastpatrol/			2015-03-17T20:39:45+00:00
“Betrayal in Benghazi” by Colonel Phil Handley-Confirmed Authorship! but Altered!			https://www.truthorfiction.com/handley-commetary/			2015-03-17T20:39:41+00:00
Gideons Banned From Military Bases-Fiction!			https://www.truthorfiction.com/gideons-military-bases/			2015-03-17T20:39:40+00:00
Former Marine Arrested in Crack Down on Anti-Government Commenters -Truth! & Fiction!			https://www.truthorfiction.com/former-marine-arrested/			2015-03-17T20:39:39+00:00
General Carter Ham Fired for Ignoring Stand Down Order- Fiction!			https://www.truthorfiction.com/general-ham-fired/			2015-03-17T20:39:39+00:00
Russian Planes Zap USS Donald Cook’s Missile Defense System-Fiction!			https://www.truthorfiction.com/uss-donald-cook/			2015-03-17T20:39:35+00:00
Chinese Jets Sink Navy Aircraft Carrier-Fiction!			https://www.truthorfiction.com/chinese-jets-george-washington/			2015-03-17T20:39:34+00:00
President Bush Visited the Wounded After the Terrorist Attack at Ft. Hood-Truth!			https://www.truthorfiction.com/bush-fthood/			2015-03-17T20:39:32+00:00
Clinton may fly the Viet Nam flag higher than the U.S. Flag-Fiction!			https://www.truthorfiction.com/vietflag/			2015-03-17T18:06:33+00:00
Military Flyover at an Annual God and Country Rally Denied by the U. S. Air Force -Truth!			https://www.truthorfiction.com/usaf-flyover-nampa/			2015-03-17T18:06:33+00:00
West Point Report: Understanding America’s Violent Far-Right-Truth!			https://www.truthorfiction.com/west-point-far-right-report/			2015-03-17T18:06:33+00:00
Wounded Warriors Project Operational Expenses Outweighs Funds Given to Program Services-Fiction!			https://www.truthorfiction.com/wounded-warriors-project-financials2012/			2015-03-17T18:06:33+00:00
Weapons Arsenal Found Near the Arizona Border-Fiction!			https://www.truthorfiction.com/weapons-mexio-raid/			2015-03-17T18:06:33+00:00
Parents of Fallen SEAL Team 6 Officer Call for Obama’s Resignation–Authorship Confirmed!			https://www.truthorfiction.com/vaughn-letter/			2015-03-17T18:06:33+00:00
Veterans can lose their weapons permit if they answer yes to three questions in a medical exam-Fiction!			https://www.truthorfiction.com/va-test-permit/			2015-03-17T18:06:33+00:00
Veteran Rumble Email-Fiction!			https://www.truthorfiction.com/veteran-rumble/			2015-03-17T18:06:33+00:00
Vet’s Backlash Against President Obama-Grass Roots Movement!			https://www.truthorfiction.com/vets-backlash/			2015-03-17T18:06:33+00:00
Three US Navy Seals Charged With Assaulting an Accused Terrorist-Truth!			https://www.truthorfiction.com/three-seals-capture-terrorist/			2015-03-17T18:06:32+00:00
Holiday Mail for Heroes-Truth!			https://www.truthorfiction.com/troopsupport/			2015-03-17T18:06:32+00:00
Transportation Security Inspectors Tough On Military With Nail Clippers-Fiction!			https://www.truthorfiction.com/tsa-military-nail-clipper/			2015-03-17T18:06:32+00:00
Target Stores Won’t Fund Veterans Projects-Fiction!			https://www.truthorfiction.com/target-viet/			2015-03-17T18:06:32+00:00
Request for National Memorial for Darrell “Shifty” Powers-  Grass Roots Effort!			https://www.truthorfiction.com/shiftypowers/			2015-03-17T18:06:31+00:00
Shutdown Bars Priests from Celebrating Mass at Military Bases-Reported to be True!			https://www.truthorfiction.com/shutdown-no-mass-4-military-101013/			2015-03-17T18:06:31+00:00
ABC Reporter Favored GIs who Support Obama in Iraq-Fiction!			https://www.truthorfiction.com/raddatz/			2015-03-17T18:06:30+00:00
The Man Who Thanked the Sea Gulls-Eddie Rickenbacker-Truth! But Inaccurate Details!			https://www.truthorfiction.com/rickenbacker/			2015-03-17T18:06:30+00:00
Puppy death recorded in video in Iraq-Truth!			https://www.truthorfiction.com/puppy/			2015-03-17T18:06:30+00:00
Petition To Award Purple Hearts to Soldiers Wounded or Killed in the Fort Hood Attack-Grass Roots Movement!			https://www.truthorfiction.com/purple-heart-petition/			2015-03-17T18:06:30+00:00
Old Pictures From a Brownie Camera of the Attack on Pearl Harbor in 1941-Fiction!			https://www.truthorfiction.com/pearl-harbor-photos/			2015-03-17T18:06:29+00:00
Openly Gay Military Unit Created by the Pentagon-Fiction! & Satire!			https://www.truthorfiction.com/pentagon-gay-unit/			2015-03-17T18:06:29+00:00
Father of an Australian soldier thanks America-Unproven!			https://www.truthorfiction.com/peter-turner/			2015-03-17T18:06:29+00:00
Ping Donates Golf Equipment to Wounded Veterans-Truth!			https://www.truthorfiction.com/ping-wounded-warriors/			2015-03-17T18:06:29+00:00
“I’m Sorry” from Lt. Gen. Chuck Pitman-Fiction!			https://www.truthorfiction.com/pitman/			2015-03-17T18:06:29+00:00
Boycott Oscar Mayer for not supporting the troops-Fiction!			https://www.truthorfiction.com/oscar-mayer/			2015-03-17T18:06:29+00:00
Sarah Palin National Guard Commander-Truth!			https://www.truthorfiction.com/palin-national-guard/			2015-03-17T18:06:29+00:00
Presidential Visit to Golf Course Rudely Delayed Other Players-Unproven!			https://www.truthorfiction.com/obama-tees-off-golfers/			2015-03-17T18:06:28+00:00
President Obama Hesitated to Give Order to Kill Osama Bin Laden-Fiction!			https://www.truthorfiction.com/obama-hesitated/			2015-03-17T18:06:28+00:00
Military to Pledge Oath To Obama, Not Constitution-Fiction! and Satire!			https://www.truthorfiction.com/oath-to-obama/			2015-03-17T18:06:28+00:00
President Obama absent from the Arlington 2010 Memorial Day Ceremony-Truth!			https://www.truthorfiction.com/obama-2010-memorial-day/			2015-03-17T18:06:28+00:00
President Obama Failed to Salute at Veterans Day Service-Fiction!			https://www.truthorfiction.com/obama-arlington-salute/			2015-03-17T18:06:28+00:00
Navy Seals rescuing Captain Richard Phillips from pirates were restricted by Obama’s delays and rules of engagement – Fiction!			https://www.truthorfiction.com/obama-delays-rescue/			2015-03-17T18:06:28+00:00
Why No Salute By Obama At Medal Of Honor Ceremony?-Commentary!			https://www.truthorfiction.com/obama-medal-of-honor/			2015-03-17T18:06:28+00:00
The Obama administration plans to require private insurance carriers to reimburse the Department of Veterans Affairs (VA) for the treatment service related injuries of military personnel  -Truth! -but Cancelled			https://www.truthorfiction.com/obama-veteran-insurance/			2015-03-17T18:06:28+00:00
New Obama policy prevented a decorated Serviceman from speaking at Catch a Dream event-Fiction!			https://www.truthorfiction.com/obamba-stube/			2015-03-17T18:06:28+00:00
President Obama Gives U.S. Marines a ‘Latte Salute’-Truth!			https://www.truthorfiction.com/obama-latte-salute/			2015-03-17T18:06:28+00:00
U.S. Government Developing Insect Spy Drones-Truth!			https://www.truthorfiction.com/mosquito-drone/			2015-03-17T18:06:27+00:00
