Help Find Little Madeleine McCann-Truth!			https://www.truthorfiction.com/madeleine/
Pray for Chad, a soldier shot in the head in Iraq-Truth!			https://www.truthorfiction.com/chad-snowden/
Target says no to the Salvation Army and yes to sex toys?-Truth! & Fiction!			https://www.truthorfiction.com/target-sex-toys/
Prayer Request for David Kristynik in Iraq-Truth! But Inaccurate!			https://www.truthorfiction.com/lastpatrol/
Help Find Reachelle Marie Smith-Truth!			https://www.truthorfiction.com/reachelle/
Boycott Oscar Mayer for not supporting the troops-Fiction!			https://www.truthorfiction.com/oscar-mayer/
$1.50 Cheesecake at Cheesecake Factory-Truth!			https://www.truthorfiction.com/cheesecake/
Watch a Video-Donate to Autism-Truth!			https://www.truthorfiction.com/autismspeaks/
