Video Shows Muslim Woman Buying Soda with Food Stamps-Truth! & Unproven!			https://www.truthorfiction.com/video-shows-muslim-woman-buying-soda-food-stamps/
Chiefs Owner Clark Hunt Speech on National Anthem Protests-Incorrect Attribution!			https://www.truthorfiction.com/chiefs-owner-clark-hunt-national-anthem-protests/
Charmin Releasing Pumpkin Spice Toilet Paper-Fiction!			https://www.truthorfiction.com/charmin-releasing-pumpkin-spice-toilet-paper/
NFL Fines Players for Wearing Commemorative 9/11 Cleats-Truth!			https://www.truthorfiction.com/nfl-fines-players-wearing-911-commemorative-cleats/
Seattle Seahawks Protest National Anthem-Fiction!			https://www.truthorfiction.com/seattle-seahawks-protest-national-anthem/
Allen B. West Penned an Open Letter to Colin Kaepernick-Authorship Confirmed!			https://www.truthorfiction.com/allen-b-west-penned-open-letter-colin-kaepernick/
Retire if You Have These Beanie Babies-Fiction!			https://www.truthorfiction.com/retire-beanie-babies/
Maya Dillard Smith Resigns from ACLU over Transgender Bathrooms-Truth!			https://www.truthorfiction.com/maya-dillard-smith-resigns-aclu-transgender-bathrooms/
Canadian Teen Finds Lost Mayan City With Google Maps-Disputed!			https://www.truthorfiction.com/canadian-teen-finds-lost-mayan-city-google-maps/
Photo Shows Gulf of Mexico, Mississippi River Don’t Mix-Mostly Truth!			https://www.truthorfiction.com/photo-shows-gulf-mexico-mississippi-river-dont-mix/
Edgar Allen Poe Wrote About the Death of Dick Parker-Truth!			https://www.truthorfiction.com/edgar-allen-poe-wrote-about-the-death-of-dick-parker/
Texas Man Forced to Remove Flag Muslims Found Threatening-Fiction!			https://www.truthorfiction.com/texas-man-forced-to-remove-flag-muslims-found-threatening/
Lawn Jockey Statues are Racist-Disputed!			https://www.truthorfiction.com/lawn-jockey-statues-are-racist/
John Franklin Stephens’ Letter to Ann Coulter-Authorship Confirmed!			https://www.truthorfiction.com/john-franklin-stephens-letter-to-ann-coulter-authorship-confirmed/
Minions from “Despicable Me” Were Inspired by Tortured Jewish Children-Fiction!			https://www.truthorfiction.com/minions-from-despicable-me-were-inspired-by-tortured-jewish-children/
Easter Island Heads Have Bodies Buried Beneath Them-Truth!			https://www.truthorfiction.com/easter-island-heads-have-bodies-buried-beneath-them/
There Will Be 5 Fridays, Saturdays and Sundays in August 2015- Truth! & Misleading!			https://www.truthorfiction.com/there-will-be-5-fridays-saturdays-and-sundays-in-august-2015/
Disable Vet Was Runner Up to Bruce Jenner for Arthur Ashe Courage Award-Fiction!			https://www.truthorfiction.com/disable-vet-was-runner-up-to-bruce-jenner-for-arthur-ashe-courage-award/
Ship Missing for 90 Years Reappears Near Bermuda Triangle-Fiction!			https://www.truthorfiction.com/ship-missing-for-90-years-reappears-near-bermuda-triangle/
Salvation Army Bell Ringers Take Home Donations-Fiction!			https://www.truthorfiction.com/salvation-army-bell-ringers-take-home-donations/
The First 3 Digits On Barcode Labels Represents The Country-Truth! & Fiction!			https://www.truthorfiction.com/barcodes/
ABC News Bans Flag Lapel Pins – Truth! & Fiction!			https://www.truthorfiction.com/abcflag/
Detroit Cuts Off Water to 30,000, Builds 1,000-Foot Water Slide-Fiction!			https://www.truthorfiction.com/detroit-cuts-off-water-to-30000-builds-1000-foot-water-slide/
Chinese Fireworks Video – Fiction!			https://www.truthorfiction.com/chinese-fireworks-video/
Picture of Hurricane Isabel taken at Sea-Fiction!			https://www.truthorfiction.com/isabel/
Why Women Should Vote and The “Iron Jawed Angels”-Truth!			https://www.truthorfiction.com/womens-vote/
Muslim Shirt Depicting Twin Towers in Flames–Unproven!			https://www.truthorfiction.com/the-shirt/
Church Building made of Legos-Truth!			https://www.truthorfiction.com/legochurch/
Halal Meat at Costco-Unproven!			https://www.truthorfiction.com/costco-halal-meat/
The meanings of the symbols on the dollar bill-Truth!			https://www.truthorfiction.com/dollarbill/
Train in Brussels is World’s Longest Chocolate Structure-Truth!			https://www.truthorfiction.com/chocolate-train-05012013/
First Air Force One Plane Decaying in Arizona Field-Truth!			https://www.truthorfiction.com/first-air-force-one/
FEMA Corps Team Members Are the Modern Day Hitler Youth-Fiction!			https://www.truthorfiction.com/fema-corps-hitler-youth/
The Deadly Janitor			https://www.truthorfiction.com/intensivecare/
Picture of a great white shark attacking a soldier hanging from a helicopter-Fiction!			https://www.truthorfiction.com/shark-copter/
Only In America-crazy court awards-Fiction!			https://www.truthorfiction.com/onlyinamerica/
Lucy…the body in the coffee table-Fiction!			https://www.truthorfiction.com/lucy/
Forest Fire picture-Truth!			https://www.truthorfiction.com/forestfire/
Child’s body used for smuggling drugs into the U.S.-Fiction!			https://www.truthorfiction.com/cocainebody/
A virus for the cell phone-Fiction!			https://www.truthorfiction.com/cellvirus/
Satellite photo of the North American blackout-Fiction!			https://www.truthorfiction.com/blackout/
Visit a web address and see your baby pictures or an instant snapshot online-Fiction!			https://www.truthorfiction.com/babypictures/
Stretching TV standards-Truth!			https://www.truthorfiction.com/tvstandards/
Patriotic Poem Written by Judge Roy Moore-Truth!			https://www.truthorfiction.com/roymoorepoem/
The story of Jacqueline Saburido Who was Disfigured in an Accident Causedby a Drunk Driver-Truth!			https://www.truthorfiction.com/jacqui/
Running Herd of Bison in Yellowstone is an Indication of Volcanic Eruption-Fiction!			https://www.truthorfiction.com/bison-run/
United Nations Dismisses Michael Brown Case – Fiction!			https://www.truthorfiction.com/un-dismisses-michael-brown-case/
Unsold New Cars Are Piling Up-Fiction!			https://www.truthorfiction.com/unsold-cars/
Old Black Vet Speaks Out-Unproven!			https://www.truthorfiction.com/old-black-vet/
The School Teacher Who Thought it was World War Eleven-Unproven!			https://www.truthorfiction.com/theodore-van-kirk/
Wal-Mart employees have to buy American flags on their own-Fiction!			https://www.truthorfiction.com/walmartflag/
Volkswagen’s New 300 MPG Car Not Allowed in America Rumor-Fiction!			https://www.truthorfiction.com/volkswagen-xl1/
Antonio West Santiago’s Murder-Truth!			https://www.truthorfiction.com/antonio-west/
Free towing through Texas roadside emergency number-Fiction!			https://www.truthorfiction.com/tdl/
Switzerland Gun Policy May Keep Their Murder Rate Down-Truth!			https://www.truthorfiction.com/swiss-gun-policy/
Judge Rules TSA Screenings for Muslims Unconstitutional-Fiction!			https://www.truthorfiction.com/tsa-screenings/
Media Missed Sniper Attack on California Power Plant-Truth!			https://www.truthorfiction.com/sniper-attack-in-san-jose/
Reggie the Black Lab’s Adoption-Fiction!			https://www.truthorfiction.com/reggie-black-lab/
FDR Rode Al Capone’s Car to Deliver Pearl Harbor Speech-Fiction! & Disputed!			https://www.truthorfiction.com/fdr-capone-car-102113/
Halloween is National Kill a Pit Bull Day – Fiction!			https://www.truthorfiction.com/nation-kill-pit-bull-day/
Microwaved Water Kills Plants-Fiction!			https://www.truthorfiction.com/microwave-test/
Netanyahu Statement to Hamas-Fiction!			https://www.truthorfiction.com/netanyahu-hamas/
Common Core and the Instructions on the Use of Sex Toys-Fiction!			https://www.truthorfiction.com/sharon-mercer/
Navy Directive Bans Bibles from Hotel Rooms on Bases-Previously Truth! Now Ended!			https://www.truthorfiction.com/navy-removes-hotel-bibles/
NBC Got Rid of Leno Because of Obama Jokes-Fiction!			https://www.truthorfiction.com/nbc-leno-obama/
An Urgent Call for Prayer from Anne Graham Lotz-Truth!			https://www.truthorfiction.com/777-anne-graham-lotz/
Mother of Officer Killed by Illegal Immigrant Wrote President Obama-Truth!			https://www.truthorfiction.com/brandon-mendoza/
Photo of Trayvon Martin- Fiction!			https://www.truthorfiction.com/martin-photo/
Veteran Complained to Lowe’s After Discovering That They Were Selling American Flag Doormats-Truth! but Inaccurate Details!			https://www.truthorfiction.com/lowes-flag-doormats/
The World’s Most Expensive Coffee is From Beans Cycled Through an Indonesian  Monkey’s Digestive System-Truth!			https://www.truthorfiction.com/kopiluwak/
Kennedy Center to Get Name Change-Truth! But not the one you think!			https://www.truthorfiction.com/kennedy-center-name-change/
Hobby Lobby’s Retirement Plan Invests in Contraception Manufacturers-Truth! & Pending Investigation!			https://www.truthorfiction.com/hobby-lobby-investments/
Radical Islamic Group ISIS Beheading Christian Children in Iraq-Truth!			https://www.truthorfiction.com/isis-beheading-children/
Instant Noodles Use Wax that Causes Cancer-Fiction!			https://www.truthorfiction.com/instant-noodles/
Hobby Lobby is Suing the U.S. Government Over Obamacare-Truth!			https://www.truthorfiction.com/hobby-lobby-lawsuit/
Hole Under Lock Car Break-ins-Truth!			https://www.truthorfiction.com/hole-break-in/
The Hamas Underground Terror Network in Gaza-Truth!			https://www.truthorfiction.com/hamas-tunnels/
Facebook Reports Photos of Gun Owners – Fiction!			https://www.truthorfiction.com/facebook-reports-gun-owners/
17 Fake Cell Phone Towers Detected-Truth!			https://www.truthorfiction.com/fake-cell-towers/
Man who died at his desk at work, but wasn’t noticed-Fiction!			https://www.truthorfiction.com/deadatwork/
FDA Finds Thousands of Coors Light Beer Cans Laced with Cocaine-Fiction!			https://www.truthorfiction.com/coors-light-cocaine/
Corpus Christi Movie Featured a Gay Jesus-Fiction!			https://www.truthorfiction.com/corpus-christi/
Costco Pulled America Book by Dinesh D’Souza-Truth! But Now Resolved!			https://www.truthorfiction.com/costco-america/
Extending the Range of Car Key Remotes by Touching Key Them to Your Head-Truth!			https://www.truthorfiction.com/car-key-remote-trick/
Brian Kolfage Letter To Obama-Under Investigation!			https://www.truthorfiction.com/brian-kolfage-letter-to-obama/
Mike Brown’s Criminal Record-Unproven!			https://www.truthorfiction.com/mike-brown-criminal-record/
Justin Bieber Admits To Being Bisexual-Fiction!			https://www.truthorfiction.com/bieber-bi-tweet/
Black Friday Originally Referred to Slave Trade – Fiction!			https://www.truthorfiction.com/black-friday-slave-trade/
Muslim Owner of Texaco In Bogalusa, LA Refuses to Serve Member of Military-Fiction!			https://www.truthorfiction.com/bogalusa-texaco/
Girl Scout Cookies Fund Planned Parenthood-Fiction!			https://www.truthorfiction.com/afa-gsusa-cookies/
ALS Association Supports Embryonic Stem Cell Research-Truth!			https://www.truthorfiction.com/als-association-warning/
AT&T Customers Eligible for Refund under Mobile Cramming Settlement – Truth!			https://www.truthorfiction.com/att-mobile-cramming-settlement-refund/
Julia Gillard and Kevin Rudd Said “No” to Sharia-Fiction!			https://www.truthorfiction.com/australia-pm-sharia/
Millions of Turkeys Affected by Avian Flu – Fiction!			https://www.truthorfiction.com/avian-flu-turkeys/
Salvation Army Instructed Bell Ringers Not to Say “Merry Christmas”- Fiction!			https://www.truthorfiction.com/salvation-army-merry-christmas/
British Scientists Clone Dinosaur-Fiction!			https://www.truthorfiction.com/scientists-clone-dinosaur/
Rare Meteor Shower Expected to Delight Sky Watchers-Truth! & Fiction!			https://www.truthorfiction.com/perseid-meteor-shower/
CNN Top 10 Stories -Virus!			https://www.truthorfiction.com/cnn-virus/
Letter to Coke over America the Beautiful-Unproven!			https://www.truthorfiction.com/coca-cola-ad-super-bowl-2014/
Incredible catch by a ball girl!-Fiction!			https://www.truthorfiction.com/ball-girl/
Cell Phone Numbers Are Going Public in a National Directory-Fiction!			https://www.truthorfiction.com/cell-phone-numbers-are-going-public-in-a-national-directory/
Yellowstone “super volcano”-Disputed!			https://www.truthorfiction.com/yellowstone/
Urinals in Amsterdam with flies etched in the bowls-Truth!			https://www.truthorfiction.com/urinal/
Shakespeare or Julius Caesar quote about war-Fiction!			https://www.truthorfiction.com/war-rightsquote/
What I am, an ad in the Washington Post written by a passionateRepublican-Truth!			https://www.truthorfiction.com/whatiam/
18th Century quote about democracy-Fiction!			https://www.truthorfiction.com/tytler/
Test to determine a whether a stroke is happening-Truth!			https://www.truthorfiction.com/stroke-test/
Texas Bans Licenese Plate Holders			https://www.truthorfiction.com/texaslicences/
Cell phones in Texas illegal in cars as of 9/1/03-Fiction!			https://www.truthorfiction.com/texcell/
The red-faced TV news anchor-Unproven!			https://www.truthorfiction.com/tvanchor/
Pictures of huge dust storm in Iraq-Truth!			https://www.truthorfiction.com/sandstorm/
Robin Williams’ peace plan-Fiction!			https://www.truthorfiction.com/robinwilliamspeaceplan/
The bizarre death of Ronald Opus-Fiction!			https://www.truthorfiction.com/ronaldopus/
The width of railroad tracks is based on history that extends back to Roman chariots-Fiction!			https://www.truthorfiction.com/railwidth/
“Prophet Yahweh” the Las Vegas Man Who Says He Can Call UFOsInto Sight on Command-Under Investigation!			https://www.truthorfiction.com/prophetyahweh/
Letter from heaven?-Fiction!			https://www.truthorfiction.com/notefromheaven/
Pulitzer Prize Winning Photographer Kills Himself and Leaves Suicide Note About World Hunger-Truth! & Fiction!			https://www.truthorfiction.com/kevincarter/
Unlocking car doors from phone to phone?-Fiction!			https://www.truthorfiction.com/lockedcardoor/
The man in the coffee beans brain test-Unproven!			https://www.truthorfiction.com/mancoffee/
The Marriott Hotel chain is classifying portions of Jerusalem as “Occupied Palestinian Area”-Fiction!			https://www.truthorfiction.com/marriott-jerusalem/
Mars is Going to Be the Closest to Earth Then Ever Before in RecordedHistory-Fiction!			https://www.truthorfiction.com/mars/
Pictures of Hurricane Katrina-Fiction!			https://www.truthorfiction.com/hurricane-katrins-pix/
Rumors among survivors of hurricane Katrina-Unproven!			https://www.truthorfiction.com/hurricane-rumors/
Put an “ICE” entry in your cell phone for emergencies-Truth!			https://www.truthorfiction.com/ice/
The Judge and the Shoe Bomber-Truth!			https://www.truthorfiction.com/judge/
The human finger in the fast-food chili-Truth! But it was a scam!			https://www.truthorfiction.com/fingerinchili/
Forward a friendship email to friends and see a video on your screen-Fiction!			https://www.truthorfiction.com/friends-forever/
Human dung used to generate power at a South African School-ProbablyTruth!			https://www.truthorfiction.com/dung-electricity/
Oral sex reduces the risk of breast cancer-Fiction!			https://www.truthorfiction.com/fellatio/
Two Crane Mishaps in Trying to Recover the Same Submerged Car-Unproven!& Fiction!			https://www.truthorfiction.com/cranetrouble/
George Carlin’s The Paradox of Our Time-Fiction!			https://www.truthorfiction.com/carlin/
Class Action about Music Recordings			https://www.truthorfiction.com/cd/
Anti War Activist Cindy Sheehan did not really rear her Army Soldierson-Fiction!			https://www.truthorfiction.com/cindy_sheehan/
Neil Boortz Graduation Speech-Truth! & Fiction!			https://www.truthorfiction.com/boortz/
The City Councilman’s Graphic Comment that Got Him Thown Out of a RadioStudio-Fiction!			https://www.truthorfiction.com/bubba/
Ethical questions about abortion and the character of politicians-Truthand Fiction!			https://www.truthorfiction.com/beethovenabort/
Forty Two Midgets Mutilated by a Lion in Cambodia Contest-Fiction!			https://www.truthorfiction.com/bbc-fake/
The amazing maize maze-Truth!			https://www.truthorfiction.com/amazingmaze/
Andy Rooney’s view of the world-Fiction!			https://www.truthorfiction.com/andyrooneycommentary/
Christmas Wreaths At Arlington Cemetery-Truth!			https://www.truthorfiction.com/wreaths/
RFID Implanted in Wyoming Students-Fiction!			https://www.truthorfiction.com/wyoming-rfid-chips-students-102113/
Dr. Jack Wheeler on Seal Team Rescue of Captain Phillips-Confirmed Authorship!			https://www.truthorfiction.com/wheeler-pirates-seals/
Wal-Mart is giving 5% of all online sales to homosexuals-Fiction!			https://www.truthorfiction.com/wal-mart-nglcc/
Distribute Money for the U.N.			https://www.truthorfiction.com/unscam/
A List of America’s Worst Charities-Reported to be True!			https://www.truthorfiction.com/tampa-bay-times-50-worst-charities/
Tape Sculptures-Truth!			https://www.truthorfiction.com/tapeart/
Swastika Rings Were Posted on Sears, Amazon Websites – Previously Truth!  Now Resolved!			https://www.truthorfiction.com/swastika-rings-sears/
Talking Angela iPhone App Warning- Fiction!			https://www.truthorfiction.com/talking-angela-app/
Inventor “burns” salt water with radio waves?-Truth!			https://www.truthorfiction.com/salt-water-flames/
Harley-Davidson Dealer’s Special Thanks to Military Members-Truth!			https://www.truthorfiction.com/reimans-harley-davidson/
Giant Squid Washes up on Santa Monica Beach-Fiction!			https://www.truthorfiction.com/giant-squid/
Pravda Opinion “American Capitalism Gone With A Whimper”- Confirmed Authorship! But Inaccurate Details!			https://www.truthorfiction.com/pravda-article-us-obama/
Tips on pumping gas from a pipeline employee-Fiction!			https://www.truthorfiction.com/pumping-gas/
Starbucks Pumpkin Spice Lattes Are Toxic-Fiction!			https://www.truthorfiction.com/starbucks-pumpkin-spice-lattes/
Boycott Petro Express because it’s owned by Hugo Chavez-Fiction!			https://www.truthorfiction.com/petroexpress/
Palestinian Burn Patient Turned Suicide Bomber-Truth!			https://www.truthorfiction.com/palestinian-burn-patient-bomber-091413/
Westboro Baptist Church Fred Phelp’s Deathbed Confession “I’m Gay”-Fiction! & Satire!			https://www.truthorfiction.com/fred-phelps-gay/
Green Bay Packers Wide Receivers Used Illegal Battery-Powered Gloves-Fiction!			https://www.truthorfiction.com/packers-gloves/
Obscene Salaries of Welfare Recipients- Reported to be Truth!			https://www.truthorfiction.com/obscene-salaries/
Walt and Cindy Miller’s Cancellation Letter to AARP-Confirmed Authorship!			https://www.truthorfiction.com/miller-aarp/
Some Motel 6 Will Only Rent Rooms To Those 21 and Over-Truth!			https://www.truthorfiction.com/motel-6-military/
Mexico Has a National Voter ID Policy-Truth!			https://www.truthorfiction.com/mexico-voter-id-092513/
Susan G. Komen CEO’s Got a 64 Percent Raise – Previously Truth! Now Resolved! 			https://www.truthorfiction.com/susan-koman/
Laminin, a protein important to the body, is in the shape of a cross-Truth!			https://www.truthorfiction.com/laminin/
Hunting to be Restricted by New Age Limits, Education Requirements- Fiction!			https://www.truthorfiction.com/hunting-age-restricted/
Illegal Immigrants Cost U.S. Taxpayers $338.3 Billion a Year-Fiction!			https://www.truthorfiction.com/illegal-immigrants-costs/
Gatlinburg, Tennessee Overrun by Immigrants-Fiction!			https://www.truthorfiction.com/gatlinburg-061013/
Former Marine Arrested in Crack Down on Anti-Government Commenters -Truth! & Fiction!			https://www.truthorfiction.com/former-marine-arrested/
Free Directory Assistance?-Truth!			https://www.truthorfiction.com/free-411/
Bill Gates Admits to Chemtrails-Truth!			https://www.truthorfiction.com/bill-gates-chemtrails/
GPS Explodes After Overheating–Fiction!			https://www.truthorfiction.com/gps-explodes/
A tax refund on 2006 forms for excise tax on long-distance phonecalls-Truth!			https://www.truthorfiction.com/exisetax/
Record-shattering Snowfall on the Way-Fiction!			https://www.truthorfiction.com/record-snowfall/
Notice From FedEx of an Undelivered Package-Fiction! & Possible Virus!			https://www.truthorfiction.com/fedex-undelivered/
New Nail Gun by DeWalt Drives Nails from 200 Yards-Fiction!			https://www.truthorfiction.com/dewalt-nail-gun/
Doe Run Smelter to Shut Down Operations-Truth!			https://www.truthorfiction.com/doe-run-smelter/
Pennies to help remedy bee stings?-Unproven!			https://www.truthorfiction.com/copper-pennies/
Chinese Jets Sink Navy Aircraft Carrier-Fiction!			https://www.truthorfiction.com/chinese-jets-george-washington/
$400K Camel Statue in Pakistan-Truth!			https://www.truthorfiction.com/400k-camel/
Vote “No” on Proposition 25 in the California November 2014 Ballot-Fiction!			https://www.truthorfiction.com/ca-prop-25/
Bitstrips App a Secret Spyware for NSA-Fiction! & Satire!			https://www.truthorfiction.com/bitstrips-app-nsa/
It Is Raining Spiders in Brazil-Fiction!			https://www.truthorfiction.com/brazilian-sky-spiders/
A Complaint Has Been Filed Against You With The Better Business Bureau-Fiction! & Scam!			https://www.truthorfiction.com/bbb-scam/
Bendy iPhone 6 Plus-Truth!			https://www.truthorfiction.com/bendy-iphone-6/
Ann Barnhardt’s Response to a Death Threat-Truth!			https://www.truthorfiction.com/ann-barnhardt/
Amanda Todd’s YouTube Video on Struggling, Bullying, Suicide and Self Harm-Truth!			https://www.truthorfiction.com/amanda-todd/
Arizona Protest Sign Threatens Violence to Peace Officers-Disputed!			https://www.truthorfiction.com/arizona-protest-sign-warning/
The Quick AA Battery Test Video on YouTube-Truth!			https://www.truthorfiction.com/aa-battery-test/
Abortion survivor’s surprise appearance in the ColoradoLegislature-Truth!			https://www.truthorfiction.com/abortion_survivor/
A.F.A. Calls for a Boycott of Harvey Milk Postage Stamps-Truth!			https://www.truthorfiction.com/afa-harvey-milk-stamp/
Aborted Babies and Other Medical Waste Used for Fuel by Oregon-Truth!			https://www.truthorfiction.com/aborted-babies-fuel-oregon/
The Connections Between the Occupy Wall Street Protest, Brookfield Properties’ Zucotti Park and Vice President Joe Biden – Truth! & Fiction!			https://www.truthorfiction.com/zucotti-park/
Photo of Ferguson Police Office Wilson’s Eye Socket Injury-Fiction!			https://www.truthorfiction.com/darren-wilson-eye-socket/
Daughter of Jeremiah Wright Convicted in Fraud Scheme-Truth!			https://www.truthorfiction.com/jeri-wright/
Photo of Kenyan Border Sign Boasts The Birthplace of President Obama- Fiction!			https://www.truthorfiction.com/welcometokenya/
Be Cautious Giving Information To Census Takers-Truth!			https://www.truthorfiction.com/uscensus/
Request from Whatsapp to Forward Messages to Friends-Fiction!			https://www.truthorfiction.com/whatsapp-fwd-request/
Royal Couple, Prince William and Kate Middleton, Snub Obama With No Wedding Invitation-Fiction!			https://www.truthorfiction.com/william-kate-wedding-invite/
“America as the Last Man Standing” by Geert Wilders-Commentary!			https://www.truthorfiction.com/geert-wilders/
Football Player Michael Vick Attacked By Pitbull-Fiction!			https://www.truthorfiction.com/michael-vick-pitbull/
What did Megachurch pastor Rick Warren Really Say about Gays and Gay Marriage?			https://www.truthorfiction.com/rick-warren-prop8/
VA Destroyed Records to Reduce Backlog- Disputed!			https://www.truthorfiction.com/va-system-redesign/
Starbucks and Monsanto Sue Vermont-Fiction!			https://www.truthorfiction.com/vermont-starbucks-monsanto/
Use Wasp Spray to Stop an Assailant as a Criminal Deterrent-Disputed!			https://www.truthorfiction.com/wasp-spray/
Volkswagen has been working on a car that gets 258 miles to the gallon-Truth! & Fiction!			https://www.truthorfiction.com/vwl1/
Beautiful picture of wildflowers—but where?-Truth! & Fiction!			https://www.truthorfiction.com/wildflowers/
Video Exposes Tacoma Housing Project For Illegal Aliens and Refugees- Fiction!			https://www.truthorfiction.com/tacoma-video/
Video of an Amazing Three Dimensional Printer-Truth!			https://www.truthorfiction.com/three-d-printer/
Don’t Eat Tilapia Because it Comes From China-Disputed!			https://www.truthorfiction.com/tilapia/
CEO Doesn’t Want Black People Wearing Timberland Boots – Fiction!			https://www.truthorfiction.com/timberland-boots/
Email Alleged to be from Microsoft That Offers Software Update”-VIRUS!			https://www.truthorfiction.com/updates-warning/
Target Stores Won’t Fund Veterans Projects-Fiction!			https://www.truthorfiction.com/target-viet/
Come to the Tax Day Tea Party Rally and Mail a Teabag to the Whitehouse to Protest Wasteful Government Spending –  Grass Roots Movement!			https://www.truthorfiction.com/teaparty/
Teddy Stoddard			https://www.truthorfiction.com/teddy/
A warning about emails that contain photos and songs by Michael Jackson could actually be malicious infections -VIRUS!			https://www.truthorfiction.com/symantec-warning-michael-jackson/
The day after Thanksgiving the busiest for shoppers?-Fiction!			https://www.truthorfiction.com/thanksgiving/
Young Thief in Iran Punished by Running a Truck Over His Arm-Fiction!			https://www.truthorfiction.com/thief-islam/
Your Latest Sprint Bill is Available Online-Fiction! & Phishing! & Virus!			https://www.truthorfiction.com/sprint-bill-scam/
Sharon Jasper, the welfare recipient with a big screen TV-Truth! & Unproven!			https://www.truthorfiction.com/sharon-jasper/
Sensible Gun Control-Fiction!			https://www.truthorfiction.com/sensible-gun-control/
Glass bottom sky walk at the Grand Canyon-Truth!			https://www.truthorfiction.com/skywalk/
Snopes.com is a secret tool of the Democratic party to promote Barack Obama-Fiction!			https://www.truthorfiction.com/snopes/
Man Responsible For Olympic Ring Mishap Found Dead In Sochi-Fiction! & Satire!			https://www.truthorfiction.com/sochi-technician-dead/
Sony CD			https://www.truthorfiction.com/sony-spyware/
