Two British Boys who Killed a Three-year-old Are Being Released and Given New Identities-Truth!			https://www.truthorfiction.com/jamiebulger/
Remarkable picture of an iceberg-Fiction!			https://www.truthorfiction.com/iceberg/
The body of a SCUBA diver found in a California forest fire-Fiction!			https://www.truthorfiction.com/firediver/
Fifty Percent of American Marriages End in Divorce-Fiction!			https://www.truthorfiction.com/divorce/
Drilling to Hell-Facts			https://www.truthorfiction.com/drilltohellfacts/
Adventures in cow tipping-Fiction!			https://www.truthorfiction.com/cowtipping/
Charles Darwin became a Christian on his deathbed and renounced evolution-Fiction!			https://www.truthorfiction.com/darwin/
Billy Evans, the boy who needs a body transplant-Fiction!			https://www.truthorfiction.com/billyevans/
The Kidnap Warning in Deerfield Township in Ohio			https://www.truthorfiction.com/deerfieldhoax/
CONFICKER or DOWNADUP Virus and the April 1 Super Strain -Virus!			https://www.truthorfiction.com/conficke-downadup/
