Press Photographer Catches Lawmakers Playing Solitaire on their Laptops During a Session-Truth!			https://www.truthorfiction.com/ct-solitaire/
California Highway Patrol Officer Cuffs Montecito Fire Battalion Chief -Truth!			https://www.truthorfiction.com/chp-cuffs-firefighter/
The Starbucks Coupon That Went Too Far			https://www.truthorfiction.com/starbucks-lawsuit/
Pasadena Police and Hotel Key Cards			https://www.truthorfiction.com/pasadena-keycards/
The county supervisor with a red face at a board meeting			https://www.truthorfiction.com/keeshan-red-face/
The Harry and David “Twleve Days of Christmas” Pack			https://www.truthorfiction.com/harryanddavid/
The “flashing headlights” gang initiation ritual			https://www.truthorfiction.com/flashinglights/
The Kidnap Warning in Deerfield Township in Ohio			https://www.truthorfiction.com/deerfieldhoax/
West Virginia Attorney General’s office			https://www.truthorfiction.com/cell-wv/
