"X.Title.","X.Date.","X.Url.","X.Rumor.Summary.","X.The.Truth.","category"
"Mechanically separated chicken for food-Truth!","2015-03-17 20:42:33","https://www.truthorfiction.com/msm/"," An email message alerting       readers to the existence of mechanically separated meats such as       chicken and turkey. The writer says it is a carcass stripped of everything except       tissue, immature sex glands, and bone and asks, “Shouldn’t       consumers be made aware of what mechanically separated chicken       is?” "," According to the U.S.Food Safety and Inspection Service of the Department of Agriculture, mechanically separated meets are the real thing and are safe. Very simply, mechanical separation is a way of getting every last piece of meat from the bone of a chicken, turkey, or other food animal. Bones with edible meat attached are forced under high pressure through a device that separates the bone from the meat. It’s a process that’s been used since the 1960’s and for a variety of popular products. A statement from the U.S. Food Safety and Inspection Service says mechanically separated products are “safe, wholesome, nutritious, and useful in providing consumers with the wide variety of economical meat and poultry products.” We have not been able to find any reference to the carcass specifically having “immature sex glands.” ","Food - Drink"
"The human finger in the fast-food chili-Truth! But it was a scam!","2015-03-17 20:42:29","https://www.truthorfiction.com/fingerinchili/"," A forwarded email alleged to include an Associated Press story of a women who bit into what turned out to be a human finger at a Wendy’s fast food restaurant in San Jose, California. "," This was quite a saga and in the end turned out to be a scam. On March 22, 2005, Anna Ayala said she was eating chili at a Wendy’s restaurant in San Jose when she realized something strange was in her mouth. It turned out to be a human fingertip. Wendy’s conducted an investigation as did health authorities and could not find any evidence that the finger had originated from anywhere within Wendy’s. Wendy’s then hired a private investigator and offered a $100,000 reward to find the owner of the finger tip. According to a 4/16/05 article in the Seattle Times, Ayala hired a lawyer to sue Wendy’s but there were reports that she has a history of filing false claims against corporations and she dropped the lawsuit. On April 22, 2005, police in Las Vegas took Anna Ayala into custody and made charges against her in connection with the finger in the chili. Ayala protested her innocence but the mystery remained as to where the finger came from. Then on 5/13/05 San Jose police announced that the finger was that of an acquaintance of Ayala’s husband and had been lost in an industrial accident in December, 2004. Then in September, 2005 both Ayala and her husband, Jaime Placencia, pleaded guilty to conspiring to file a false claim and attempted grand theft. Wendy’s says it has lost $2.5 million in sales and dozens of employees lost their jobs because of the hoax. Last updated 9/10/05 ","Food - Drink"
"U.S. burger chains buying foreign beef?-Truth!","2015-03-17 20:42:29","https://www.truthorfiction.com/foreignbeef/"," The writer of the eRumor accuses McDonald’s and Burger King of making the unpatriotic  decision to start purchasing beef from foreign sources and urges a  boycott. Another version adds to this by saying that some of the beef is  being purchased from South American. "," Burger King says this is nothing new and that it has been purchasing beef from Australia and New Zealand for years. McDonald’s says it is conducting an experiment to use beef from Australia and New Zealand, but it is a small test involving less than 1 percent of its beef purchases. Contrary to the eRumor, there is a documented shortage of lean beef in the United States, according to McDonald’s, and that is why they are doing the test. In a statement sent to TruthOrFiction.com, McDonald’s says it is the biggest buyer of beef in the U.S., using more than one billion pounds per year.  (Burger King is second biggest.) McDonald’s says that any foreign beef purchased is 100% USDA-approved and inspected.  According to the statement, most major quick service restaurant chains including Taco Bell, Wendy’s, and Carl’s Jr. have used or are now using a significant percentage of imported beef, up to 50 percent. In the second version (below), the writer says that McDonald’s is   claiming that there isn’t enough beef in the U.S. to serve their   needs.  That is not exactly accurate.  McDonald’s is   saying there is a shortage of lean beef.  Also, in the second   version, the burger chains are described as buying beef from South   America and then the writer criticizes some of the standards   regarding beef in South America.  None of the major chains   has said anything about buying beef from South America. last updated 07/16/02 ","Food - Drink"
"Free salads from McDonald’s-Fiction!","2015-03-17 20:42:29","https://www.truthorfiction.com/freesalad/"," This is an email with a colorful attachment that is a coupon or certificate for a free “Premium Salad” at McDonald’s. "," McDonald’s says this slick, professional-looking certificate is not valid. An official notice on their website says McDonald’s had nothing to with the coupon and that their company is investigating where it came from. It began circulating in April, 2003. Last updated 7/31/03 ","Food - Drink"
"Young girl with serious health problems from Wal-Mart milk-Unproven!","2015-03-17 20:40:00","https://www.truthorfiction.com/wal-mart-milk/"," The story of an 11-year-old girl who has had menstrual bleeding since she was 8 and has also started lactating.   The eRumor says it is because she’s been drinking milk injected with rBST, a hormone given to cows to increase their milk production.  The eRumor focuses on Wal-Mart Great Value milk as a source of the rBST and recommends against feeding it to your family. "," There is controversy over rBST, which stands for recombinant bovine somatotropin.  It is an artificial growth hormone used in cows. We’ve not found the family of Marissa, the 11-year old girl referenced in the eRumor.  If she is real her family’s suspicions are worthy of consideration but do not constitute proof that what they describe has been caused by ingesting milk from Wal-Mart.  There are other conditions that can cause early menstruation such as hypothyroidism.  Also, although there are fears, there is not scientific agreement about whether rBST is harmful to humans. RBST is a synthetic version of bST or BGH, a natural growth hormone in cows which, among other things, affects the amount of milk produced by a dairy cow.  Use of bST to increase milk production has been around since the 1930’s then along then the synthetic version came into popularity. Critics of the use of rBST say that it is banned for use in cattle in virtually every major country in the world except the United States.  They point out that there is an increase in health problems in cattle that produce the most milk so the use of rBST should be avoided on that ground. Supporters say rBST helps dairy farmers with better milk yield and that there has not been any proof that the hormone causes problems in humans.  It is approved for use by the U.S. Food and Drug Administration. Although this eRumor focused on Wal-Mart milk there are several different milk companies that use cattle treated with rBST and Wal-Mart also sells milk from cows that are not injected with it.  Because of the controversy over rBST a lot of the milk products without it are labeled as such and are not hard to find. In March, 2008, Wal-Mart announced that rBST will no longer be found in milk from either Wal-Mart or Sams Club. Updated 3/25/08 ","Food - Drink"
"Chinese Firm Purchased Smithfield Farms-Truth!","2015-03-17 20:39:56","https://www.truthorfiction.com/smithfield-farms-china/"," This is a forwarded email alleging that Smithfield Farms has been sold to a Chinese firm. The email says poor sanitary conditions with Chinese farm-raised tilapia should raise concerns to American consumers. "," Smithfield Farms, Inc., was purchased by Chinese food producer Shuanghui International, according to an October 25, 2013, article by UPI that said the acquisition “has left many Americans feeling concerned about the future of food safety.” The Smithfield transaction was the largest purchase of a U.S. company by a Chinese investor, “a deal valued at $7 billion, including $4 billion in cash.” The article said that the concerns over the food safety were raised from the recent news of Chinese tainted dog treats resulting in the deaths of hundreds of pets “from a mystery illness.” A Smithfield spokesperson told reporters that the objective of the deal was “to increase the export of U.S. pork to China.” The eRumor alleged poor sanitary conditions of farm raised tilapia from China. TruthOrFiction.com has findings posted, which can be read by clicking this link . Our findings about Starkist being purchased by a Korean company can be found by clicking this link . Posted 06/12/14 ","Food - Drink"
"Starbucks Adds Semen to its Drinks-Fiction!","2015-03-17 20:39:56","https://www.truthorfiction.com/starbucks-semen-for-flavor/"," Viral reports claim that Starbucks adds semen to its drinks because it adds “more flavor.” "," This is a hoax. The fake news website Huzlers.com published a false report that semen samples had been found inside Starbucks drinks in October 2014. The website’s disclaimer states that it “keeps its visitors in a state of disbelief” by publishing  satirical news. Within days, the story had been shared more than 215,000 times on Facebook. The fake Huzlers.com report also alleged that the popular Starbucks Pumpkin Spice Latte seasonal drink is loaded with both semen and cockroaches, which is also not true. This isn’t the first time Huzlers.com has picked on Starbucks, either. The fake news website previously falsely reported that Starbucks started using human breast milk in its products because the “discovery of cancer in cattle” led to widespread milk shortages. Posted 10/2714 ","Food - Drink"
"Satanic Barista at Starbucks Upsets Catholic Customer-Truth!","2015-03-17 20:39:55","https://www.truthorfiction.com/satanic-barista-at-starbucks/"," This is a forwarded email that contains what appears to be a news article alleging that Megan Pinion, a Catholic school teacher, posted a complaint on her Facebook news feed about a Starbucks barista.  Pinion said the barista drizzled satanic symbols in caramel on her two lattes. "," The article is real and appeared on the Limelife.com website on April 2, 2014. This story went viral on the Internet and Starbucks issued a public apology, according to an article by The Advertiser released later that day. Tom Kuhn, the social media spokesman for Starbucks,  told reporters, “We reached out to her through social media and apologized. We’re taking the complaint seriously. We’re not sure who served her or what kind of beverage it was. It looks kind of caramel-ish in the photos.” Posted 04/02/14 ","Food - Drink"
"Starbucks Pumpkin Spice Lattes Are Toxic-Fiction!","2015-03-17 20:39:53","https://www.truthorfiction.com/starbucks-pumpkin-spice-lattes/"," Reports alleging that Starbucks’ Pumpkin Spice Latte includes a toxic artificial caramel color have gone viral on social media and blog sites. "," Starbucks Pumpkin Spice Latte includes caramel coloring, but there’s no proof that it’s toxic. Starbucks sells the Fontana Pumpkin Sauce it uses to brew Pumpkin Spice Lattes in its online store. Its list of ingredients includes caramel color and natural and artificial flavors. The eRumor alleges that the caramel coloring found in the Pumpkin Spice Latte is a cancer-causing chemical compound called 4-MEI, or Class IV Caramel Coloring. But there’s no evidence that the Starbucks Pumpkin Spice Latte includes 4-MEI, or that it actually causes cancer. According to the FDA : Foods containing added colors must list them either by name or as “artificial colors” in the ingredients statement on the food label. Because there are other artificial colors, the presence of “artificial colors” on a food label does not necessarily mean that caramel coloring is contained in the food. Also, the presence of “caramel coloring” on a food label does not necessarily mean that the food contains 4-MEI, because the term “caramel coloring” also may be used to describe Class I and Class II caramel coloring. Class I and Class II caramel coloring do not contain 4-MEI. And, even if Starbucks Pumpkin Spice Latte does include 4-MEI, FDA says there’s no proof that it’s harmful to humans: Based on the available information, FDA has no reason to believe that there is any immediate or short-term danger presented by 4-MEI at the levels expected in food from the use of caramel coloring. It’s also “virtually impossible” to eliminate 4-MEI from foods because its not an additive. It’s a byproduct of food prep activities like roasting coffee beans or grilling meats, FDA says. Posted 09/25/14 ","Food - Drink"
"Monster Energy Drinks are Satanic-Fiction!","2015-03-17 20:39:47","https://www.truthorfiction.com/monster-drinks-satanic/"," Subtle satanic references can be found in Monster Energy’s logo and branding. "," The marketing firm that developed the name, brand and package design for Monster Energy told TruthorFiction.com that there aren’t any hidden satanic messages in it. Rumors that that the Monster brand hides subliminal satanic messages went viral after an unidentified woman made that claim in a video posted in November 2014. In the video, the woman claims that the “M” that appears on cans of Monster is actually “Vav,” the Hebrew numeral for six , repeated three times. She interprets that to mean “666.” The woman also claims a crucifix can be found inside the “O” of the Monster banner logo. She interprets the two occurrences to represent “the beast” from the Book of Revelations. “This is not a Christian company at all,” the woman said. “So why would they have a cross on the can? Here is the message: Anti-Christ.” TruthorFiction.com tracked down McLean Design, the firm that Hansen Beverage Corporation hired to developed the name, logo and packaging for what would become “Monster” way back in 2000, to find out the truth. Rifle Hughes, managing director of McLean Design, emphatically denied that Monster’s brand has any subliminal messaging, satanic or otherwise. “The facts are that we were there,” Hughes said. “We were at all of the client meetings and putting in hours at the studio creating what has become one of the most recognized brands in popular culture. Trust me, there was nothing in the creative brief about anything spiritual or layering hidden meanings.” The firm outlines its work to brand “Monster” in this case study . In 1997, Hansen helped launched the energy drink market, but its market share had dropped to just 8 percent by 2000. Hansen turned to McLean Design to develop an edgy brand that would “drive sales, volume and market penetration” for a new line of 16-ounce cans of energy drink. The firm settled on three finalists for the new brand’s name: “Fatboy,” “Deuce” and “Monster.” Ultimately, the company said, it went with “Monster” because of the 16-ounce can’s larger size, as well as its “maniacal energy,” and its status as a “social renegade.” And the “M” logo was inspired by Alfred Hitchcock, not satan. “We designed the logo to be an iconic ‘M’ that would imply the presence of a monster’s claws ripping through the can. It’s the whole, ‘the monster you don’t see is scarier’ thing — see Hitchcock,” Hughes said. And Hughes said there’s no crucifix inside the Monster banner’s “O,” either. “The ‘O’ was part of an existing typeface,” Hughes said. “We added the bone through the ‘O’ to make it more menacing. It’s not a hidden cross. It’s not a cross at all. It’s not even a Psi. It’s an ‘O.’” Hughes said conspiracy theories about the Monster’s brand are nothing new, and he doesn’t expect them to go away anytime soon. “The issue with all these online theories is that they cherry pick historical symbology, make some pretty wild leaps in connection, and force-fit some ‘ah-ha’ that they often believe to be there before they start connecting the dots,” Hughes said. Posted 11/17/14 ","Food - Drink"
"KFC Bans Alcohol Wet Wipes Because Muslims Might Take Offense – Truth!  & Now Resolved","2015-03-17 20:39:44","https://www.truthorfiction.com/kfc-alcohol-wet-wipes/"," Reports allege that Kentucky Fried Chicken (KFC) banned alcohol wet wipes at some restaurants because Muslims might find them offensive. "," A greasy-fingered customer at a KFC in Leicester, England, was denied an alcohol-based wet wipe because the franchise was running a Halal-only trial there and Islam does not allow alcohol. The customer, Graham Nokes, told the Leicester Mercury he thought it was a practical joke. He was working on a new Muslim community center that was being constructed in the area at the time. A KFC spokesperson told BBC News in 2010 that the fast-food chain had launched 86 Halal restaurants in the U.K. because of demand from Muslim customers. KFC also operates 32 Halal restaurants in the U.S. A company rep told the Leicester Mercury the situation was a misunderstanding. “Our alcohol-based hand wipes are approved for use in all our restaurants, including those who are part of our Halal trial,” the rep said. “There was a misunderstanding at the store in question, but the wipes are being used again. We’re sorry for the customer’s experience.” Posted 09/30/14 ","Food - Drink"
"Don’t Eat Tilapia Because it Comes From China-Disputed!","2015-03-17 18:06:32","https://www.truthorfiction.com/tilapia/"," This is a forwarded email that warns not to eat tilapia because it comes from China. "," This eRumor has more to do with the controversy of consuming wild caught fish over fish that is farm raised.  China is a major producer of farm raised tilapia but sanitation conditions of ponds may not be as big of a concern when compared to dumping of  chemicals and drugs into the water where these tasty fish are raised. According to the seafood watch fact sheet by the Monterey Bay Aquarium in California, tilapia is a fresh water snapper that is farmed in ponds, closed re-circulating systems or tank systems.  About 40% of the world’s tilapia comes from China.  Other countries that farm tilapia in mass production are the U.S., Canada, Ecuador, and Taiwan.  The fish is a native to Africa and is considered a “fast-growing tropical species.”  The fact sheet also said that it “is the fourth most-consumed seafood in the United States after shrimp, tuna and salmon.” Consuming fish has health benefits but experts say that wild caught fish is preferable to those raised on a farm.  This according to a November 19, 2012 article by the Washington Post that warned of “heavy use of chemicals — including pesticides and antibiotic and antifungal drugs — in many aquaculture operations,” a process to help maintain the health of fish in overcrowded habitats.  The article also said that the experts suggested that it was healthier to eat farmed fish than no fish at all.  Moderation was the key to a healthier life by including half a pound of fish in the weekly diet. The allegation that farm raised tilapia in China were being fed chicken and pig feces also remains unproven. “In many cases, fish farmed in Asia and imported to the US have been raised on diets of chicken and pig feces.” This according to a July 15, 2013 article by MSNBC but in an update at the bottom of this same article cites a denial by a member of the U.S. Food and Drug Administration. “ FDA spokesperson Theresa Eisenman flatly denied that the widespread practice of feeding feces to farmed fish occurs.” Eisenman said, “We are not aware of evidence to support the claim that this practice is occurring in China, Both domestic and imported seafood products are required to meet the same food safety standards. If FDA had information that an aquaculture product was raised in a manner that would violate FDA’s food safety requirements, that product would not be allowed entry into the United States.” Posted 01/19/14 ","Food - Drink"
"The Potential Dangers of Splenda / Sucralose – Disputed!","2015-03-17 18:06:31","https://www.truthorfiction.com/splenda-warnings/"," Various warnings have been circulating on the Internet that the sugar substitute, Splenda, may do more harm than good. "," According to a June 12, 2013 article by Fox News, a nonprofit public watchdog group called “ The Center for Science in the Public Interest ” issued a downgrade in “its safety rating of sucralose from ‘safe’ to ‘caution,’ meaning that the additive ‘may pose a risk and needs to be better tested.'” The article said that Italian researchers in an unpublished study discovered that “sucralose caused leukemia in mice,” and the watchdog group is still investigating the credibility of the report. Another study was condu cted by Dr. Joseph Mercola and posted on his website . Mercola wrote that “Adverse health effects related to Splenda have been reported by people around the globe, from gastrointestinal problems, seizures, dizziness, migraines, blurred vision, weight gain, and blood sugar elevation to allergic reactions.” The Splenda Frequently Asked Questions page said that “SPLENDA® Brand Sweetener has no known side effects.”   They also denied that their product caused headaches, tooth decay or damaged kidneys. Splenda users should practice moderation as such heavy tests are conducted in mass doses on lab rats. TruthOrFiction.com checked the website for any updates to the safety rating and to date there are none.    We will post any new findings on this page when we get them. Posted 02/21/14 ","Food - Drink"
"Starkist is Now Korean and Packaging Farmed Tuna from China-Truth! & Fiction!","2015-03-17 18:06:31","https://www.truthorfiction.com/starkist-korean/"," This is a forwarded email that warns that Starkist, the tuna company, is owned by Korea and alleges that their tuna may be farm raised in China. "," The parent company of Starkist is the Dongwon Group based out of Seoul, South Korea but their tuna does not come from fisheries in China.    This eRumor appears to be a new variation to the do not eat tilapia warning that went viral on the Internet in late 2013. The company’s website said that the Starkist US Headquarters is in Pittsburgh, Pennsylvania.  They also have facilities in Pago Pago, American Samoa as well as Guayaquil, Ecuador. According to the Frequently Asked Questions page on the Starkist website, “all of StarKist’s tuna is wild-caught. The majority of the tuna StarKist obtains is from the Pacific Ocean and the Western Atlantic fisheries. We do not use farm-raised tuna.” Posted 02/10/14 Related eRumors also posted on TruthOrFiction.Com: Don’t Eat Tilapia Because it Comes From China ","Food - Drink"
