"X.Title.","X.Date.","X.Url.","X.Rumor.Summary.","X.The.Truth.","category"
"Deadly Brazilian Wandering Spider Found in Bananas-Reported as Fiction!","2015-06-22 18:47:05","https://www.truthorfiction.com/deadly-brazilian-wandering-spider-found-in-bananas/"," Shoppers have been warned to check bananas for spider eggs after a woman found a nest of Brazilian Wandering Spiders, the world’s most venomous, in a bunch of bananas. "," : Don’t believe reports about deadly Brazilian Wandering Spiders (also known as Banana Spiders) being found in fruit at supermarkets. Many claims about shoppers bringing Brazilian Wandering Spiders home from the supermarket in bunches of bananas have surfaced over the years. Most have turned out to be false alarms, including one from England that went viral in June 2015. The story went viral in June 2015 when a family allegedly had to flee their home because a bunch of bananas from an Aldi supermarket was infested with Brazilian Wandering Spider eggs. The Express reported that a wildlife expert confirmed that the eggs were from a Brazilian Wandering Spider, and the store was closed for half a day while it was searched for spiders. But an Aldi spokesperson later said the eggs were not from a Brazilian Wandering Spider, and the store had been shut down as a precaution: “The safety of our customers is our absolute no 1 priority and as such, the bananas in question were immediately removed from the store as a precautionary measure. Following independent expert analysis, we can confirm that the eggs in question were totally harmless and not from the Brazilian Wandering Spider (Phoneutria fera). Whilst our bananas are of the highest quality and delivered by one of the world’s largest suppliers, these incidents, whilst extremely rare, can occur and we apologise for the distress caused to Mr Hobbs and his family. The Watling Street store in Hinckley is now fully open to customers.” Similar reports about Brazilian Wandering Spiders went viral in 2013 and 2014 . There’s a good chance that the eggs were misidentified in those cases, too. Again, eggs were found, but not the actual spider (or insect) that laid them. Richard Vetter, a retired research associate of entomology at the University of California at Riverside, told Live Science that it’s really hard to identify spider egg sacks without the spider that laid them, which often leads to confusion and false reports: “Egg sacks are much harder to identify than spiders. To identify them, you need familiarity with the spider first, then the egg sack,” Vetter said. It’s unlikely that British exterminators would be intimately familiar with the egg sacks of spiders from South and Central America, he added. However, it is possible that the eggs in question belonged to an arachnid, Vetter said. There are several genera of spider that sometimes survive the long trip from banana-producing nations — such as Brazil, Mexico, Nicaragua and Costa Rica — to other parts of the world. Among them are Phoneutria and Cupiennius, two types of spiders that are commonly known as wandering spiders. Wandering spiders are named for their tendency to wander around looking for food instead of spinning a web. As nocturnal hunters, bothPhoneutria and Cupiennius sometimes seek out shelter during the day under the broad leaves of banana trees. And because of their preference for these fruit trees, species of both genera at times wind up in grocery stores and residences in Europe and North America, Vetter said. Typically, when one of these big, hairy spiders shows up overseas, it automatically gets labeled as a “deadly” Brazilian wandering spider without anyone identifying what genus or species the spider belongs to, Vetter said. And that’s a shame, he said, because only one of the two genera of wandering spiders, Phoneutria, contains species that could actually pose a threat to humans. The other genus, Cupiennius, contains some big, but totally harmless, spiders. And reports that Brazilian Wandering Spiders are extremely deadly may be overblown, too. Richard Vetter said a study that looked at 422 Brazilian Wandering Spider bites found that only two people died, and they were both small children. TruthorFiction.com has reached out to Aldi for comment on whether the supermarket has ever actually found a Brazilian Wandering Spider at a store, and future updates will be posted here. For now, we’re reporting this one as fiction. ","Food - Drink"
"KFC Served a Fried Rat to Customer-Unproven!","2015-06-19 14:44:00","https://www.truthorfiction.com/kfc-served-a-fried-rat-to-customer/"," A KFC customer posted pictures online of what he said was a fried rat found in his food. "," Claims about KFC serving a fried rat to a customer are unproven. The controversy started when a customer posted pictures of an oddly shaped piece of fried chicken that resembled a breaded, fried rat on Facebook. The photos appeared with this caption: “Don’t eat fast food!! I went to KFC yesterday and bought a 3piece chicken tender. As I bit into it I noticed that it was very hard and rubbery which made me look at it. As I looed down at it I noticed that it was in the shape of a rat with a tail. It sent deep chills throughout my whole body! I’ve been feeling weird ever since.” KFC said the customer had refused to cooperate with them and, “We currently have no evidence to support this allegation.” KFC also said that one of the pictures shows a bite taken out of the so-called fried rat, and it “clearly shows it’s a piece of hand breaded white meat chicken.” Until the customer provides the “fried rat” to KFC for testing we won’t know if this one is truth or fiction. ","Food - Drink"
"China Injects Crabs with Toxic Preservative Formalin-Fiction!","2015-05-26 13:18:27","https://www.truthorfiction.com/china-injects-crabs-with-toxic-preservative-formalin/"," Viral reports on social media have warned people to look for injection marks on crabs that are imported from China because they may have been injected with a highly toxic preservative called formalin. "," Reports that crabs imported from China have been injected with formalin are false. Formalin can be used as an embalming fluid to preserve animal specimens and tissue samples that are studied under microscopes. It can also be diluted and used as a disinfectant to kill parasites in fish. The FDA has approved three diluted forms of formalin for use in finned food fish and fish eggs, but crab is not listed among its approved uses. The FDA approval means that these forms of formalin are “scientifically show to be safe and effective when used according to the directions on the label.” However, there haven’t been any credible reports of crab imported from China being injected with toxic levels of formalin, as the social media posts claim. And photos that appear with these social media reports don’t show crabs being injected with formalin. They are from a December 2014 blog post that warns Malaysian consumers about crabs that have been injected with a solution to make them weigh more. According to a translated version of the blog post : “Be careful when you buy crab at this time because there are reliable reports that there is a pinhole in the abdomen because the crabs have injected feared and pricked with water to preserve freshness and increase the weight of the crab.” China is among the world’s largest producers of farm-raised fish. The FDA has challenged China’s seafood imports after finding carcinogens and antibiotics in them in the past. Still, warnings that crabs from China have been injected with formalin are unfounded. ","Food - Drink"
"FDA Finds Skittles Laced with Cocaine – Fiction!","2015-05-23 10:33:08","https://www.truthorfiction.com/fda-finds-skittles-laced-with-cocaine/"," The FDA shut down Skittles factories after finding that the candy is made with cocaine. "," This hoax was started by a fake news website. The fake news website Huzlers first reported that the FDA had found “cocaine everywhere” during surprise inspections of Skittles factories: “Today, multiple Skittles factories were busted after it was discovered that they have been using cocaine to make their Skittles. The factories were busted after FDA inspectors unexpectedly decided to inspect all Skittles factories nationwide. According to authorities, the factory was filled with ‘cocaine everywhere,’ all over workers’ faces, and Skittles batches.” The fake report about cocaine-laced Skittles was quickly shared more than 10,000 times on social media sites. Taken out of context, many social media users were tricked into believing that the story was true. But the disclaimer for Huzlers states that website’s stories are, “Bad fake news poorly written.” ","Food - Drink"
"Urine in Arizona Tea-Fiction!","2015-04-28 19:48:07","https://www.truthorfiction.com/urine-in-arizona-tea/"," The FDA has discovered that the makers of Arizona Iced Tea add human urine to their iced tea product, and therefore there will be a recall in 2015 of all their products. "," A fake news website started the false report that Arizona Iced Tea contains human urine. The fake news website Huzlers first reported that the FDA had exposed the Arizona Beverage Company adding human urine to its products: “Upon being unexpectedly inspected a few days ago, FDA inspectors visited five of Arizona’s biggest factories in the United States and what they discovered was shocking. They discovered thousands and thousands of gallons of large industrial containers containing human urine. But what was the urine doing in an Arizona tea factory? According to the FDA, urine has been suspected to be used in Arizona products for years and it is what gives it its signature flavor, surprisingly. About 6% of Arizona cans are made up of human urine.” Huzlers describes the website’s content as “bad fake news poorly written.” Nevertheless, social media users spread its false report that human urine had been found in the Arizona Beverage Company’s products. One Facebook user commented : “I’ve contacted (Arizona) multiple times with no answer regarding my issue. I will be pursuing a lawsuit for the urine in the bottles. I am not waiting any longer. You guys messed with the wrong customer. My lawyer will be contacting the company by the end of the week.” Arizona responded : “The rumor you’re referring to is not true. The site that it originated on is a self-proclaimed ‘notorious urban satirical entertainment website with the most shocking headlines and articles.” ","Food - Drink"
"Fetal Cells Are Ingredients in Food and Drinks-Fiction!","2015-04-17 15:24:48","https://www.truthorfiction.com/fetal-cells-are-ingredients-in-food-and-drinks/"," Embryonic kidney cells from aborted babies are used as an ingredient in food and drinks. "," Cells from aborted babies aren’t used as ingredients in food and drinks. The claim first emerged in 2011 when Senomyx, a company that develops flavor ingredients, announced a partnership with PepsiCo. Their goal was to develop “high-potency sweeteners” to reduce the amount of sugar in soft drinks. At the time, the anti-abortion group Children of God For Life issued a press release that said Senomyx had used human embryonic kidney cells (also called HEK 293) to test its products. The group called for a boycott of companies that had partnered with Senomyx. The original claim that Senomyx had used HEK 293 to test its products appears to be true. But that original claim has morphed over the years. Today, viral emails and blogs claim that cells from aborted babies are used as ingredient, which is false. The HEK 293 cell line dates back to the 1970s. Today, it’s commonly used to test new drugs and vaccines, Forbes reports : “The cells, called HEK 293 cells (that stands for human embryonic kidney) were taken from an aborted fetus in the 1970s in the Netherlands. Bits of chopped up DNA from the adenovirus, a virus that causes a pretty severe cold. The kidney cells were forced to take up bits of DNA using a technique invented in 1973 that used a calcium solution. The resulting cells don’t act much like human cells at all, but they are very easy to work with and have become workhorses of cellular biology. That’s why they’re used in the development of drugs and vaccines. No new fetal tissue has been used to keep the cell culture going; the use of this cell line isn’t leading to new abortions.” It seems that Senomyx has engineered HEK cells to function as human taste-receptor cells, ABC News reports : “This way, Senomyx can test millions of substances to see if they work as different types of taste enhancers without subjecting human volunteers to endless taste tests.” In 2008, Senomyx was awarded a patent on “recombinant methods for expressing a function sweet taste receptor” that lists HEK 293 as part of the process. CBS News found in 2011 that many of the company’s 77 patents listed HEK 293. The Miami New Times asked Gwen Rosenberg, the vice president of investor relations and corporate communications at Senomyx, about it in a 2011 interview : “Asked about the action alert, Rosenberg said, ‘We don’t discuss details of our research, but you won’t find anything on our website about HEK 293.’ I asked Rosenberg if Senomyx had a position on stem cell research. ‘We’ve never been asked that,’ she replied, ‘We don’t have a position on anything. We’re dedicated to finding new flavors to reduce sugars and reduce salt. Our focus is to help consumers with diabetes or high blood pressure have a better quality of life.’” So, while it appears that HEK 293 cells are used to develop and test new ingredients, the claim that the cells themselves are used for ingredients is false. ","Food - Drink"
"Canine Carry Outs Dog Treats Poison Dogs with Antifreeze-Fiction!","2015-04-01 09:17:29","https://www.truthorfiction.com/canine-carry-outs-dog-treats-poison-dogs-with-antifreeze/"," Social media posts warn dog owners not to give their dogs Canine Carry Outs brand dog treats because an anti-freeze called propylene glycol is listed in its ingredients and will poison their pet. "," This one has a sliver of truth, but it’s mostly fiction. The panic was started by Facebook posts like this one that warn dog owners not to feed their pets bacon flavored Canine Carry Outs because it contains propylene glycol, an anti-freeze agent: “Please check the ingredients of the dog foods and treats you are feeding your pets. If it contains propylene glycol, DO NOT feed to your pets. Propylene Glycol is just another name for Antifreeze!!!” It’s true that propylene glycol is listed as an ingredient in Canine Carry Outs dog treats, but that doesn’t mean that they are hazardous to your dog’s health. In fact, chances are that many pet owners that worry about feeding their dogs propylene glycol eat or drink it themselves on a regular basis. It’s commonly used as an anti-freeze by the food and beverage industries to prevent leaking water from coming into contact with food, the Centers for Disease Control and Prevention reports : “Propylene glycol has been approved for use at certain levels in food, cosmetics and pharmaceutical products. If you eat food products, use cosmetics or take medications that contain it, you will be exposed to propylene glycol, but these amounts are not considered harmful.” The FDA says that humans and pets can safely eat propylene glycol if it doesn’t account for more than 5% of total food intake. Canine Carry Outs are made by Big Heart Pet Brands (formerly Del Monte Pet Products). TruthorFiction.com has reached out to the company for comment. Future updates will be posted here. ","Food - Drink"
"Pepsi Cuts “Under God” from Pledge of Allegiance on Cans-Fiction!","2015-03-30 18:08:51","https://www.truthorfiction.com/pepsi-cuts-under-god-from-pledge-of-allegiance-on-cans/"," New cans of Pepsi will feature the Pledge of Allegiance without the phrase “under god.” "," This eRumor was sort of true at one time, but it’s not anymore. Reports that “under god” had been left off cans of soda showed up after the 9/11 terrorists attacks. TruthorFiction.com investigated back then, and we found that Dr Pepper — not Pepsi — had in fact released a can of soda that said “One Nation … Indivisible” across the top. Click here for the story. Critics said that Dr Pepper left out “under god” because the company wanted to be politically correct. The led some to call for boycotts of the soda. The Dr Pepper Snapple Group responded : “In recent days, several news media outlets in the country have reported on a special edition Dr Pepper can that was created to show support for the patriotic fervor that has been sweeping America since the tragic events of Sept. 11, 2001, and to show the world that we are a united nation of people who place a high value upon freedom. Much of the information being circulated on this subject is incomplete or inaccurate. Here are the facts: “The can, released last November, features an image of the Statue of Liberty along with the words ‘One Nation … Indivisible.’ “The special packaging was designed to reflect our pride in this country’s determination to stand together as one. The Statue of Liberty and Pledge of Allegiance were chosen as two of the greatest symbols of American freedom. “Due to space limitations on the can, only a few of the 31 words from the Pledge of Allegiance could be used. The available area for graphics limited the amount of verbiage on the can. “Of the 31 words in the Pledge of Allegiance, only three were included. More than 90 percent were not included. “We at Dr Pepper/Seven Up strongly believe that the message on these cans is a resoundingly patriotic, bipartisan message that we are a united nation. “More than 41 million special edition cans were ordered by Dr Pepper bottlers in portions of a dozen states.  Because the limited edition patriotic can is to be retired in February, you will soon see regular packaging graphics for Dr Pepper at your local retail stores.” That should have settled it, but somehow the eRumor has changed over the years. Now chain emails urge people to boycott Pepsi because it supposedly left “under god” off its cans. That isn’t true. Pepsi responded directly: “You’ve received an erroneous email about a ‘patriotic can’ that Pepsi allegedly produced with an edited version of America’s Pledge of Allegiance. The truth is, Pepsi never produced such a can. In fact, this is a hoax that has been circulating on the Internet for more than six years. A patriotic package used in 2001 by Dr Pepper (which is not a part of PepsiCo) was inappropriately linked to Pepsi. Thanks for giving us the chance to clarify the situation and please feel free to share this message with anyone else who may have received the erroneous email.” It’s not unusual for eRumors to morph over the years, and it appears that’s what happened here. ","Food - Drink"
"Halal Meat at Costco-Unproven!","2015-03-30 18:06:20","https://www.truthorfiction.com/costco-halal-meat/"," This is a forwarded email that said that Halal meats are beginning to appear at the meat sections at Costco all over the U.S and Canada. "," We have not found any evidence of a national program to sell Halal meat at Costco. This eRumor has been circulating for a few years and seems to go viral every year around the months of October and November.   We sent our Truth or Fiction team to a local Costco in Signal Hill, California on a fact finding tour on October 30, 2013. We took the above photo at the Signal Hill Costco, which appeared similar to the photo that appeared in the eRumor, but found no Halal meats on display. At the time of our investigation we checked the Costco website and found a variety of Kohsher products but there were no Halal products listed by the big box vendor. We are not ruling out that this could have possibly been a one time seasonal promotion in an area where there is a large demographic of Muslims, such as Dearborn, Michigan.  We are still trying to reach a spokesperson at Costco for a statement. Blogger Ann Barnhardt is mentioned in the eRumor but we did not find any articles about Halal products on her website . Posted 11/19/13 Related eRumors: Ann Barnhardt’s Response to a Death Threat ","Food - Drink"
"McDonald’s Uses Worm Meat Fillers-Fiction!","2015-03-29 18:06:26","https://www.truthorfiction.com/mcdonalds-worm-burgers/"," Warnings have gone viral on the Web alleging that McDonalds fast food chains are filling their burgers with worm meat. "," The source for this hoax is a fictional news website called DailyBuzzLive.com . McDonalds has a statement on its website that said the company’s meat comes from 100% USDA-inspected beef. Screenshot from McDonald’s website Posted 04/24/14 ","Food - Drink"
"Train in Brussels is World’s Longest Chocolate Structure-Truth!","2015-03-25 21:40:50","https://www.truthorfiction.com/chocolate-train-05012013/"," This is a forwarded email with photos of what appears to be a train, sculpted from chocolate, on display at a train station in Brussels.  The email alleges that this is the world’s longest chocolate structure. "," This train holds the Guinness world record for being the longest chocolate structure, according to a November 20, 2012 article by Reuters. The article said, “A train made entirely out of chocolate was unveiled to set a new world record as the longest chocolate structure ever made. The train is 34 meters or 112-feet long and weighs 1250 kilograms, or nearly 2800 pounds.”  The sculpture was made by Andrew Farrugia who took over 700 hours to build the chocolate train that is now on display at Brussels south station. Posted 05/01/13 ","Food - Drink"
"Lawsuit Claims California Wines Have Unsafe Amounts of Arsenic – Truth! & Misleading!","2015-03-23 17:36:15","https://www.truthorfiction.com/lawsuit-claims-california-wines-have-unsafe-amounts-of-arsenic/"," A lawsuit claims that some brands of California wine have dangerously high levels of arsenic. "," It’s true that a number of California wineries were sued for high levels of arsenic in their wines, but the lawsuit is misleading. The class action lawsuit claims that 28 California wineries bottled wine that had unsafe levels of inorganic arsenic. It said there was 500% more arsenic in some wine samples than is allowed in drinking water: “Defendants produce, manufacture and/or distribute wine in California that contains inorganic arsenic in amounts far in excess of what is allowed in drinking water. Defendants do not warn that their products contain unsafe amounts of inorganic arsenic, nor do they disclose even the existence of inorganic arsenic in the wine.” The problem is that it’s misleading to compare the allowable arsenic levels of drinking water and wine. The EPA allows arsenic levels to reach 10 parts per billion (ppb) in drinking water — but there aren’t any specific limits on allowable arsenic levels in wine. Even so, that doesn’t mean that arsenic levels in California wines are unsafe or toxic. Other countries allow much more arsenic in wine than the EPA allows in drinking water. The International Organization of Vine and Wine, which regulates wine makers in 45 countries, sets the limit for total arsenic in wine at 200 ppb. In Canada and the European Union, the limit is 100 ppb. Besides, the lawsuit doesn’t attack the California wine makers for dangerous amounts of arsenic. It claims the companies broke state laws because they didn’t disclose that there was any arsenic at all in their wines on the labels. That basically means that every California winery would have to make the same disclosure, because arsenic is in almost all food and drinks. The Wine Institute, which represents 1,000 California wineries, called the lawsuit “irresponsible” in a statement : “Arsenic is prevalent in the natural environment in air, soil and water, and in food. As an agricultural product, wines from throughout the world contain trace amounts of arsenic, as do juices, vegetables, grains and other alcohol beverages. There is no research that shows that the amounts found in wine pose a health risk to consumers. “The U.S. Tax and Trade Bureau (TTB), the agency that regulates wine, beer and spirits, monitors wines for compounds, including arsenic, as part of its testing program as does FDA as part of its Total Diet Study. While there are no established limits in the U.S., several countries, including the European Union, have established limits of 100 parts per billion or higher for wine. California wine exports are tested by these governments and are below the established limits.” Whether or not the federal government should set limits for the amount of arsenic allowed in wine is open for debate. But even if it does, the level won’t be the same as drinking water’s, which is what the eRumor seems to imply. ","Food - Drink"
