"X.Title.","X.Date.","X.Url.","X.Rumor.Summary.","X.The.Truth.","category"
"President Obama Bans Pork at Federal Prisons- Truth!","2015-10-13 13:22:56","https://www.truthorfiction.com/president-obama-bans-pork-at-federal-prisons/"," The Bureau of Prisons, which works at the behest of President Obama, has banned pork at federal prisons. "," It’s true that pork has been removed from federal prison menus. Pork was removed from federal prisons when the new fiscal year began in October. The fiscal year 2016 National Menu for America’s 206,000 federal inmates is pork-free. Many have questioned whether the decision to ban pork at federal prisons was made for religious reasons. Muslim prisoners that follow a halal diet are unable to eat pork. Jewish prisoners are also unable to eat pork because animals that don’t chew their cud or have split hooves aren’t considered kosher . But Edmund Ross, a spokesman for the Bureau of Prisons, told the Washington Post that the decision to ban pork was based on a survey of prisoners’ food preferences. Ultimately the decision was made, Ross said, because pork wasn’t a popular meal choice, and it’s one of the most expensive to provide. “Why keep pushing food that people don’t want to eat?” Ross said . “Pork has been the lowest-rated food by inmates for several years.” In theory, pork could be the lowest-rated menu option because the religious beliefs of Muslim and Jewish prisoners make them rate it low among available food options — but that’s not the case. Eighty-five percent of the prisoners locked up in federal and state prisons across the U.S. identify as Christian, according to the PEW Research Center . There’s no way that a small minority of Muslim and Jewish prisoners could make pork the lowest-rated food for religious reasons alone. But Dave Warner, a spokesman for the National Pork Producers Council, said that it was hard to believe that a survey would find a majority of any population — let alone federal prisoners — who say they don’t want bacon: “We’re going to find out how this came about and go from there,” Warner said. “We wouldn’t rule out any options to resolve this.” He said the association “is still formulating our strategy” to reverse the prison decision, which the industry first learned about Monday when the Fort Worth Star-Telegram called for comment. So, it’s true that the Bureau of Prisons has banned pork at federal prisons. As of now, however, the only reason given for the change is that prisoners don’t like it. ","Government"
"FEMA’s First Concentration Camp, Camp Alpha, Opens in Arizona-Fiction!","2015-10-12 12:40:15","https://www.truthorfiction.com/femas-first-concentration-camp-camp-alpha-opens-in-arizona/"," FEMA has opened Camp Alpha, the first of four planned political realignment facilities, in Wilcox, Arizona. "," FEMA has not opened Camp Alpha in Wilcox, Arizona. That rumor started with a report that appeared at the fake news website National Report . The fake report claims that Camp Alpha was built on 500 acres of federal property in southwest Arizona: The facilities, which were ordered and authorized through two-dozen executive orders by President Barack Obama the day he took office on January 20th, 2009, will serve as special camps for conservative-leaning Americans who openly dissent against the Obama Administration and the Democratic party, through Facebook status updates, Tweets, blog posts, or in private conversations intercepted by FEMA. Once conservatives have been rounded up, FEMA will use enhanced interrogation techniques and “Clockwork Orange”- style machinery to effectively brainwash the conservatism out of an inmate, after which they can be reentered into the population with a more liberal, progressive worldview. The story has been shared on social media sites more than 83,000 times, and many readers have been duped into believing that FEMA has actually opened Camp Alpha to “re-educate” conservative Americans. But National Report isn’t a trusted source of news, according to the website’s disclaimer : National Report is a news and political satire web publication, which may or may not use real names, often in semi-real or mostly fictitious ways. All news articles contained within National Report are fiction, and presumably fake news. Any resemblance to the truth is purely coincidental. Advice given is NOT to be construed as professional. If you are in need of professional help, please consult a professional. National Report is not intended for children under the age of 18. Many conspiracy theories about so-called “FEMA camps” have gone viral over the years. TruthorFiction.com has investigated rumors that FEMA has purchased $1 billion worth of disposable coffins and that the agency has made preparations for the zombie apocalypse . Like previous one, the rumor that FEMA has opened its first concentration or death camp in southwest Arizona is false.","Government"
"After Requiring Voter ID, Alabama Closes DMV Locations in Black Counties-Truth!","2015-10-09 13:40:04","https://www.truthorfiction.com/after-requiring-voter-id-alabama-closes-dmv-locations-in-black-counties/"," The Alabama Legislature has closed many DMV locations in majority black counties after passing a law that requires voters to show photo ID. "," It’s true that many DMV locations in areas where mostly black people live have been closed, and that Alabama has a law on the books that requires voters to show photo ID. The Alabama Law Enforcement Agency (ALEA) announced on September 30, 2015, that 31 driver license offices would be closed due to an $11 million cut in state funding for the ALEA: An $11 million cut in the new General Fund appropriation to the Alabama Law Enforcement Agency (ALEA) will force the elimination of travel to 31 part-time, non-state owned, satellite locations. Effective today, the traveling Driver License Examiners will be reallocated to staff District Driver License Offices full-time. The reallocation of the Driver License Examiners comes one day before the effective date of the General Fund Budget passed during a special legislative session. The appropriation to ALEA was reduced in the new budget from $55,758,744 to $44,640,937. “Since the Jan. 1, 2015 implementation date of ALEA, my staff and I have worked hard to make improvements and optimize customer convenience to the citizens of Alabama. In July, I announced several advancements that will help the Driver License issuance process including online scheduling, online driver license renewals and duplicates, self-serve kiosks, digital licensing for smart phones, and statewide equipment upgrades. Since making that announcement, we have had over 40,000 transactions online,” said Secretary of Law Enforcement Spencer Collier. “The impact of the changes due to the budget cuts will be lessened because of the implementation of these technology-based services, including online renewals.” John Archibald, a columnist for the Alabama Media Group, noted that the majority of Alabama’s driver’s license office closures were in places with majority black populations that had high voter turnout: Take a look at the 10 Alabama counties with the highest percentage of non-white registered voters. That’s Macon, Greene, Sumter, Lowndes, Bullock, Perry, Wilcox, Dallas, Hale, and Montgomery, according to the Alabama Secretary of State’s office. Alabama, thanks to its budgetary insanity and inanity, just opted to close driver license bureaus in eight of them. All but Dallas and Montgomery will be closed. Look at the 15 counties that voted for President Barack Obama in the last presidential election. The state just decided to close driver license offices in 53 percent of them. Look at the five counties that voted most solidly Democratic? Macon, Greene, Sumter, Lowndes and Bullock counties all had their driver license offices closed. Look at the 10 that voted most solidly for Obama? Of those, eight – again all but Dallas and the state capital of Montgomery – had their offices closed. Because Alabama enacted a photo ID requirement for voters in 2011, many believed that the closures would make it more difficult for residents in those areas to renew or obtain an ID card or driver’s license. One of those people was Alabama state Rep. Terri Sewell, who requested that U.S. Attorney General Loretta Lynch launch an investigation into the closures: “It is disappointing, and unconscionable that Alabama would heighten its requirements to vote without also increasing the available options to meet these requirements. Closing 31 driver’s license offices across the state only heightens the disparities in voting between low-income and higher-income communities, and would disproportionately impact the residents of the 7th Congressional District.  These closures will potentially disenfranchise Alabama’s poor, elderly, disabled and black communities. “My constituents are the least able, and least likely to have access to transportation – either public or private – and thus travel across county lines for a driver’s license. ","Government"
"President Obama Has Ordered “Behavior Experiments” on Americans-Mostly Fiction!","2015-09-18 14:42:44","https://www.truthorfiction.com/president-obama-has-ordered-behavior-experiments-on-americans/"," President Obama has ordered behavioral experiments to be carried out on the American public through an executive order. "," It’s true that President Obama signed an executive order encouraging federal agencies and departments to use behavioral insights when making policy decisions. And it’s also true that behavioral insights can be gleaned through experimentation, but those two things have been patched together to create a fictional narrative that the executive order authorizes mass “behavioral experimentation” on Americans. Those rumors spread across blog sites after the president signed the executive order calling for the use of “behavioral science insights to better serve the American people.” These blog sites replaced the term “behavioral sciences” with the more ominous-sounding term “behavioral experiments” — but that term doesn’t actually appear anywhere in the executive order. The word “experimentation” does, however, appear in the definition of behavioral sciences in the Psychology Dictionary: A scientific discipline which studies the actions and interactions of organisms, particularly humans and animals. These activities are monitored through observational and experimental means, and they may be observed under natural or controlled conditions. This branch of science includes studies like psychology, psychiatry, sociology, biology, anthropology, psychopharmacology, etc. That led websites like D.C. Clothesline to report that Obama had instructed federal agencies to “conduct mass behavioral experiments on U.S. citizens,” and to liken the move to the rise of Nazi Germany: Obamabots, liberals, and individuals intent on destroying this nation’s republic form of government will cheer for the “behavioral experimentation” on everyone. It’s a way to use behavioral altering methods to brainwash the populace to accept the socialist/dictator agenda. Face facts friends, the citizens of this nation are nothing more than mice in a maze, Pavlov’s dog, or mice in a glass cage to study to the ones occupying elected positions and positions of power in Washington, DC. Through the executive order, however, Obama “encouraged” federal agencies and departments to “identify policies, programs, and operations where applying behavioral science insights may yield substantial improvements in public welfare, program outcomes, and program cost effectiveness.” There’s no mention of behavioral experiments. The overall purpose of the executive order is stated: To more fully realize the benefits of behavioral insights and deliver better results at a lower cost for the American people, the Federal Government should design its policies and programs to reflect our best understanding of how people engage with, participate in, use, and respond to those policies and programs. By improving the effectiveness and efficiency of Government, behavioral science insights can support a range of national priorities, including helping workers to find better jobs; enabling Americans to lead longer, healthier lives; improving access to educational opportunities and support for success in school; and accelerating the transition to a low-carbon economy. The executive order also states that the behavioral insights policy will be unrolled through the National Science and Technology Council’s Social and Behavioral Sciences Team (SBST), which was launched in January 2014 to “better serve the nation while saving taxpayer dollars.” The SBST has carried out a number of pilot projects over the last year, many of which have used behavioral science to make government communications more effective: SBST had a successful first year, launching a wide variety of evidence-based pilots with objectives ranging from connecting veterans with employment and educational counseling benefits to helping struggling student borrowers understand their loan repayment options. In one recent pilot, SBST collaborated with the Department of Defense (DOD) to help members of the Armed Forces continue contributions to their Roth Thrift Savings Plans. Due to a change in the military pay system in January 2015, nearly 140,000 members needed to re-enroll in their plans online, or else their contributions would be suspended indefinitely. SBST worked with DOD to redesign their planned communications to better serve our service members, by making the language clear and concise, charting out clear action steps for service members to take, and personalizing the emails. Results from the first week of the pilot indicated that the redesigned email led 22% more service members – 3,770 individuals – to re-enroll compared to the original message. Since the redesigned email was more effective at prompting re-enrollment after just one week, DOD sent a version of the redesigned email to the entire population in follow-up messages, demonstrating the rapid scalability of insights from these types of low-cost pilots. So, it’s true that Obama has “encouraged” federal departments and agencies to use behavioral sciences when possible, but claims that the president has ordered behavioral experiments on Americans are fictional. ","Government"
"Judge Tonya Parker Refuses to Perform Heterosexual Marriages-Previously Truth! Now Resolved!","2015-09-08 11:13:38","https://www.truthorfiction.com/judge-tonya-parker-refuses-to-perform-heterosexual-marriages/"," Dallas County Judge Tonya Parker refused to perform marriage ceremonies until homosexuals were allowed to wed. "," It’s true that Judge Tonya Parker refused to perform marriage ceremonies back in 2012, but she has started performing them again. Judge Tonya Parker said that she would not perform any legal marriage ceremonies in her courtroom until homosexual couples were allowed to wed back in February 2012. During an address to the Stonewall Democrats of Dallas, Parker said “I use it as my opportunity to give them a lesson about marriage inequality in this state because I feel like I have to tell them why I’m turning them away. So I usually will offer them something along the lines of, ‘I’m sorry. I don’t perform marriage ceremonies because we are in a state that does not have marriage equality, and until it does, I am not going to partially apply the law to one group of people that doesn’t apply to another group of people.’ And it’s kind of oxymoronic for me to perform ceremonies that can’t be performed for me, so I’m not going to do it.” Judge Tonya Parker kept her pledge for three years. She didn’t perform a courtroom wedding until June 2015, after the U.S. Supreme Court ruled that state bans on same-sex marriages were unconstitutional. After Parker married a same-sex couple that had been together for 28 years, she said , “The decision today represents an opportunity where I can now marry couples that come to the courtroom, like any other judge.” Tonya Parker, who is openly gay, has served as a judge since 2010. She was last elected to the 101st District Court seat in 2014. Reports of Tonya Parker’s refusal to perform marriage ceremonies went viral after Kim Davis, a Kentucky county clerk, was jailed for contempt of court after she refused to issue marriage licenses to same-sex couples. Comparisons between Tonya Parker and Kim Davis have sparked controversy because Davis was jailed for her stand, and Parker was not. A similar situation that played out in Oregon helps explain why. Many questioned why Vance Day, a county judge from Oregon, wasn’t thrown in jail for contempt of court after he refused to perform same-sex weddings, Oregon Live reports : “The clerk in Kentucky is required to issue marriages license,” Washington County Senior Judge Gayle Nachtigal said Friday. “That’s part of her job.” For an Oregon judge, the situation isn’t so clear. State law allows a wide range of officiants at marriage ceremonies. Among those allowed to conduct such proceedings, are state judges, federal judges, county clerks and religious congregations Legal experts agree that judges here aren’t required to perform weddings. But if they do, can they choose not to officiate for some couples? “Whether they could decide, ‘I’m not going to marry same-sex couples, interracial couples, or a very young person to a very old person,'” Nachtigal said, “I don’t know that that would be allowed ultimately.” If a judge offers officiating services to the public, but only some of the public, “that’s when it starts to look like state-sanctioned discrimination,” said Mat dos Santos, legal director for the American Civil Liberties Union of Oregon. If a judge stopped performing all weddings to avoid officiating for gay couples, dos Santos said, that would be disappointing but probably the most legally defensible practice. So, Tonya Parker’s refusal to conduct wedding ceremonies held up for two reasons. First, judges aren’t required by law to perform marriages, they’re optional. Second, Tonya Parker refused to officiate all weddings — not just a particular type of wedding. ","Government"
"Maine Welfare Reforms Have Led to Big Welfare Declines-Mostly Fiction!","2015-08-25 17:41:32","https://www.truthorfiction.com/maine-welfare-reforms-have-led-to-big-welfare-declines/"," Blog sites are reporting that reforms made to Maine’s welfare program have led to a massive reduction in the number of people who collect welfare in the state. "," Maine has made a number of welfare reforms in recent years, but claims about the impact they’ve had on welfare numbers in the state have been exaggerated or are incorrect. Maine Gov. Paul LePage made welfare reform a key issue in his 2014 reelection campaign, but the reform that has made the biggest impact in the state took effect before Gov. LePage’s re-election. In July 2014, Gov. LePage announced that Maine would no longer seek a federal waiver that allowed some able-bodied adults to receive food stamps without meeting minimum work requirements. That means those who receive food stamps in Maine have to work 20 hours a week, volunteer at a community agency or enroll in a vocational program, the Portland Press Herald reports : (The Maine Department of Health and Human Services) has identified 12,000 current recipients in Maine who fit that definition. They represent about 5 percent of all food stamp recipients and collectively receive about $15 million per year in benefits, or about 4.4 percent of all food stamp dollars that come to Maine. It’s not known how many of these would fail to satisfy the work requirement. By April 2015, Maine had seen a “dramatic drop” in able-bodied adults on food stamps. In the first four months of 2015, the number of able-bodied adults on food stamps in the state had dropped 70%, from 12,000 to 2,680. Still, the claim that Maine welfare reform has led to a “nearly 80% reduction in welfare” isn’t true. It led to a 70% reduction in able-bodied adults who receive food stamps — who made up about 5% of all food stamp recipients before the reform took effect. So, a claim making its way around the blogosphere that Maine has seen an 80% reduction in welfare recipients is false. And a number of Maine’s welfare reforms sited in these blog posts have only been in effect for months, so their impact isn’t yet known. In April 2015, for example, Maine started drug screening some recipients of the Temporary Assistance for Needy Family program (commonly known as TANF) who had criminal records. By June 2015, just 15 recipients had drug screenings scheduled. Thirteen didn’t show up, and one failed the drug test, the Associated Press reports . In June 2015, Gov. LePage said Maine would move forward with a plan to cut off general assistance benefits to illegal aliens and undocumented immigrants. DHHS Commissioner Mary Mayhew estimated the plan would affect about 1,000 people and would save the state about $1 million a year, the Portland Press Herald reports . So those welfare reforms may reduce the number of beneficiaries in the state at some point, but they haven’t been around long enough to make a difference. ","Government"
"Nuclear Deal Sends $150 Billion to Iran-Mostly Truth!","2015-08-17 13:56:21","https://www.truthorfiction.com/nuclear-deal-sends-150-billion-to-iran/"," Donald Trump said on NBC’s “Meet the Press” that a nuclear deal with Iran would send $150 billion to Iran, even if it’s not approved by Congress. "," This one is mostly true, but some of the details are a little fuzzy. Donald Trump said that the $150 billion would go to Iran even if Congress didn’t approve the nuclear deal during an August 16 appearance on NBC’s “Meet the Press”: “The problem is by the time I get in there, they will have already receive the $150 billion. Do you know if the deal gets rejected they still get the money? Which is something I found out a week ago. I couldn’t believe it. If the deal gets rejected, they still get all of this money. Iran is going to be unbelievably powerful and unbelievably rich.” Under the nuclear deal, Iran would have access to billions of dollars in assets that were frozen in foreign accounts due to previous nuclear sanctions. But the exact amount of Iran’s windfall, and the idea that Iran would get the assets even if Congress doesn’t approve the deal, aren’t sure things. Sanctions placed on Iran because of its nuclear program froze billions of dollars of Iran’s assets in foreign accounts. The nuclear deal would unfreeze those accounts, which the White House has estimated could send up to $150 billion to Iran. But Obama administration officials said that Iran wouldn’t receive the full $150 billion in frozen assets because the country owes billions to China and other countries. After repaying those debts, Iran would receive about $56 billion. Others have argued that Iran would leave the $150 billion in foreign accounts because repatriating it could hurt its economy, the Daily Beast reports : The money is unlikely to be repatriated back to Iran. Administration officials and critics alike predict that Iran will keep much of its assets overseas, since a sudden influx of funds into the country could drive up the cost of the Iranian currency, making it more expensive for foreign buyers to purchase Iranian goods and services. “It’s already in foreign accounts, so it’s not part of the normal budgeting process. It’s just ready cash… so you can start distributing it abroad very easily,” said Hudson Institute Senior Fellow Michael Doran. “It would be very easy for them not to repatriate it.” Also, the idea that the nuclear deal would send $150 billion to Iran even if Congress doesn’t approve it isn’t necessarily a given. Other countries would have to lift sanctions on Iran even if the U.S. doesn’t for that to happen. So, some of the details are up in the air, but the claim that the nuclear deal could send up to $150 billion to Iran is mostly true. ","Government"
