"X.Title.","X.Date.","X.Url.","X.Rumor.Summary.","X.The.Truth.","category"
"Over Five Million Health Care Polices Cancelled After ACA Roll Out – Special Report!","2015-03-17 21:40:46","https://www.truthorfiction.com/aca-5-million-cancellations/"," When discussing the Affordable Care Act (ACA), President Obama, on several occasions, promised Americans that if they have health insurance they could keep their old polices.   The President also said that if Americans liked their doctors they could keep their doctors. After the Obamacare roll out over 5 million people in the US have been notified by mail of policy cancellations from their health insurance companies because they do not meet up to the standards of the new law. "," There have been several reports from various news agencies, including CBS , Forbes , NBC and Fox that said millions throughout the U.S. are loosing their health insurance coverage.  The number has exceeded five million and it is expected to grow larger. The Obama administration “knew millions could not keep their health insurance.” This according to an October 28, 2013 article by NBC , which also warned that “50 to 75 percent of the 14 million consumers who buy their insurance individually can expect to receive a ‘cancellation’ letter or the equivalent over the next year because their existing policies don’t meet the standards mandated by the new health care law.” The state of California was hardest hit, according to a November 12, 2013 article by a CBS-TV affiliate in Sacramento that said, “More than 1 million cancellation notices have been sent to Californians as the Affordable Care Act begins allowing individuals to buy insurance through exchanges.” On November 20, 2013, citing the independent analysis of the American Enterprise Institute, a Fox News article said that 50 to 100 million more people are expected to lose there health insurance policies. Insurance Premium Sticker Shock To make matters worse, the ACA is driving premium costs higher.  On November 6, 2013, NBC News reported that the new conditions set into policies “To a larger degree than other requirements of the law, it is fueling the ‘sticker shock’ now being voiced by some consumers about premiums for new policies, say industry experts.”  This means people will either have to pay more to get similar coverage to what they are used to or shop for a plan with a higher deductible and less benefits. On November 7, 2013 President Obama, in an interview on NBC News, said that he was sorry “to Americans who are losing their health plans.”   This according to a Washington Post article dated the same day. As of November 2, 2013, Health and Human Services Secretary Kathleen Sebelius said that 106,185 people have signed up for new health care policies, a number 1/5 the number of enrollments anticipated by the Obama Administration.  This according to a November 13, 2013 article by CNBC. Keep Your Health Plan Act On October 28, 2013 HR-3350: Keep Your Health Plan Act of 2013 was introduced in the House of Representatives and is currently in the committee process.  The purpose of the bill is  “to authorize health insurance issuers to continue to offer for sale current individual health insurance coverage in satisfaction of the minimum essential health insurance coverage requirement, and for other purposes.” There are also a couple of bills on the Senate side. On October 30, 2013 S. 1617: If You Like Your Health Plan, You Can Keep it Act was introduced by Senator Ron Johnson (R-WI).  It is currently in the committee process and has 43 Republican Senators sponsoring the bill. On November 4, 2013 Senator Mary Landrieu (D-LA) introduced S. 1642: Keeping the Affordable Care Act Promise Act .  The bill currently has five sponsors, including California’s Senator Dianne Feinstein. On November 13, 2013 Fox News reported that the “House Democrats delivered a fix-it-or-else ultimatum Wednesday to President Obama, giving his administration until Friday to find an affordable solution for the millions of Americans losing their health plans under ObamaCare — or risk some Democrats backing a Republican solution.”   The article also said that the “ultimatum from President Obama’s own party is another sign of the unrest within the Democratic caucus about the cancellation notices.”   It is unknown if the Democrat Representatives would support the HR-3350 bill if the administration fails to come up with an alternative solution. There are resources on the Govtrack.com site for people to follow the bill and call their Congressional Representatives to urge them to support the bill.    Concerned citizens should also call the White House at (202) 456-1414 and ask the President to support the bill by encouraging the Senate to read the bill and vote for it. Posted 11/13/13  Updated 11/25/13 Related eRumors: Various eRumor about the proposed Health Care Bill Dhimmitude Established by ACA Exempts Moslem From Enrollment ","Government"
"Shakespeare or Julius Caesar quote about war-Fiction!","2015-03-17 20:42:38","https://www.truthorfiction.com/war-rightsquote/"," A quote attributed to Shakespeare or Julius Caesar warns about the seductive nature of war and that citizens who get caught up in the emotions of it could lose their rights as a result. "," The exact quote is below, but there is no evidence that it originated in antiquity. TruthOrFiction.com has searched the complete works of Shakespeare and the writings of Julius Caesar as well as other historic texts and has not found this quote in any of them.  Some emails have claimed that it is a quote from Julius Caesar’s writings about THE GALLIC WARS, but there is nothing of this nature in those texts.  We’ve also searched several collections of quotes without success. According to our records, this quote started appearing on the Internet toward the end of 2001 and usually appeared in emails, articles, or newsletters that dealt with the subject or war or the risk of losing personal rights during a time of war.  That was a hot topic of discussion after the Attack on America and debate on how to best deal with the threat of terrorism in the United States. Update 10/1/02, entertainer Barbara Streisand admitted in the Washington Post that she got duped by this circulated quote and used it during a $6 million Democratic fund-raiser in Hollywood on September 30, 2002.  She later corrected it on her website and said she learned a lesson from it. We would suggest that the lesson is to check with TruthOrFiction.com before using quotes from forwarded emails! Last updated 10/1/02 ","Government"
"Religious significance of George Washington and the Washington memorial-Mostly Truth!","2015-03-17 20:42:38","https://www.truthorfiction.com/washmonument/"," The eRumor describes some of the inscriptions and design of the Washington Monument in Washington D.C. in light of controversy over references to God in government settings. "," This one’s got many statements in it, so let’s take them one by one. The words “Laus Deo” on the cap of the monument- Truth! There is an aluminum point crowning the apex of the monument. There are four sides, each facing a point of the compass.  According to the National Park Service, the north side lists the members of the joint commission that was in charge of the Washington monument project.  The west side lists the dates of the laying of the cornerstone, the first stone laid at the height of 152 fee, and the the setting of the capstone. The south side lists the names of chief engineer, the architect, and some of the workmen.  The east side simply has the words “Laus Deo” which is translated as “Praise be to God.” Washington DC was laid out to be in the design of a cross- Fiction! It seems to be in the form of a cross, but there’s no evidence that was the intent of the designer, architect Pierre Charles L’Enfant.  If one sees the layout of White House, the Jefferson Memorial, the Capitol, and The Lincoln Memorial as the intended cross, it was not in the mind of Charles L’Enfant because he proposed the original design in 1791, which was long before it was decided that the Lincoln and Jefferson memorials would be built and where (1911 and 1934). On the 12th Landing is a prayer offered by the City of Baltimore- Truth! There is a memorial stone in the wall at the 140-foot level with the following blessing: “May heaven to this union continue its beneficence.  May brotherly affection with union be perpetual. May the free constitution which is the work of our ancestors be sacredly maintained and its administration be stamped with wisdom and virtue.” On the 20th landing is a memorial presented by some Chinese Christians- Truth! It is from Christians from the port city of Ningpo, Chekiang Province, Mainland China and is a eulogy to George Washington. On the 24th landing a presentation made by Sunday School children from New York and Philadelphia quoting Proverbs 10:7, Luke 18:16 and Proverbs 22:6.- Truth! The memorial says it is presented by the Sunday Schools of the Methodist Episcopal Church in New York and from the Sabbath School children of the Methodist Episcopal church in Philadelphia.  It then says “A preached Gospel” and “A free press” then closes with “Washington, we revere his memory.” The inscriptions include the Bible reference Proverbs 10:7. There is also an open bible on the monument that includes Luke 18:16 where Jesus said “Suffer the little children to come unto me” and Proverbs 22:6, which says “Train up a child in the way he should go, and when he is old, he will not depart from it.” When the cornerstone was laid, one of the items in it was a Bible-Truth! Several dozen items were placed into the monument at the laying of the cornerstone including, according to the National Park Service, a copy of the Bible presented by The Bible Society. Washington’s Prayer for America- Truth! But altered. This is an interesting one. This “prayer of Washington” is widely circulated and reflects his true wishes about the United States because the bulk of it comes from his own words. There is a certain lack of integrity with the prayer, however, in that he never really formally prayed it in the way that is circulated. Someone along the way decided to create the prayer from one of Washington’s letters and package it in the fabricator’s own religious cultural language. The original words from Washington are from the closing paragraph of a letter to the governors of the 13 states on the occasion of his retirement from command of the Continental Army and public life.  We consulted John C. Fitzpatrick’s collection of the writings of George Washington that are available through the University of Virginia Library and which includes the text of the letter. In the letter, Washington said that he wanted the governors to convey his words to their legislatures and that he hoped it would be regarded as coming from someone who always wished to be useful to his country and who in the shade of retirement would not fail to “implore divine benediction upon it.” Then his final paragraph contains the words of his benediction: I now make it my earnest prayer, that God would have you, and the State over which you preside, in his holy protection, that he would incline the hearts of the Citizens to cultivate a spirit of subordination and obedience to Government, to entertain a brotherly affection and love for one another, for their fellow Citizens of the United States at large, and particularly for their brethren who have served in the Field, and finally, that he would most graciously be pleased to dispose us all, to do Justice, to love mercy, and to demean ourselves with that Charity, humility and pacific temper of mind, which were the Characteristicks of the Divine Author of our blessed Religion, and without an humble imitation of whose example in these things, we can never hope to be a happy Nation. The prayer that is circulated, however, adds a formal salutation and prayer ending, changes it to King James English (used for formal prayers among many Christian groups), changes some of the wording, and leaves out words from the original.   A blessing that was written to the governors of the states about their states and their soldiers was changed to be a general prayer about the country. We even found one reference that claimed the prayer was prayed by George Washington during battle at Valley Forge. Last updated 12/5/03 ","Government"
"Call Governor Rick Perry’s Office in Texas to Get Prayer Back inSchools-Fiction!","2015-03-17 20:42:37","https://www.truthorfiction.com/texas-schoolprayer/"," The message says to call a toll free number at the office of Texas Governor Rick Perry and register your support of getting prayer back in schools.  It says that the governor is conducting a survey of Texans on the topic.  The originator of the email claims to have called and talked with someone at the governor’s office and discovered that they have received only 20,000 calls since they started taking the calls last November. "," The telephone number is authentic, but the eRumor is a hoax.  Governor Perry’s office tells TruthOrFiction.com there is no truth to the eRumor and a recording on his office phone explains that to people who call. The issue of prayer in schools is a constitutional one that would need to be handled by Congress and the courts. This is the second telephone hoax to plague governor Perry’s office in recent months.  Another false story claimed that the governor was surveying Texas citizens about whether to make the maximum speed limit 55 miles-per-hour. CLICK HERE for that story. Last updated 6/26/02 ","Government"
"Give your opinion to the Texas governor’s office on a 55 mile-per-hourspeed limit-Fiction!","2015-03-17 20:42:37","https://www.truthorfiction.com/texasmph/"," The message claims that Rick Perry, the governor of Texas, is asking Texans to call his office and let him know what they think about rolling back the maximum speed limit in the state to 55 miles per hour. "," This is a hoax.  Governor Perry’s office has told TruthOrFiction.com that there is no such survey being conducted. although the phone number is one that dials into the governor’s office. Another similar telephone hoax is circulating about an alleged survey by the governor about school prayer. CLICK HERE for the details. Last updated 6/26/02 ","Government"
"Social Security benefits to legal and illegal Mexican immigrants?-Truth!","2015-03-17 20:42:37","https://www.truthorfiction.com/totalization/"," The email says that a “totalization” agreement between the U.S. and Mexico would grant Social Security benefits to Mexicans, including some who are here illegally, even if they didn’t work in the U.S. long enough to qualify for Social Security benefits. "," According to the Social Security Administration, the U.S. has similar totalization agreements with other countries including Germany, Switzerland, Belgium, Canada Norway, and the United Kingdom. Critics are hopping mad about a totalization agreement with Mexico.  They say it will cost upwards to one billion dollars to provide Social Security benefits to Mexicans who will qualify.  They say that at a time when the Social Security system is such a focus of concern, it’s not time to grant such benefits to such a large group of foreigners. Supporters say totalization benefits large numbers of Americans too, not just foreigners in the U.S..  One of the problems, according to the Social Security Administration, is that Americans, for example, who have worked in both the U.S. and a foreign country may end up being double taxed for retirement benefits.  Additionally, there are some workers who have worked, for example, for a period of time in the United States then worked for a period of time in a foreign country, but failed to qualify for benefits in either country.  The totalization agreements allow both U.S. and foreign workers to qualify for benefits based on the combined coverage of both countries..  According to the Washington Post, there is an estimated 37,000 Mexicans who worked legally in the United States and paid into Social Security but have not been able to collect their checks.  One of the controversies of totalization is that it may include thousands of foreign workers who were in the U.S. illegally but did pay into Social Security.  Immigration reform in 1996 cut their benefits. Updated 1/21/03 Germany, Switzerland, Belgium, Canada, Norway, and the United Kingdom ","Government"
"Travel Agent Humor from Washington DC-Unproven!","2015-03-17 20:42:37","https://www.truthorfiction.com/travelagent/"," A collection of       hard-to-believe stories about interactions between government       employees and a travel agent in Washington DC. "," There is nothing in this eRumor to give it credibility.  It refers to “a retiring Washington DC travel agent.”   Many of these kinds of lists of alleged crazy conversations in the marketplace are fabricated. ","Government"
"Comparing the backgrounds of the stars versus the politicians-Truth!","2015-03-17 20:42:37","https://www.truthorfiction.com/starsandpols/"," This eRumor criticizes the       stars who have been against the 2003 war in Iraq and lists the       education and accomplishments of the stars compared with some of       those who are making key decisions in Washington. "," The facts in this eRumor appears to be mostly correct as far as we can see. Those supporting or opposed to the war may differ with the opinions expressed. The information about the stars tends to focus on their education and not other accomplishments. Many of them have been successful in business ventures. ","Government"
"NASA Space Pen: a ten-year, $12 million price tab-Fiction!","2015-03-17 20:42:36","https://www.truthorfiction.com/spacepen/"," The message says that the       U.S. National Aeronautics and Space Administration spent ten years       and $12 million developing a pen that writes in zero gravity for use       by astronauts.  The pen will write upside down, underwater, on       almost any surface and is functional at extremely hot and cold       temperatures.  The Russians, however, filled the need for a       space writing instrument by simply using pencils. "," For some people, it’s sport to point out government waste and bureaucratic stupidity, but this story about the space pen won’t provide ammunition for it.  The government did not fund the development of the pen, it did not cost $12 million to perfect, and neither the Americans nor the Russians consider it desirable to use pencils in space.  In fact, both Americans and Russians use the space pen for their flights. The famous space pen, which is still a popular product today, was developed by Paul Fisher the founder of the Fisher pen company.  An engineer who improved ball point technology, he created his “bullet pen” in the 1940’s, which became one of the best-selling pens of the Twentieth Century. Later, he perfected a pen that was sealed with pressure inside of the cartridge that made the ink to flow regardless of gravity.  It also worked in high and low temperature extremes, underwater, and wrote on many kinds of surfaces.  According to the Fisher Pen company, after extensive testing, NASA chose the pen in 1967 for use by Apollo astronauts and it’s been a part of space travel ever since.  The company says it took Fisher about 2 years and $2 million to develop the space pen.  Prior to 1967, there were no pens that worked in space so there were pencils used, but there were concerns about pencil dust floating around the space capsules as well as fears that if the tip of a pencil broke off and drifted into the electronics, there would be problems. ","Government"
"Democratic Origins of Social Security-Fiction!","2015-03-17 20:42:36","https://www.truthorfiction.com/ss-origins/"," The eRumor lists several things about Social Security as it was supposed to have been instituted under the Democratic presidency of Franklin D. Roosevelt: Such as: 1.  That contributions to Social Security were voluntary. 2.  That it would cost only one percent of the first $1,400 of annual income. 3.  That the contributions into Social Security would be tax deductible. 4.  That the money would go into a trust fund dedicated to Social Security and not be used to pay other federal bills. 5.  That annuity payments to retirees would not be taxed. "," Let’s take them one at a time. That participation in the Program would be completely voluntary- Fiction! According to the Social Security Administration (SSA), the Social Security (FICA) contribution is a payroll tax and, like all taxes, has never been voluntary. That the participants would only have to pay 1 % of the first $1,400 of their annual incomes into the Program- Fiction! SSA says the original tax rate was 1% on the employer and the employee on the first $3,000 of annual wages. That the money the participants elected to put into the Program would be deductible from their income for tax purposes each year- Fiction! The 1935 law prevented Social Security contributions from being tax deductible and they never have been. That the money the participants put into the independent “Trust Fund” rather than into the General operating fund, and therefore, would only be used to fund the Social Security Retirement Program, and no other Government program…- Truth! This one gets a little complex. According to the SSA, the way that Social Security is financed has not changed since it was enacted in 1939. Social Security payroll taxes are deposited into The Social Security Trust Fund.  The SSA says that those funds have never been taken out and put into a “general fund.” There was an accounting change in 1968, however, that listed the Trust Fund under something called the “unified budget” along with all other federal programs. In 1990, there was another accounting change that took the Trust Fund out from under that umbrella, but according to the SSA, it was merely a matter of accounting practices, not the function of the fund itself. That the annuity payments to the retirees would never be taxed as income- Fiction! There was no guarantee that Social Security payments would never be taxed. Originally, they were not taxed, but in 1983, Congress passed a law that did include Social Security payments as taxable income. posted 7/06/07 ","Government"
