"X.Title.","X.Date.","X.Url.","X.Rumor.Summary.","X.The.Truth.","category"
"NBA, NFL, or Congress: Guess What Organization Has Most Convictions?- Truth! & Misleading!","2015-03-17 18:06:27","https://www.truthorfiction.com/nba-nfl-congress/"," This email talks about an organization of more than 500 employees that has an array of spouse abusers, bad check artists, failures in business, shoplifters, and other criminals…and asks you to guess what organization it is. It then tells you that it is referring to the United States Congress. Some versions of this eRumor may compare Congress to NBA or NFL. "," TruthOrFiction.com cannot vouch for every allegation in this email, but it is not fabricated. Although the eRumor that is circulated doesn’t say it, these figures come from a series of articles by the website CAPITOL HILL BLUE (www.chblue.com). Also, their research covers both present and past members of Congress, so the email is misleading in leaving the impression that the statistics are referring to the present Congress. They are from the work of Capitol Hill Blue editor Jack Sharp, researcher Marilyn Crosslyn, and private Investigator James Hargill. In the articles, they don’t document every instance of wrongdoing, but they claim to have it. Posted 09/19/14 ","Government"
"Snooping Mosques in U.S. Off Limits to NSA & FBI-Reported to be Truth!","2015-03-17 18:06:27","https://www.truthorfiction.com/nsa-snooping-off-limits-082613/"," This is a forwarded email that alleges that the National Security Agency (NSA) has a policy against spying on mosques in the country. "," The NSA and FBI have a policy not to spy on mosques in the U.S. after the FBI was sued by the Council on Islamic Affairs and the American Civil Liberties Union (ACLU) for “allegedly violating the civil rights of Muslims in Los Angeles by hiring an undercover agent to infiltrate and monitor mosques there.” This according to a June 12, 2013 editorial in the Investors Business Daily . The editorial alleged that prior to the exclusion of mosques “from the otherwise wide domestic spy net the administration has cast, the FBI launched dozens of successful sting operations against homegrown jihadists — inside mosques — and disrupted dozens of plots against the homeland.” TruthOrFiction.Com has contacted the NSA for comment and we are still awaiting a response. Posted 08/26/13 ","Government"
"Senate Passes Bill That Repeals Sodomy Laws in Uniform Military Code of Justice-Truth! But Removed From Final Bill","2015-03-17 18:06:27","https://www.truthorfiction.com/national-defense-appropriations-act2012-sodomy/"," A forwarded email that contains an article that says that the U.S. Senate unanimously approved S. 1867, the National Defense Authorization Act, which has a provision that repeals Article 125 of the Uniform Code of Military Justice.  This is the part of military law that defines and bans sodomy. "," The U.S. Senate approved the National Defense Authorization Act, S. 1867 on December 1, 2011 by of vote of 93 to 7.  There was a provision in the bill that repealed Article 125 of the Uniform Code of Military Justice on page 174 of the bill. It said, “REPEAL OF SODOMY ARTICLE.—Section 925 of such title (article 125 of the Uniform Code of Military Justice) is repealed.” The National Defense Authorization Act of 2012 is a 565 page long and confusing bill, which was sent to a conference committee to work out the differences between the Senate bill S. 1867 and the House Bill, HR-1540 before presenting it to the President for the final step in the legislative process.   That final version of the bill does not contain the repeal of Article 125 of the Uniform Code of Military Justice. Text and status of the bill can be found at the Thomas Library of Congress web site: Click for HR-1540 Another rumor about this bill has been circulating the Internet alleging that it ends the Bill of Rights for citizens in the U.S. Click here for our findings. updated 12/27/11 ","Government"
"Claims About Missouri’s Approach to Illegal Immigration-Truth!","2015-03-17 18:06:27","https://www.truthorfiction.com/missouri-illegal-aliens/"," A viral email alleges that Missouri doesn’t have problems with illegal immigration because state lawmakers have passed a number of bills aimed at cracking down on illegal immigrants. People are asking if Missouri is the smartest state in the nation. "," This eRumor is true and was taken from an editorial written by Republican State Rep. Nita Jane Ayres. It was published by the Ozarks Sentinel on May 13, 2009. The allegation that this state has no undocumented immigrants is fiction. The Missouri General Assembly placed a constitutional referendum on the ballot in 2007 that designated English as the state’s primary language. The state legislature also got a measure signed into law in 2008 that required Missouri Highway State Patrol officers to check the immigration status of people who were pulled over. It’s also true that lawmakers in Missouri have made illegal immigrants ineligible for state-sponsored health care and food stamp programs, according to Legal Services of Missouri. Illegal immigrants are also ineligible for financial aid in Missouri. The eRumor’s claim that there are no illegal immigrants in Missouri is false, but the state does have one of the lowest populations of illegal immigrants in the country. According to 2010 U.S. Census data , there were about 55,000 illegal immigrants in Missouri, which was less than 1 percent of the state’s population. Posted 05/09/14 ","Government"
"National Defense Appropriations Act to End American Bill Of Rights- Unproven!","2015-03-17 18:06:27","https://www.truthorfiction.com/national-defense-appropriations-act2012/"," A rumor is circulating the Internet about the National Defense Appropriations Act of 2012 alleging that its passage effectively ends the Bill of Rights in America. "," The National Defense Appropriations Act of 2012 is real.  It does expand the power of the military in the war against terrorism and one of the provisions of the act is what has prompted controversy about the rights of those who fall under the definition as detainees. On November 30, 2011 the Harvard Law and Policy Review looked at S-1867 , the Senate version of the bill.  Calling the text of the lengthy bill “confusing” the article said that it believed that “the offending part is Sec. 1032 (a), which states that the military ‘shall’ hold a person captured in the course of the war on terror in military custody until the military can determine the person’s disposition under the law of war.”   The article questioned the authority of the military to detain U.S. Citizens over the lack of “territorial limitation on this directive.”  Section 1032 of the bill authorizes the President to prioritize guidance strategies to “deny safe havens to al-Qaeda and its violent extremist affiliates and to strengthen at-risk states.” HR-1540 The National Defense Appropriations Act of 2012 We examined the text of the bill and it affirms the “authority of the armed forces of the united states to detain covered persons pursuant to the authorization for use of military force.”   The text of the bill defines a “covered” person as: (1) A person who planned, authorized, committed, or aided the terrorist attacks that occurred on September 11, 2001, or harbored those responsible for those attacks. (2) A person who was a part of or substantially supported al-Qaeda, the Taliban, or associated forces that are engaged in hostilities against the United States or its coalition partners, including any person who has committed a belligerent act or has directly supported such hostilities in aid of such enemy forces. Bill History and Status: HR-1540-265 is the 565 page National Defense Appropriations Act of 2012 that was introduced on the House of Representatives floor on April 14, 2011.  The bill has forty eight proposed amendments. Govtrack.US, the website that tracks federal legislation, reported that it was passed by Congress on May 26, 2011. The Senate passed its version, S-1867 , on the First of December after some amendments were added to the bill. The bill then went back to House of Representatives to resolve differences between the Senate and the House for final passage on December 14, 2011. According to a December 14, 2011   article in the New York Times ,  President Obama threatened to veto the bill “arguing that provisions would open the door for the military to perform policing functions inside the United States, and that they would infringe on executive branch powers.” On December 31, 2011 President Obama, while vacationing in Hawaii, signed the bill into law . An Adobe PDF copy of the final version of bill can be read by clicking this link to the Library of Congress: HR-1540 PDF Another rumor about this bill has been circulating the Internet alleging that the U.S. Senate passed its version of the bill that repeals Article 125 of the Uniformed Code of Military Justice. Article 125 is the part of military law that defines and bans sodomy. Click here for our findings. updated 01/01/12 ","Government"
"U.S. Government Developing Insect Spy Drones-Truth!","2015-03-17 18:06:27","https://www.truthorfiction.com/mosquito-drone/"," Reports allege that the U.S. government is developing an insect spy drone the size of a mosquito that will be able to capture photos, sound recordings and DNA samples. "," Insect spy drones have been in development by the U.S. military and a number of universities for years, but the extent of the technology’s functionality is unknown. In 2008, the Air Force Research Laboratory set its sights on developing a tiny, armed drone that could be used by U.S. Special Forces to track and terminate “high-value targets,” Wired.com reports . The goal of the project, dubbed “Project Anubis,” was described in the Air Force’s 2008 budget as the development of a small unmanned aerial vehicle (UAV) that “carries sensors, data links and munitions payload to engage time-sensitive fleeting targets in complex environments,” Wired reports. The fate of Project Anubis is unknown, but similar micro drones have been used and tested in the battlefield. U.S. forces in Afghanistan reportedly tested the Black Hornet drone , which is about the size of a hummingbird, in 2013. The Wasp drone, which weighs less than a pound and measures about 28 inches, has also been used by the military. Schools like Harvard, MIT and Norte Dame are developing micro-robotic insect drone technology, too. Harvard’s RoboBees are being developed to pollinate field crops, explore hazardous environments and carryout military surveillance. It appears that insect-sized micro drones may be a reality in the future, but it’s unknown how close we are to that point. Posted 09/25/14 ","Government"
"Oliver North wrote an article that says according to the U.S. Government he is a right wing extremist-Truth!","2015-03-17 18:06:27","https://www.truthorfiction.com/oliver-north-extremist/"," A forwarded email containing an article written by Oliver North that says according to the U.S. government he is an extremist. "," The article was real and written by Oliver North for Human Events on April 17, 2009. Click for Human Events story. North wrote this article in response to an internal report the Department of Homeland Security sent to law enforcement agencies and warning of potential unrest among right wing extremist groups.  The report generated a lot of controversy because it identified potential trouble groups as including veterans, pro-life Christians and third parties.   The news story about the report turned into an eRumor that spread along the internet in mass earlier in April, 2009.  TruthorFiction.com findings are posted at this link: Click here. Oliver North is a retired combat decorated Marine who writes articles for Human Events as well as various conservative internet publications.  North also serves as host for the “War Stories with Oliver North” program on the Fox News Network. updated 04/27/09 ","Government"
"Warnings about HB-3200: Medicare at 76Fiction!","2015-03-17 18:06:27","https://www.truthorfiction.com/hb-3200-obamacare/"," A viral email claims that the Affordable Care or Obamacare makes changes to Medicare at 76 that will end coverage of cancer treatments. "," Rumors about changes to Medicare at 76 are false. These rumors have been circulating since 2009 in an email with the subject line “Medicare changes at 76 years of age – The Care Bill HB3200.” But the legislation cited in the email — H.R. 3200, the America’s Affordable Health Choices Act — is different than the Affordable Care Act (aka Obamacare). H.R. 3200 was introduced in July 2009, and it has since died. Besides that, nowhere in text of the bill does it say that cancer treatment coverage would be denied for Medicare beneficiaries older than 76. The section of the bill cited in the email outlines a study on whether cancer care costs more at certain classes of hospitals than others. Given that the email cites the wrong bill and makes false claims about that bill, we’re calling this one fiction. Posted 4/2/2013 Updated 5/24/16 ","Government"
"Anonymous Report From a Presidential Town Hall Meeting in Montana – Truth! and Unproven!","2015-03-17 18:06:27","https://www.truthorfiction.com/montana-town-hall/"," A anonymous account of President Obama’s town hall meeting in Belgrade, Montana, a small town near Bozeman.  The email criticizes many aspects of the meeting including the meeting location, ticket distribution, pre-selection of attendees and the handling of the questions from the press.  It also says that thousands of dollars of lobsters were shipped into feed those in attendance and fights broke out  between union members and protesters. "," This email presents a couple of problems when trying to verify it. One is that, like many forwarded emails, the identity of the originator is not known. The other is that although there are some facts to check out, the email reflects the observations and opinions of the writer. Here are the known facts: President Obama was in Belgrade, Montana on August 14, 2009 in a Town Hall Meeting to discuss health care reform.  The meeting was conducted in a hangar at Gallatin Field Airport in Belgrade. According to published reports of the meeting, there were demonstrators at the site representing both supporters and critics of the president and health care reform.  An August 14, 2009 article by the Associated Press reported a “brief shoving match between supporters and critics of Obama and the Democrats’ health care proposals.” Click for article. We’re still checking on some of the other charges in the email such as lobster being flown in for the event instead of locally-grown beef. update 08/24/09 ","Government"
"California City Goes Broke Because it is a Sanctuary for Illegal Aliens-Unproven!","2015-03-17 18:06:26","https://www.truthorfiction.com/maywood-california-broke/"," This is a forwarded article about the City of Maywood in California by radio talk show host Roger Hedgecock.   Hedgecock describes the  town’s history as being one of financial problems, scandals and corruption.  He alleges that the town’s population is 97% Hispanic, 40% of which is undocumented and that it has become a sanctuary for illegal aliens.  The article says that the town went broke, the Maywood Police Department has been dismantled, city employees were let go and only the the town council and city managers remained on the payroll. "," It is not known if the financial problems of the city of Maywood, Ca resulted from illegal aliens but the town is in the process of restructuring, according to an official statement on their web site . Roger Hedgecock’s article is real and appeared in the conservative newspaper, Human Events on June 26, 2010.  Hedgecock is the former mayor of San Diego and a veteran broadcaster who currently hosts a nationally syndicated radio political talk show. Click for original text of the article. According to a July 2, 2010 Los Angeles Times article , the city of Maywood had to let go of 100 employees and disbanded its 86-year-old Police Department.  The duties of law enforcement were handed over to the Los Angels County Sheriffs department.  City managers said that they were unable to obtain insurance citing past lawsuits, many involving the Maywood Police Department.  At this time the city manager, city attorney and elected officials are the only ones left on the payroll and the operation of the city services are being handled by a neighboring city, Bell. Maywood  is the third smallest city in Los Angeles County, has a population estimated by the Los Angeles Times of close to 40,000.  It is located just South of East Los Angeles near the Commerce area. This is not the first time that the city of Maywood has been in the news over immigration in the US.  In 2006, the city passed a resolution opposing a tough Congressional immigration bill. updated 07/06/10 ","Government"
"2015 Rates for Medicare Part A, Part B Withheld-Fiction!","2015-03-17 18:06:26","https://www.truthorfiction.com/medicare-ratebook-2015/"," Rates for Medicare Part A and Part B were withheld from the 2015 Medicare Handbook and won’t be released until after the 2014 midterm elections. "," It’s true that 2015 Medicare Handbooks do not include rates for Medicare Part A and Part B, but the rates are available online. The “Medicare & You 2015” handbook was released by the Centers for Medicare and Medicaid Services (CMS) on September 1, 2014. The handbook does in fact state that premiums and deductable amounts for Medicare Part A and Part B were unavailable at the time of printing and provides a 1-800 number to call for up-to-date information. The rate and premium information for Medicare Part A and Part B are both available at Medicare.gov . Users will actually pay less for Medicare Part A in 2015 than they did in 2014. Premiums and deductibles for Medicare Part B, meanwhile, will not change in 2015. Click HERE for information about signing up for Medicare Part A or Part B. Posted ","Government"
"First Lady Michelle Obama has a larger staff than previous first ladies-Fiction!","2015-03-17 18:06:26","https://www.truthorfiction.com/michelle-obama-staff/"," This is an email that contains a list of 22 staff members under First Lady Michelle Obama along with their salaries.  The email alleges that  “There has never been anyone in the White House at any time that has created such an army of staffers whose sole duties are the facilitation of the First Lady’s social life.”  It also says that former First Lady Hillary Clinton had three, Jackie Kennedy had one and Laura Bush only had one staff member. "," The allegations that former first ladies from previous administrations had smaller staffs is Fiction! – at least in the cases of Laura Bush and Hillary Clinton. On July 1, 2009 the White House released a 29 Page long ANNUAL REPORT TO CONGRESS ON WHITE HOUSE OFFICE STAFF . This report in Adobe PDF format can be found on the Executive Mansion website: Click for report. From it, TruthorFiction.com confirmed the following staff members, job titles as they appeared in the report and annual salaries.  Please note that some of the below job titles do not indicate clearly if they are directly under the President or the First Lady : Sher,  Susan              Assistant To The President and Chief of Staff to the First Lady 172,200 Frye, Jocelyn C          Deputy Assistant to the President and Director of Policy and Projects For the Fist Lady     140,000 Rogers, Desiree G.     Special Assistant to the President and White House Social Secretary 113,000 Johnston, Camille Y.   Special Assistant to the President and Director of Communications for the First Lady    102,000 Winter, Melissa E.      Special Assistant to the President and Deputy Chief Of Staff to the First Lady   102,000 Medina, David S.         Deputy Chief Of Staff to the First Lady   90,000 Lelyveld, Catherine M.  Director and Press Secretary to the First Lady  84,000 Starkey, Frances M.    Director of Scheduling and Advance for the First Lady  75,000 Sanders, Trooper         Deputy Director of Policy and Projects for the First Lady  70,000 Burnough, Erinn J.       Deputy Director and Deputy Social Secretary    65,000 Reinstein, Joseph B.    Deputy Director and Deputy Social Secretary 65,000 Goodman, Jennifer R.   Deputy Director of Scheduling and Events Coordinator For The First Lady  62.000 Fitts, Alan O.              Deputy Director of Advance and Trip Director for the First Lady   60,000 Lewis, Dana M.           Special Assistant and Personal Aide to the First Lady    60,000 Mustaphi, Semonti M.  Associate Director and Deputy Press Secretary To The First Lady   52,500 Jarvis, Kristen E.         Special Assistant for Scheduling and Traveling Aide To The First Lady   50,000 Lechtenberg, Tyler A.   Associate Director of Correspondence For The First Lady    45,000 Tubman, Samantha      Deputy Associate Director  45,000 Boswell, Joseph J.       Executive Assistant to the Chief Of Staff to the First Lady    $40,000 Armbruster, Sally M.    Staff Assistant to the Social Secretary   36,000 Bookey, Natalie          Staff Assistant    $36,000 Jackson, Deilia A.       Deputy Associate Director of Correspondence for the First Lady   36,000 First Ladies of the White House have no official job description. In an October 25, 2004 PBS program former First Lady Laura Bush said , “It’s not an office; you’re not elected to it.”     In the same transcript, former First Lady Hillary Clinton called it a vicarious role. The White House Museum has a First Lady page with photos with descriptions of former First Ladies meeting with staff members.  Nancy Reagan, Laura Bush  showing a variation in numbers that would conflict with the numbers indicated by Williams’ blog. The museum page said that former first lady Hillary Clinton had a staff of twenty in addition to fifteen interns and volunteers. The museum also said that Eleanor Roosevelt had two staff members, Malvina Thompson and social secretary Edith Helm. Click for White House Museum First Lady Page. Most of the substance of this eRumor appears in a blog on the web site of Dr. Paul L. Williams , Thelastcrusade.org. Williams told TruthorFiction.com that the last paragraph of the forwarded email was added by some unknown author who inserted his own opinion then forwarded the article as though his contribution was a part of the original. The original unchanged version can be found at: William’s blog The Last Crusade web site, according to its self description is a place for visitors to “engage in the life and death struggle against the forces of Islam, apostasy, moral complacency, cultural relativity, and the New World Order.”     Also, it says that they  ” abhor the teachings of such spineless and heretical pseudo-Christians as Robert Schuller, Rick Warren, and Joel Osteen.” Dr. Paul L. Williams, according to his web site bio was a former pastor a the Saint Paul’s United Church of Christ in Taylor, PA who vacated his position “because the denomination was spiritually bankrupt.” updated 08/07/09 ","Government"
"72 people Killed Resisting Gun Confiscation in Massachusetts -Truth! If the date was April 20, 1775","2015-03-17 18:06:26","https://www.truthorfiction.com/72-people-killed-ma/"," This is a very authentic looking article alleging that 72 people were killed and more than 200 others were injured while the National guard confiscated a cache of recently banned assault weapons.  Emails of concern have gone viral warning that the U.S. Government is after our guns. "," One must read the entire article to understand that this was written about an account called the “Gunpowder Incident” that occurred in 1775 while Americans were struggling to gain independence from England. This according to the Revolutionary War and Beyond website. Some facts were cleverly omitted from the eRumor to make it appear as though the incident took place in modern time.  General Thomas Gage was the Royal Governor of Massachusetts in 1775.   He confiscated the gunpowder supply of the American colonials, not “military-style assault weapons.”   The only firearms that were in use back then were muzzle loaded black powder flintlocks. We have highlighted the punch line in red in the example of the eRumor. Posted 03/11/14 ","Government"
