"X.Title.","X.Date.","X.Url.","X.Rumor.Summary.","X.The.Truth.","category"
"President Obama Promised Flexibility to Russia-Truth!","2016-12-13 14:21:49","https://www.truthorfiction.com/president-obama-promised-flexibility-russia/"," Amid rumors about Russian hackers meddling in U.S. elections, reports have gone viral from 2012 about President Obama pledging “more flexibility” to Russia. "," It’s true that President Obama told then-Russian President Dmitri A. Medvedev that he would have “more flexibility” to negotiate missile defense after the November 2012 election. Despite those assurances, however, Obama was never able to negotiate a European missile defense deal that Russia approved of, and that has contributed to current tensions between the two nations. A hot microphone captured the exchange between Obama and Russia’s former president in March 2012 after the leaders met about a U.S. missile defense system in Europe in South Korea, the New York Times reports: Mr. Obama’s Republican adversaries seized on the comment, which followed a meeting between Mr. Obama and Mr. Medvedev in Seoul, South Korea, where both had struggled to find common ground amid strong objections in Russia to the American plans for a missile defense system based in Europe. As a pool of television journalists gathered for a news conference on the leaders’ meeting, Mr. Obama leaned in to deliver private assurances to Mr. Medvedev. But speaking inadvertently into an open microphone, he offered a frank assessment of the difficulty of reaching a deal — on this or any other subject — in an election year. “On all these issues, but particularly missile defense, this can be solved, but it’s important for him to give me space,” Mr. Obama could be heard saying to Mr. Medvedev, according a reporter from ABC News, who was traveling with the president. “Yeah, I understand,” the departing Russian president said. “I understand your message about space. Space for you … .” Mr. Obama then elaborated in a portion of the exchange picked up by the cameras: “This is my last election. After my election I have more flexibility.” “I understand. I will transmit this information to Vladimir,” Mr. Medvedev said, referring to Prime Minister Vladimir V. Putin, who just won an election to succeed Mr. Medvedev. A video clip of the exchange can be viewed here: The flap was over the Obama administration’s “ European Phased Adaptive Approach” (EPAA) to missile defense in Europe to augment defense “against prospective longer-range ballistic missiles from Iran,” the Brookings Institution reports: Initially, the Russians seemed to see the EPAA as less of a threat than the Bush administration plan that it replaced. The Russians agreed at the end of 2010 to explore a cooperative missile defense arrangement with NATO. In 2011, however, Russian officials attached priority to securing from Washington a “legal guarantee” that U.S. missile defenses would not be directed against Russian strategic ballistic missiles, accompanied by a series of constraints. The Obama administration has offered a political assurance on this but could not agree to a legal guarantee. Republican support for missile defense and op- position to any treaty limits on it would mean that a treaty could not obtain the two-thirds majority necessary for Senate ratification. Moscow nevertheless has held to its insistence. The mix of motives that underlies the Russian approach to missile defense and possible cooperation with NATO is not entirely clear but likely includes: concern that later phases of the EPAA or subsequent developments will threaten Russian strategic ballistic missiles; Ministry of Defense reluctance in principle to engage in a cooperative effort; opposition to U.S. military infrastructure on the territory of countries that joined NATO in or after 1999; and a desire to drive wedges within NATO. Finally, Moscow may be in a holding pattern on missile defense, as it is on nuclear arms control issues, until it sees who wins the November U.S. presidential election. Ultimately, the Obama administration couldn’t secure an agreement for the missile defense shield that satisfied Republicans in Congress and the Kremlin, and the deal stalled. In May 2016, however, the U.S. launched its European missile defense shield (under control of NATO) launched — with staunch opposition from Russia, CNN reports: “From the very outset we kept saying that in the opinion of our experts the deployment of an anti-missile defense poses a threat to Russia,” Russian presidential spokesman Dmitry Peskov said, according to the Tass News Agency. “The question is not whether measures will be taken or not; measures are being taken to maintain Russia’s security at the necessary level.” Russia believes the missile defense system breaches a 1987 agreement it signed with the U.S. In October, at a meeting of the meeting of the Valdai International Discussion Club in Russia, Russian President Vladimir accused the U.S. of “lying” about a “hypothetical Iranian threat, which never existed” and called the system “an attempt to destroy the strategic balance.” The 2012 exchange between Obama and Medvedev was trudged up again after widespread reports that hackers working under the direction of Vladimir Putin leaked hacked emails to influence the 2016 election in Donald Trump’s favor. However, Obama was never able to negotiate a European missile defense deal that Russia agreed with, and that has contributed to current tensions between the two countries. While it’s true that Obama promised “more flexibility” to Russians in 2012, that never materialized in a deal Russia approved of. ","Government"
"NYC Mayor Bill De Blasio Headed to Jail for Issuing Fake IDs-Mostly Fiction!","2016-12-08 08:21:30","https://www.truthorfiction.com/nyc-mayor-bill-de-blasio-headed-jail-issuing-fake-ids/"," New York City Mayor Bill De blasio is headed to jail for supplying fake IDs to illegal or undocumented immigrants. "," Reports that NYC Mayor Bill De Blasio is headed to jail for issuing fake IDs to illegal immigrants are false. The rumor appears to have started at the Conservative Daily Post website with a story that appeared under the clickbait headline “NYC Mayor Bill De Blasio Headed to Jail for Supplying Fake IDs” that doesn’t actually back up that claim. Instead, the article argues in favor of voter ID laws and concludes that De Blasio has “problems” with the Trump Administration over a New York law that supposedly supplied “fake” IDs “to illegals” that will now be destroyed to avoid prosecution under a Republican president: Let’s take stock: not only is De Blasio and much of the New York political establishment guilty of potentially thousands of felony counts for issuing these I.D.’s, but they will be guilty of thousands more if they destroy them! A classic catch-22. Not surprisingly, the NYC City Council member who wrote the illegal I.D. law, Carlos Menchaca, has admitted that the law was written to allow for the destruction of the I.D.s (even though allowing that is illegal). “Protecting it from a possible Republican president was just one of the reasons” for the provision to destroy the I.D.’s, Menchaca said. This is a devastating admission by Menchaca [email him], because it provides evidence of intent in any investigation. The new Attorney General, Jeff Sessions, “now has all the evidence he needs to charge NYC and its employees with multiple violations of Federal law.” Again, that doesn’t back up the article’s “breaking” claim that De Blasio is “headed to jail.” And the article used a 2013 photo of De Blasio getting arrested for civil disobedience while protesting with a nurses union to further mislead readers. The article refers to New York City’s IDNYC program . DeBlasio launched the initiative, which allows all New Yorkers over the age of 14 to apply for an ID card, in 2015. The card can be used to access city programs and services, and in interactions with police: IDNYC is the new, free identification card for all New York City residents, which gives all of us the opportunity to show who we are—New Yorkers. As a government-issued photo identification card, IDNYC secures the peace of mind and access to City services that come from having recognized identification. IDNYC benefits every city resident, including the most vulnerable communities—the homeless, youth, the elderly, undocumented immigrants, the formerly incarcerated and others who may have difficulty obtaining other government-issued ID. IDNYC cardholders can access services and programs offered by the City as well as by businesses. IDNYC helps enhance public safety, by serving as a recognized ID for interacting with NYPD. It also helps New Yorkers gain access to all City buildings that provide services to the public and is accepted as a form of identification for accessing numerous City programs and services. IDNYC also provides a dynamic series of benefits to cardholders, including a free one-year membership at many of the City’s leading museums, zoos, concert halls, and botanical gardens. The idea that New York City officials could erase or destroy data from the IDNYC program emerged after President-elect Donald Trump won the presidency on a platform that promised to deport millions of illegal immigrants. Fox News reported that New York City officials were considering erasing data over concerns that it would make it easier for the federal government to track down and deport illegal immigrants who registered: Alberto Saldivia got his “IDNYC” card this year after spending 15 years in the country without legal authorization. “It did cause me considerable concern, because they have my information, also the information of my son,” the 53-year-old Mexico native said through an interpreter. But he felt reassured when Mayor Bill de Blasio said last week that the city would “absolutely” safeguard cardholders’ identities. De Blasio, a Democrat, said officials would assess whether to delete the personal records, a provision that was built into the program partly over concerns about the possible election of a Republican president such as Trump, whose campaign promises included a vow to deport millions of people in the U.S. illegally. Municipal ID programs began in 2007 in New Haven, Conn., and have expanded to about 10 cities, including Los Angeles and San Francisco. New York’s program is the most ambitious, with more than 800,000 cardholders, many of them U.S. citizens or legal residents. So claims made in the Conservative Daily Post article are at least grounded in fact. But there’s been no indication that there’s anything criminal about De Blasio’s ID program, and he definitely is not currently “headed to jail” as the article claims. That’s why we’re calling this one mostly fiction. ","Government"
"A General Mattis Christmas Story-Truth!","2016-12-05 09:06:53","https://www.truthorfiction.com/general-mattis-christmas-story/"," A commentary making the rounds titled “A General Mattis Christmas Story” tells about how President-elect Donald Trump’s pick to serve as Secretary of Defense, Gen. James “Mad Dog” Mattis personally filled in for an officer on duty so the officer could spend Christmas Day with his young family. "," “A General Mattis Christmas Story” has been correctly attributed to Dr. Albert C. Pierce, the director of the Center for the Study of Professional Military Ethics at the United States Military Academy. Pierce recounted the “General Mattis Christmas Story” story while introducing Gen. James “Mad Dog” Mattis before a lecture titled “Ethical Challenges in Contemporary Conflict: The Afghanistan and Iraq Classes” at the United States Naval Academy in the spring of 2006. An archived recording of Pierce’s introduction can be heard here . Peirce’s General Mattis Christmas Story was a retelling of a story told by Gen. Charles Kruliak. Kruliak and his wife made and delivered hundreds of Christmas cookies to Marine guard posts in the Washington-Annapolis-Baltimore area each Christmas. One year, while making a cookie delivery to Quantico, Kruliak asked was surprised to find Mattis filling in for the officer in comamnd: …General Krulak said that General Mattis came in, in a duty uniform with a sword, and General Krulak said, “Jim, what are you doing here on Christmas Day? Why do you have duty?” General Mattis told him that the young officer who was scheduled to have duty on Christmas Day had a family, and General Mattis decided it was better for the young officer to spend Christmas Day with his family, and so he chose to have duty on Christmas Day… The General Mattis Christmas story has been circulating in forum posts and forwarded emails as far back as 2010 — but it resurfaced in 2016 after President-elect Trump announced that he would nominate Mattis to serve as secretary of defense. ","Government"
"Donald Trump Invested in Carrier Parent Company-Mostly Truth!","2016-12-05 08:20:46","https://www.truthorfiction.com/trump-invested-carrier-parent-company/"," Carrier received a so-called government handout under the guise of keeping manufacturing jobs in America because President-elect Donald Trump is invested in Carrier’s parent company. "," Donald Trump had $100,000 to $250,000 invested in Carrier’s parent company, United Technologies Corp., in 2014 — but it’s not clear whether or not he still does. Trump’s investments in Carrier’s parent company became a sticking point after Trump negotiated with the company to prevent the company from moving some American manufacturing jobs to Mexico in exchange for tax incentives. The Wall Street Journal reports that Trump promised Carrier’s parent company $7 million in tax breaks in exchange for keeping an undetermined number of jobs at plants in Indiana. It was first reported that the deal would save 2,100 jobs, and then 1,100 jobs, that were threatened, but Forbes reports that the actual number of saved jobs is less because some were white collar jobs that were never in jeopardy: The initial claim for the negotiations that Trump held with Carrier was that 1,100 jobs would be saved. That was already far from the 2,100 jobs supposedly threatened. The full total saved, however, was smaller because 300 of the jobs were white-collar positions that were never going to be relocated. The total number of jobs saved was 800, or about 44 percent of the total 1,800 that would otherwise have been lost. Far from all the jobs were saved, although it still means many people would keep working. But at what cost? Because the $7 million in tax breaks will be paid out over 10 years at a cost of $700,000 per year, the government’s cost for the 800 saved jobs would be $875 per worker per year, Forbes continues, “The sum is ridiculously small when comparing labor rates in Mexico. That isn’t enough money to keep a company in the country because labor in Indiana would still be more expensive”: Former Indiana lieutenant governor John Mutz, who sits on the board of the Indiana Economic Development Corporation, told Politico that the driver for the change was more likely fear on the part of Carrier’s parent, United Technologies, that Trump would interfere with part of the $6.7 billion in federal contracts it held. As questions about Trump’s negotiation’s with Carrier’s parent company swirled, the Wall Street Journal reported that Trump had as much as $250,000 invested in Carrier’s parent company as recently as 2014. However, it’s not clear whether Trump still has investments in United Technologies because those disclosure forms are filed annually: WASHINGTON—President-elect Donald Trump in recent years has had an investment of as much as $250,000 in the parent of the company he pushed to shelve plans to move its Indianapolis factory to Mexico. Mr. Trump in 2014 owned an investment between $100,001 and $250,000 in United Technologies Corp., according to financial disclosure forms filed during the presidential campaign. It couldn’t be learned whether he still had a financial investment in the company because disclosure forms are filed only annually. Mr. Trump’s 2015 disclosure is the most recent one available and was filed in May 2016. The Trump transition team didn’t respond to requests for comment. His 2015 form showed he owned one or more corporate bonds issued by United Technologies. The bond investment, held in a brokerage account through a Deutsche Bank AG unit, paid between $2,501 and $5,000 in interest for the year, the form said, but it valued the investment at between nothing and $1,000. His 2014 financial form for 2014 indicated he held an investment in United Technologies in the same account that paid interest in the same range, with a value between $100,001 and $250,000. It isn’t clear what happened to the investment between 2014 and 2015. Mr. Trump didn’t indicate on the form that he had sold the investment and he didn’t appear to report capital gains for such a sale. So, while it’s true that Trump held a bond investment in Carrier’s parent company that paid out as much as $5,000 as recently as 2014, but it’s not clear whether he still held them at the time of his negotiations with the company. ","Government"
"25th Amendment Could End Trump Presidency-Truth!","2016-12-01 08:32:06","https://www.truthorfiction.com/25th-amendment-end-trump-presidency/"," Congress could use a little known provision of the 25th Amendment to prevent Donald Trump from taking office, or to cut his term in office short, by declaring him “unfit” for the presidency. "," It’s true that President-elect Donald Trump’s cabinet or Congress could exercise a section of the 25th amendment to declare him unable to discharge his duties and effectively end his presidency. The Hill first reported on the 25th Amendment ending a (then potential) Trump presidency back in August after he appeared to encourage Russian hackers to steal emails from Hillary Clinton’s time as secretary of state: The 25th Amendment was ratified in 1967, as a clarification to Article II, Section 1, Clause 6 of the U.S. Constitution. The 25th Amendment deals with the succession of the Presidency, especially at a time when the sitting President becomes unable, incapable or unfit to perform the duties of his or her office. It also establishes procedures to fill a vacancy left by the Vice President. It is essentially a safeguard against a president who runs amuck, or who goes insane, or who cannot fulfill his or her duties as commander and chief and leader of the union of 50 states. Specifically, Article II, Section IV of the 25th Amendmen t outlines a process for “a majority of executive departments” or “such other body as Congress” could basically declare the president unfit to hold office: Whenever the Vice President and a majority of either the principal officers of the executive departments or of such other body as Congress may by law provide, transmit to the President pro tempore of the Senate and the Speaker of the House of Representatives their written declaration that the President is unable to discharge the powers and duties of his office, the Vice President shall immediately assume the powers and duties of the office as Acting President. Under that scenario, the president could then submit in writing to Congress that “no inability exists” and “he shall resume the powers and duties of his office” unless “principal officers of the executive department” submit a written declaration that the president is unable to discharge his duties. Then, Congress would have the last say on the issue: Thereupon Congress shall decide the issue, assembling within forty-eight hours for that purpose if not in session. If the Congress, within twenty-one days after receipt of the latter written declaration, or, if Congress is not in session, within twenty-one days after Congress is required to assemble, determines by two-thirds vote of both Houses that the President is unable to discharge the powers and duties of his office, the Vice President shall continue to discharge the same as Acting President; otherwise, the President shall resume the powers and duties of his office. So, it’s true that Trump’s cabinet or Congress could cut short his time in office by declaring him unfit to discharge his duties. However, claims that the 25th Amendment could prevent a Trump presidency from happening at all seem shaky given that the 25th Amendment refers only to a sitting president, not a president-elect. ","Government"
