10 Things to Know About Slender Man	http://urbanlegends.about.com/od/horrors/tp/10-Things-to-Know-About-Slender-Man.htm	horrors
The 13 Creepiest Tales to Tell Around a Campfire	http://urbanlegends.about.com/od/horrors/ss/Campfire-Tales.htm	horrors
About Those Alligators in the Sewers...	http://urbanlegends.about.com/od/alligators/a/sewer_gators.htm	horrors
Who's Calling You from 999-999-9999? Are You Sure You Want to Know?	http://urbanlegends.about.com/b/2005/11/21/the-phone-call-of-death-999-999-9999.htm	horrors
"Aren't You Glad You Didn't Turn on the Light?"	http://urbanlegends.about.com/od/horrors/a/turn_on_light.htm	horrors
Did a Woman Really Lick Cockroach Eggs off an Envelope?	http://urbanlegends.about.com/od/cockroaches/a/fear_of_licking.htm	horrors
Should You Watch Out for Spiders Hiding in Your Toilet?	http://urbanlegends.about.com/od/spiders/a/butt_spider.htm	horrors
Do You Know What Happens When You Mess with Bloody Mary?	http://urbanlegends.about.com/od/horrors/a/bloody_mary.htm	horrors
The Babysitter and the Man Upstairs	http://urbanlegends.about.com/od/horrors/a/The-Babysitter-And-The-Man-Upstairs.htm	horrors
One Dead Body Under the Mattress Can Spoil Your Whole Honeymoon!	http://urbanlegends.about.com/od/crime/a/body_in_bed.htm	horrors
Scary Stuff: The Legend of the Hanging Boyfriend	http://urbanlegends.about.com/od/horrors/a/boyfriend_death.htm	horrors
Is This What a Brown Recluse Spider Bite Looks Like?	http://urbanlegends.about.com/od/spiders/ss/brown_recluse_spider_bite.htm	horrors
What Really Happened to "The Missing Bride"?	http://urbanlegends.about.com/od/classics/a/The-Missing-Bride.htm	horrors
The Terrifying Tale of Bunny Man Bridge	http://urbanlegends.about.com/od/murderers/fl/Bunny-Man-Bridge.htm	horrors
What Really Happened to Carmen Winstead?	http://urbanlegends.about.com/od/ghoststories/a/carmen_winstead.htm	horrors
Do People Really Get Buried Alive?	http://urbanlegends.about.com/od/horrors/a/buried_alive.htm	horrors
Beware of the Killer Clown!	http://urbanlegends.about.com/od/horrors/a/clown_statue.htm	horrors
The Legend of the Cadaver's Arm	http://urbanlegends.about.com/od/horrors/fl/The-Cadaver-Arm.htm	horrors
The Case of the Choking Doberman	http://urbanlegends.about.com/od/dogs/a/chokingdoberman.htm	horrors
"They Hurt Her" - A Cautionary Tale About Bullying	http://urbanlegends.about.com/od/internet-scares/ss/David-Gregory-Death.htm	horrors
Ole Mose the Crocodile Suspected in Demise of Elderly Golfer	http://urbanlegends.about.com/od/animalattacks/fl/Crocodile-Eats-Man.htm	horrors
Could Cannibalism Be Alive and Well in Modern World?	http://urbanlegends.about.com/od/horrors/a/eating_babies.htm	horrors
Watch Doctors Pull a Live Worm Out of This Patient's Eye!	http://urbanlegends.about.com/od/medical/fl/A-Case-of-Eye-Worm.htm	horrors
Did You Hear the One About the Spiders in the Hairdo?	http://urbanlegends.about.com/od/horrors/a/fatal_hairdo.htm	horrors
Did You Hear the One About the Exploding Cactus?	http://urbanlegends.about.com/od/horrors/a/cactus.htm	horrors
Can Tanning Beds Kill?	http://urbanlegends.about.com/od/accidentsmishaps/a/fatal_tan.htm	horrors
Why Do People Think Friday the 13th Is Unlucky?	http://urbanlegends.about.com/cs/historical/a/friday_the_13th.htm	horrors
Was This "Grave Cage" Meant to Keep Zombies in the Ground?	http://urbanlegends.about.com/od/horrors/ss/Grave-Cage.htm	horrors
Beware the Hook Man!	http://urbanlegends.about.com/od/horrors/a/the_hook.htm	horrors
The Hairy-Armed Hitchhiker - An Urban Legend	http://urbanlegends.about.com/od/horrors/a/The-Hairy-Armed-Hitchhiker.htm	horrors
"I Am Teddy" Chain Letter Will Freak You Out (Or Make You Laugh)	http://urbanlegends.about.com/od/horrors/ss/I-Am-Teddy.htm	horrors
2 Jaw-Dropping Versions of a Very Creepy Urban Legend	http://urbanlegends.about.com/od/horrors/a/humans_can_lick.htm	horrors
The Killer in the Backseat	http://urbanlegends.about.com/od/horrors/a/killer_backseat.htm	horrors
Is There a Predator at Tuttle Mall in Columbus?	http://urbanlegends.about.com/od/horrors/a/Another-Close-Call-At-The-Mall.htm	horrors
The Trouble with Good Samaritans	http://urbanlegends.about.com/od/horrors/a/The-Knife-In-The-Briefcase.htm	horrors
The Killer in the Window	http://urbanlegends.about.com/od/horrors/fl/The-Killer-in-the-Window.htm	horrors
The Laundry Room Killer	http://urbanlegends.about.com/od/murderers/fl/The-Laundry-Room-Killer.htm	horrors
They Don't Call Them "Darwin Awards" for Nothing	http://urbanlegends.about.com/od/darwinawards/a/survival_of_the_silliest.htm	horrors
The Sad, Sad Ballad of the Mistletoe Bough	http://urbanlegends.about.com/od/classics/a/The-Mistletoe-Bough.htm	horrors
Chain-Letter Ghost Story About the Little Girl Clarissa	http://urbanlegends.about.com/od/ghoststories/a/Clarissa-Chain-Letter.htm	horrors
Can Necrophiliacs Spread Disease to a Living Person?	http://urbanlegends.about.com/od/sex/a/necrophiliac.htm	horrors
"The Russian Sleep Experiment" Will Keep You Awake at Night	http://urbanlegends.about.com/od/internet-scares/fl/Russian-Sleep-Experiment.htm	horrors
This Girl Literally Wore a "Killer Dress"	http://urbanlegends.about.com/od/horrors/fl/The-Poison-Dress.htm	horrors
Is the "Pet in the Microwave" Urban Legend True?	http://urbanlegends.about.com/od/dogs/a/microwaved_pet.htm	horrors
"Scary Way to Break Up" Chain Letter Haunts the Internet	http://urbanlegends.about.com/od/internet-scares/fl/A-Scary-Way-to-Break-Up.htm	horrors
Psychic Predicts Halloween Campus Massacre	http://urbanlegends.about.com/od/horrors/a/campus_massacre.htm	horrors
Who's Afraid of Slender Man?	http://urbanlegends.about.com/od/horrors/a/The-Slender-Man.htm	horrors
The Necrophilac's Gift	http://urbanlegends.about.com/od/sex/a/necrophiliac.htm	horrors
The Slender Man	http://urbanlegends.about.com/od/horrors/a/The-Slender-Man.htm	horrors
Travel Horror Stories	http://urbanlegends.about.com/od/horrors/ss/Travel-Horror-Stories.htm	horrors
The Roommate's Death	http://urbanlegends.about.com/od/horrors/a/roommate.htm	horrors
Skinned Tom	http://urbanlegends.about.com/od/ghoststories/a/skinned_tom.htm	horrors
Snake Swallows Man!	http://urbanlegends.about.com/od/snakes/ss/Snake-Eats-Man.htm	horrors
The Vanishing Hitchhiker	http://urbanlegends.about.com/od/ghoststories/fl/The-Vanishing-Hitchhiker.htm	horrors
The Stuffed Baby	http://urbanlegends.about.com/od/crime/fl/Drugs-Smuggled-in-a-Dead-Baby.htm	horrors
What Is the Charlie Charlie Challenge?	http://urbanlegends.about.com/od/horrors/fl/Charlie-Charlie-Challenge.htm	horrors
